url,title,publisher,time
https://baomoi.com/bam-nat-quy-hoach-do-thi-co-dau-hieu-loi-ich-nhom-chi-phoi/c/43781704.epi,Băm nát quy hoạch đô thị: Có dấu hiệu 'lợi ích nhóm' chi phối?,Báo VOV,2022-09-21T07:00:00+07:00
https://baomoi.com/thai-nguyen-chung-suc-xay-dung-nong-thon-moi/c/43781885.epi,Thái Nguyên: Chung sức xây dựng Nông thôn mới,Báo Đại Đoàn Kết,2022-09-21T07:00:00+07:00
https://baomoi.com/cuc-hang-khong-tai-khang-dinh-ipp-air-cargo-du-dieu-kien-cap-phep-bay/c/43784036.epi,Cục Hàng không tái khẳng định IPP Air Cargo đủ điều kiện cấp phép bay,Báo Giao Thông,2022-09-21T07:00:00+07:00
https://baomoi.com/xu-huong-phong-khach-hang-dau-ma-ban-nen-thu-trong-nam-2022/c/43184104.epi,Xu hướng phòng khách hàng đầu mà bạn nên thử trong năm 2022,Báo VOV,2022-09-21T06:44:00+07:00
https://baomoi.com/tro-thanh-thi-xa-truoc-nam-2025/c/43781598.epi,Trở thành thị xã trước năm 2025,Đại Biểu Nhân Dân,2022-09-21T06:42:00+07:00
https://baomoi.com/sua-luat-dau-thau-can-bit-lo-hong-sinh-quan-xanh-quan-do/c/43781263.epi,"Sửa Luật Đấu thầu: Cần bịt lỗ hổng sinh 'quân xanh, quân đỏ'",Báo Pháp Luật TP.HCM,2022-09-21T06:38:12+07:00
https://baomoi.com/xu-phat-130-trieu-dong-mot-cong-ty-xay-dung-khong-phep-o-dong-nai/c/43781472.epi,Xử phạt 130 triệu đồng một công ty xây dựng không phép ở Đồng Nai,Báo Nhân Dân,2022-09-21T06:30:00+07:00
https://baomoi.com/hinh-anh-khu-tap-the-cu-o-dong-da-xuong-cap-duoc-dua-vao-dien-cai-tao-dot-1/c/43183749.epi,Hình ảnh khu tập thể cũ ở Đống Đa xuống cấp được đưa vào diện cải tạo đợt 1,Báo VOV,2022-09-21T06:20:00+07:00
https://baomoi.com/nhieu-giai-phap-thu-hoi-no-thue/c/43781382.epi,Nhiều giải pháp thu hồi nợ thuế,Báo Hà Nội Mới,2022-09-21T06:19:00+07:00
https://baomoi.com/thap-thom-song-dat-vanh-dai-3/c/43781235.epi,Thấp thỏm 'sóng' đất Vành đai 3,Báo Đầu Tư Chứng Khoán,2022-09-21T06:18:00+07:00
https://baomoi.com/de-nguoi-dan-bi-thu-hoi-dat-co-cuoc-song-tot-hon/c/43781200.epi,Để người dân bị thu hồi đất có cuộc sống tốt hơn,Báo Pháp Luật TP.HCM,2022-09-21T06:16:00+07:00
https://baomoi.com/tp-hcm-se-co-hinh-mau-chuan-ve-boi-thuong-tai-dinh-cu/c/43781186.epi,"TP.HCM sẽ có hình mẫu chuẩn về bồi thường, tái định cư",Báo Pháp Luật TP.HCM,2022-09-21T06:11:00+07:00
https://baomoi.com/cong-tac-dau-thau-dau-gia-dat-tai-ha-noi-siet-quan-ly-tang-phan-cap/c/43781180.epi,"Công tác đấu thầu, đấu giá đất tại Hà Nội: Siết quản lý, tăng phân cấp",Báo Kinh Tế Đô Thị,2022-09-21T06:09:00+07:00
https://baomoi.com/dinh-gia-dat-sat-voi-gia-tri-thi-truong/c/43781222.epi,Định giá đất sát với giá trị thị trường,Đại Biểu Nhân Dân,2022-09-21T06:09:00+07:00
https://baomoi.com/khach-san-resort-doi-dien-nguy-co-thua-cung/c/43780961.epi,"Khách sạn, resort đối diện nguy cơ thừa cung",Tạp chí Tri Thức Trực Tuyến,2022-09-21T06:15:53+07:00
https://baomoi.com/bo-cong-thuong-kien-quyet-khong-bo-quy-hoach-dia-diem-dien-hat-nhan-ninh-thuan/c/43781009.epi,Bộ Công Thương kiên quyết không bỏ quy hoạch địa điểm điện hạt nhân Ninh Thuận,Báo VietnamNet,2022-09-21T06:00:00+07:00
https://baomoi.com/hai-hoa-trong-loi-ich-giua-nha-nuoc-nguoi-dan-va-nha-dau-tu/c/43781095.epi,"Hài hòa trong lợi ích giữa Nhà nước, người dân và nhà đầu tư",Báo Sài Gòn Giải Phóng,2022-09-21T06:00:00+07:00
https://baomoi.com/nhung-mau-nha-500-trieu-o-nong-thon-dep-me-man-khong-muon-roi-mat/c/43782670.epi,"Những mẫu nhà 500 triệu ở nông thôn đẹp mê mẩn, không muốn rời mắt",Báo VietnamNet,2022-09-21T06:00:00+07:00
https://baomoi.com/kien-truc-su-chia-se-cach-xay-nha-nghi-duong-tuyet-dep-voi-400-trieu-dong/c/43785918.epi,Kiến trúc sư chia sẻ cách xây nhà nghỉ dưỡng tuyệt đẹp với 400 triệu đồng,Báo VietnamNet,2022-09-21T06:00:00+07:00
https://baomoi.com/qua-tai-truong-hoc-noi-lo-cu-trong-nam-hoc-moi-can-thuc-hien-dong-bo-nhieu-giai-phap-bai-cuoi/c/43781140.epi,"Quá tải trường học, nỗi lo cũ trong năm học mới: Cần thực hiện đồng bộ nhiều giải pháp (Bài cuối)",Báo Công An Nhân Dân,2022-09-21T05:59:00+07:00
https://baomoi.com/dat-cum-cong-nghiep-thanh-biet-thu/c/43780986.epi,Đất cụm công nghiệp thành biệt thự,Báo Tiền Phong,2022-09-21T05:57:00+07:00
https://baomoi.com/bao-sggp-to-chuc-toa-dam-gop-y-du-thao-luat-dat-dai-sua-doi-go-rao-can-phat-huy-noi-luc/c/43781051.epi,"Báo SGGP tổ chức tọa đàm 'Góp ý Dự thảo Luật Đất đai (sửa đổi): Gỡ rào cản, phát huy nội lực'",Báo Sài Gòn Giải Phóng,2022-09-21T05:55:00+07:00
https://baomoi.com/nha-3-noi-trong-rong-con-chau-muon-doi-ngheo-doi/c/43780864.epi,Nhà 3 nơi trống rỗng con cháu muôn đời nghèo đói,Tạp chí Gia Đình Việt Nam,2022-09-21T05:30:00+07:00
https://baomoi.com/tuyet-doi-khong-de-nganh-thuy-san-bi-rut-the-do/c/43780844.epi,Tuyệt đối không để ngành thủy sản bị rút 'thẻ đỏ'!,Báo Người Lao Động,2022-09-21T05:07:00+07:00
https://baomoi.com/cu-chi-kien-nghi-thu-hoi-22-du-an-cham-trien-khai/c/43780857.epi,Củ Chi kiến nghị thu hồi 22 dự án chậm triển khai,Báo Pháp Luật TP.HCM,2022-09-21T05:03:00+07:00
https://baomoi.com/kham-pha-4-ngoi-nha-ky-la-tren-the-gioi/c/43780795.epi,Khám phá 4 ngôi nhà 'kỳ lạ' trên thế giới,Báo Phụ Nữ Việt Nam,2022-09-20T23:46:00+07:00
https://baomoi.com/mo-rong-chi-dinh-thau-di-nguoc-muc-tieu-tang-tinh-canh-tranh-minh-bach/c/43780492.epi,"Mở rộng chỉ định thầu đi ngược mục tiêu tăng tính cạnh tranh, minh bạch",Thời báo Tài chính,2022-09-20T23:20:00+07:00
https://baomoi.com/sap-khoi-cong-du-an-duong-vanh-dai-3-thanh-pho-ho-chi-minh/c/43780428.epi,Sắp khởi công Dự án đường Vành đai 3 Thành phố Hồ Chí Minh,Báo Điện tử Đảng cộng sản VN,2022-09-20T23:11:00+07:00
https://baomoi.com/ra-soat-cac-bat-cap-cua-he-thong-thong-tin-dat-dai/c/43184592.epi,Rà soát các bất cập của hệ thống thông tin đất đai,Báo VOV,2022-09-20T22:58:00+07:00
https://baomoi.com/dak-nong-va-binh-phuoc-thong-nhat-huong-tuyen-cao-toc-gia-nghia-chon-thanh/c/43780341.epi,Đắk Nông và Bình Phước thống nhất hướng tuyến cao tốc Gia Nghĩa – Chơn Thành,Báo Xây Dựng,2022-09-20T22:35:00+07:00
https://baomoi.com/lo-gom-co-hung-loi-tu-di-tich-thanh-phe-tich/c/43780336.epi,Lò gốm cổ Hưng Lợi: Từ di tích thành phế tích?,Truyền Hình Quốc Hội Việt Nam,2022-09-20T22:26:00+07:00
https://baomoi.com/sua-luat-co-chong-duoc-quan-xanh-quan-do-thong-thau-tham-nhung-tieu-cuc-trong-dau-thau/c/43783740.epi,"Sửa luật có chống được 'quân xanh, quân đỏ', thông thầu, tham nhũng, tiêu cực trong đấu thầu?",Tạp chí Kinh Tế Sài Gòn,2022-09-20T22:12:34+07:00
https://baomoi.com/ninh-binh-giai-ngan-nhanh-phai-dong-nghia-voi-chat-luong-cong-trinh-tot/c/43780216.epi,Ninh Bình: Giải ngân nhanh phải đồng nghĩa với chất lượng công trình tốt,Thời báo Tài chính,2022-09-20T21:56:00+07:00
https://baomoi.com/ban-quan-ly-rung-phong-ho-bac-khanh-hoa-tim-bien-phap-su-dung-hieu-qua-dat-rung-san-xuat/c/43779982.epi,Ban quản lý rừng phòng hộ Bắc Khánh Hòa: Tìm biện pháp sử dụng hiệu quả đất rừng sản xuất,Báo Khánh Hòa,2022-09-20T21:37:00+07:00
https://baomoi.com/phe-duyet-dau-tu-xay-dung-ha-tang-ky-thuat-khu-tai-dinh-cu-xa-dien-dong/c/43780004.epi,Phê duyệt đầu tư xây dựng hạ tầng kỹ thuật Khu tái định cư xã Diên Đồng,Báo Khánh Hòa,2022-09-20T21:37:00+07:00
https://baomoi.com/tham-tra-chu-truong-chuyen-muc-dich-su-dung-rung-de-thuc-hien-ho-chua-nuoc-ka-to/c/43779896.epi,Thẩm tra chủ trương chuyển mục đích sử dụng rừng để thực hiện hồ chứa nước Ka Tơ,Báo Khánh Hòa,2022-09-20T21:29:00+07:00
https://baomoi.com/ra-soat-tien-do-thuc-hien-ke-hoach-chuyen-doi-so/c/43780051.epi,Rà soát tiến độ thực hiện kế hoạch chuyển đổi số,Báo Khánh Hòa,2022-09-20T21:28:00+07:00
https://baomoi.com/ra-soat-vuong-mac-cua-cac-do-an-quy-hoach/c/43779868.epi,Rà soát vướng mắc của các đồ án quy hoạch,Báo Khánh Hòa,2022-09-20T21:26:00+07:00
https://baomoi.com/tiep-cong-dan-dinh-ky-thang-8/c/43779980.epi,Tiếp công dân định kỳ tháng 8,Báo Khánh Hòa,2022-09-20T21:25:00+07:00
https://baomoi.com/doanh-nghiep-thoa-thuan-boi-thuong-dat-de-lam-du-an-ngay-mot-kho/c/43779937.epi,Doanh nghiệp thỏa thuận bồi thường đất để làm dự án ngày một khó,Tạp chí Kinh Tế Sài Gòn,2022-09-20T21:00:27+07:00
https://baomoi.com/trien-khai-du-an-duong-vanh-dai-4-vung-thu-do/c/43779934.epi,Triển khai Dự án đường Vành đai 4 - vùng Thủ đô,Đài Phát thanh và truyền hình Hà Nội,2022-09-20T20:58:00+07:00
https://baomoi.com/gan-91-4-ngan-ty-dong-dau-tu-2-tuyen-duong-sat-o-dong-nai/c/43780192.epi,"Gần 91,4 ngàn tỷ đồng đầu tư 2 tuyến đường sắt ở Đồng Nai",Báo Đồng Nai,2022-09-20T20:56:00+07:00
https://baomoi.com/ha-tinh-xay-dung-thi-xa-hong-linh-thanh-trung-tam-do-thi-phia-bac-cua-tinh/c/43779931.epi,Hà Tĩnh: Xây dựng thị xã Hồng Lĩnh thành trung tâm đô thị phía Bắc của tỉnh,Báo Xây Dựng,2022-09-20T20:52:00+07:00
https://baomoi.com/thua-thien-hue-dau-tu-hon-250-ti-dong-cho-du-an-xay-dung-tru-so-cdc/c/43779664.epi,Thừa Thiên – Huế: Đầu tư hơn 250 tỉ đồng cho dự án xây dựng trụ sở CDC,Tạp chí Một Thế Giới,2022-09-20T20:47:00+07:00
https://baomoi.com/tap-doan-phuc-son-phai-nop-12-000-ty-dong-tai-du-an-san-bay-nha-trang-cu/c/43779778.epi,Tập đoàn Phúc Sơn phải nộp 12.000 tỷ đồng tại dự án Sân Bay Nha Trang cũ,Tạp chí Doanh Nghiệp Việt Nam,2022-09-20T20:46:00+07:00
https://baomoi.com/quang-binh-phe-duyet-quy-che-quan-ly-quy-hoach-kien-truc-do-thi/c/43779858.epi,"Quảng Bình: Phê duyệt quy chế quản lý quy hoạch, kiến trúc đô thị",Báo Xây Dựng,2022-09-20T20:41:00+07:00
https://baomoi.com/phien-hop-thuong-truc-hdnd-tinh-khanh-hoa-thang-9-2022/c/43779716.epi,Phiên họp Thường trực HĐND tỉnh Khánh Hòa tháng 9-2022,Báo Khánh Hòa,2022-09-20T20:36:00+07:00
https://baomoi.com/loat-du-an-bt-cua-tap-doan-phuc-son-o-khanh-hoa-deu-cham-tien-do/c/43779600.epi,Loạt dự án BT của Tập đoàn Phúc Sơn ở Khánh Hòa đều chậm tiến độ,Báo Công Thương,2022-09-20T20:35:27+07:00
https://baomoi.com/yeu-cau-cong-ty-co-phan-tap-doan-phuc-son-nop-ngan-sach-gan-12-000-ty-dong/c/43779717.epi,Yêu cầu Công ty Cổ phần Tập đoàn Phúc Sơn nộp ngân sách gần 12.000 tỷ đồng,Báo Khánh Hòa,2022-09-20T20:33:00+07:00
https://baomoi.com/can-loai-bo-loi-ich-nhom-trong-quy-hoach-dien/c/43779549.epi,Cần loại bỏ lợi ích nhóm trong quy hoạch điện,Truyền Hình Thông Tấn,2022-09-20T20:30:00+07:00
https://baomoi.com/can-xu-ly-nghiem-vi-pham-tai-du-an-khu-do-thi-moi-mai-pha/c/43779677.epi,Cần xử lý nghiêm vi phạm tại Dự án Khu đô thị mới Mai Pha,Báo Đầu Tư,2022-09-20T20:07:00+07:00
https://baomoi.com/chu-tich-ubnd-tinh-kiem-tra-cac-du-an-dau-tu-du-lich-tai-thi-xa-duc-pho/c/43779245.epi,Chủ tịch UBND tỉnh kiểm tra các dự án đầu tư du lịch tại thị xã Đức Phổ,Báo Quảng Ngãi,2022-09-20T20:02:00+07:00
https://baomoi.com/khanh-hoa-yeu-cau-tap-doan-phuc-son-nop-ngan-sach-gan-12-000-ty-dong/c/43780005.epi,Khánh Hòa yêu cầu Tập đoàn Phúc Sơn nộp ngân sách gần 12.000 tỷ đồng,Tạp chí Người Đưa Tin,2022-09-20T20:00:00+07:00
https://baomoi.com/huyen-phu-xuyen-tiep-tuc-xu-ly-14-41-cong-trinh-vi-pham-tai-xa-phu-tuc/c/43780073.epi,Huyện Phú Xuyên tiếp tục xử lý 14/41 công trình vi phạm tại xã Phú Túc,Báo Kinh Tế Đô Thị,2022-09-20T20:00:00+07:00
https://baomoi.com/soc-trang-dung-chu-truong-xay-cap-tuong-ca-chep-hoa-rong-gay-tranh-cai/c/43779184.epi,Sóc Trăng dừng chủ trương xây cặp tượng cá chép hóa rồng gây tranh cãi,Báo Nhân Dân,2022-09-20T19:45:00+07:00
https://baomoi.com/khanh-hoa-de-nghi-tap-doan-phuc-son-nop-ngan-sach-gan-12-000-ty-dong/c/43779441.epi,Khánh Hòa đề nghị Tập đoàn Phúc Sơn nộp ngân sách gần 12.000 tỷ đồng,Báo Kinh Tế Đô Thị,2022-09-20T19:43:00+07:00
https://baomoi.com/tu-lenh-giao-thong-lam-ro-tien-trinh-nang-doi-san-bay-con-dao/c/43779206.epi,Tư lệnh giao thông làm rõ tiến trình nâng đời sân bay Côn Đảo,Báo Đầu Tư,2022-09-20T19:40:00+07:00
https://baomoi.com/ha-noi-cap-quan-huyen-duoc-to-chuc-moi-thau-du-an-duoi-2-500-ty-dong/c/43779220.epi,"Hà Nội: Cấp quận, huyện được tổ chức mời thầu dự án dưới 2.500 tỷ đồng",Báo Kinh Tế Đô Thị,2022-09-20T19:37:00+07:00
https://baomoi.com/tong-thu-ngan-sach-nha-nuoc-tren-dia-ban-9-thang-tang-21-so-voi-cung-ky/c/43779838.epi,Tổng thu ngân sách nhà nước trên địa bàn 9 tháng tăng 21% so với cùng kỳ,Báo Quảng Ninh,2022-09-20T19:35:14+07:00
https://baomoi.com/hai-phong-kiem-tra-xu-ly-viec-nuoi-ngao-khong-phep-tren-vung-bien/c/43779238.epi,"Hải Phòng: Kiểm tra, xử lý việc nuôi ngao không phép trên vùng biển",Báo Lao Động Thủ Đô,2022-09-20T19:35:00+07:00
https://baomoi.com/ngoi-nha-2-tang-nhin-ngoai-tuong-hien-dai-don-so-ngo-dau-ben-trong-am-cung-day-du-tien-nghi/c/43780135.epi,"Ngôi nhà 2 tầng nhìn ngoài tưởng hiện đại, đơn sơ ngờ đâu bên trong ấm cúng, đầy đủ tiện nghi",Báo Phụ Nữ Việt Nam,2022-09-20T19:31:00+07:00
https://baomoi.com/so-ke-chon-di-ve-cua-sao-viet-sau-giai-nghe/c/43779014.epi,So kè chốn đi về của sao Việt sau giải nghệ,Báo Kiến Thức,2022-09-20T19:30:00+07:00
https://baomoi.com/quan-binh-thanh-tp-hcm-phan-hoi-ve-lum-xum-quanh-1-vu-cuong-che-nha/c/43779075.epi,"Quận Bình Thạnh, TP.HCM phản hồi về 'lùm xùm' quanh 1 vụ cưỡng chế nhà",Báo Pháp Luật TP.HCM,2022-09-20T19:25:10+07:00
https://baomoi.com/phu-quoc-gan-80-biet-thu-xay-tren-dat-cong-phot-lo-chinh-quyen-so-tai/c/43779189.epi,"Phú Quốc: Gần 80 biệt thự xây trên đất công, 'phớt lờ' chính quyền sở tại",Truyền Hình Quốc Hội Việt Nam,2022-09-20T19:22:00+07:00
https://baomoi.com/khan-truong-ra-soat-lai-so-luong-co-so-chan-nuoi-nam-trong-khu-vuc-khong-duoc-phep-chan-nuoi/c/43778936.epi,Khẩn trương rà soát lại số lượng cơ sở chăn nuôi nằm trong khu vực không được phép chăn nuôi,Báo Cần Thơ,2022-09-20T19:10:00+07:00
https://baomoi.com/cho-y-kien-ve-du-an-luat-dau-thau-sua-doi/c/43778852.epi,Cho ý kiến về dự án Luật Đấu thầu (sửa đổi),Truyền Hình Thông Tấn,2022-09-20T19:09:00+07:00
https://baomoi.com/soc-trang-dung-xay-cap-tuong-ca-chep-hoa-rong-15-ty-dong/c/43778941.epi,Sóc Trăng dừng xây cặp tượng 'cá chép hóa rồng' 15 tỷ đồng,Báo Công Lý,2022-09-20T19:21:00+07:00
https://baomoi.com/hoi-dong-nhan-dan-tinh-giam-sat-cong-tac-quan-ly-nha-nuoc-ve-khoang-san-tai-huyen-quy-hop/c/43778973.epi,Hội đồng nhân dân tỉnh giám sát công tác quản lý nhà nước về khoáng sản tại huyện Quỳ Hợp,Báo Nghệ An,2022-09-20T18:58:00+07:00
https://baomoi.com/chu-tich-quoc-hoi-sua-luat-de-xu-ly-quan-xanh-quan-do-trong-dau-thau/c/43778849.epi,"Chủ tịch Quốc hội: Sửa luật để xử lý 'quân xanh, quân đỏ' trong đấu thầu",Báo VTC News,2022-09-20T18:51:00+07:00
https://baomoi.com/ho-tro-phat-trien-1-500-du-an-khoi-nghiep-lap-nghiep/c/43779380.epi,Hỗ trợ phát triển 1.500 dự án khởi nghiệp lập nghiệp,Thời báo Tài chính,2022-09-20T18:51:00+07:00
https://baomoi.com/ra-soat-viec-thuc-hien-cac-du-an-dau-tu-truc-tiep-tai-khu-kinh-te-nghi-son-va-cac-khu-cong-nghiep/c/43779771.epi,Rà soát việc thực hiện các dự án đầu tư trực tiếp tại Khu Kinh tế Nghi Sơn và các Khu công nghiệp,Báo Thanh Hóa,2022-09-20T18:41:00+07:00
https://baomoi.com/chu-tich-quoc-hoi-tieu-cuc-trong-dau-thau-luat-hong-o-dau-va-the-nao/c/43778614.epi,"Chủ tịch Quốc hội: Tiêu cực trong đấu thầu, Luật hổng ở đâu, 'vá' thế nào?",Báo Kinh Tế Đô Thị,2022-09-20T18:23:00+07:00
https://baomoi.com/6-y-tuong-trang-tri-tao-cam-giac-binh-yen-cho-ngoi-nha/c/43778969.epi,6 ý tưởng trang trí tạo cảm giác bình yên cho ngôi nhà,Báo Giáo Dục & Thời Đại,2022-09-20T18:17:00+07:00
https://baomoi.com/mac-1-trong-10-dau-hieu-nay-thi-bat-dong-san-ban-mua-dang-bi-mat-gia/c/43780132.epi,Mắc 1 trong 10 dấu hiệu này thì bất động sản bạn mua đang bị mất giá,Báo Phụ Nữ Việt Nam,2022-09-20T18:12:00+07:00
https://baomoi.com/100-don-vi-no-bao-hiem-xa-hoi-bi-nhac-ten/c/43778261.epi,100 đơn vị nợ bảo hiểm xã hội bị nhắc tên,Báo Kiến Thức,2022-09-20T17:59:51+07:00
https://baomoi.com/lam-dong-xu-ly-dut-diem-vi-pham-hanh-lang-bao-ve-an-toan-cong-trinh-thuy-loi/c/43778332.epi,Lâm Đồng: Xử lý dứt điểm vi phạm hành lang bảo vệ an toàn công trình thủy lợi,Kinh tế Môi trường,2022-09-20T17:55:00+07:00
https://baomoi.com/lanh-dao-tinh-dong-thap-lam-viec-voi-cong-ty-cp-mekong-smart-city/c/43778886.epi,Lãnh đạo tỉnh Đồng Tháp làm việc với Công ty CP Mekong Smart City,Báo Đồng Tháp,2022-09-20T17:55:00+07:00
https://baomoi.com/ha-noi-tong-ket-mo-hinh-doi-quan-ly-trat-tu-xay-dung-do-thi/c/43779219.epi,Hà Nội: Tổng kết mô hình Đội quản lý trật tự xây dựng đô thị,Báo Kinh Tế Đô Thị,2022-09-20T17:55:00+07:00
https://baomoi.com/thieu-nien-bi-canh-sat-duoi-theo-danh-dap-noi-gi/c/43864629.epi,Thiếu niên bị cảnh sát đuổi theo đánh đập nói gì?,Báo VTC News,
https://baomoi.com/vot-chiec-vali-la-troi-noi-tren-song-nguoi-dan-soc-nang-khi-mo-ra/c/43866863.epi,"Vớt chiếc vali 'lạ' trôi nổi trên sông, người dân sốc nặng khi mở ra",Tạp chí SaoStar,2022-09-30T07:00:00+07:00
https://baomoi.com/ket-dau-long-cua-nu-dai-gia-sau-khi-vao-khach-san-voi-huan-luyen-vien-gym/c/43868351.epi,Kết đau lòng của nữ đại gia sau khi vào khách sạn với huấn luyện viên gym,Báo VietnamNet,2022-09-30T09:08:00+07:00
https://baomoi.com/hien-truong-7-thi-the-troi-dat-o-bai-bien-phu-quoc/c/43864061.epi,Hiện trường 7 thi thể trôi dạt ở bãi biển Phú Quốc,Tạp chí Tri Thức Trực Tuyến,
https://baomoi.com/dang-giua-chuyen-bay-vo-phat-hien-chong-chet-tren-ghe-may-bay/c/43864902.epi,"Đang giữa chuyến bay, vợ phát hiện chồng chết trên ghế máy bay",Báo Người Lao Động,
https://baomoi.com/ba-luat-su-bao-chua-cho-ba-nguyen-phuong-hang/c/43866209.epi,Ba luật sư bào chữa cho bà Nguyễn Phương Hằng,Báo Tiền Phong,2022-09-30T05:37:00+07:00
https://baomoi.com/an-mang-dau-long-gia-dinh-tan-nat/c/43864558.epi,"Án mạng đau lòng, gia đình tan nát",Báo Người Lao Động,
https://baomoi.com/day-xe-tang-2-nguoi-dan-ong-bi-dien-giat-tu-vong/c/43864153.epi,"Đẩy xe tang, 2 người đàn ông bị điện giật tử vong",Báo Giao Thông,
https://baomoi.com/ha-noi-chu-so-huu-khu-dat-vang-o-quan-hoang-mai-bi-ngan-hang-rao-ban-no-khung/c/43872056.epi,Hà Nội: Chủ sở hữu khu đất vàng ở quận Hoàng Mai bị ngân hàng rao bán nợ khủng,Báo Infonet,2022-09-30T15:03:00+07:00
https://baomoi.com/bidv-ban-khoan-no-hon-4-900-ty-cua-chu-dau-tu-du-an-kenton-node/c/43849773.epi,BIDV bán khoản nợ hơn 4.900 tỷ của chủ đầu tư dự án Kenton Node,Báo Đại Đoàn Kết,2022-09-28T11:23:00+07:00
https://baomoi.com/bidv-dai-ha-gia-toi-410-ty-dong-khoan-no-4-900-ty-cua-chu-dau-tu-du-an-kenton/c/43825182.epi,BIDV đại hạ giá tới 410 tỷ đồng khoản nợ 4.900 tỷ của chủ đầu tư dự án Kenton,Chuyên trang Vietnamdaily - Báo Tri thức & Cuộc sống,2022-09-26T07:08:00+07:00
https://baomoi.com/nhieu-ngan-hang-giam-gia-ban-tai-san-the-chap-de-thu-hoi-no/c/43801390.epi,Nhiều ngân hàng giảm giá bán tài sản thế chấp để thu hồi nợ,Báo Sài Gòn Giải Phóng,2022-09-23T07:02:00+07:00
https://baomoi.com/nhieu-ngan-hang-rao-ban-tai-san-khung-voi-gia-beo/c/43722360.epi,Nhiều ngân hàng rao bán tài sản 'khủng' với giá bèo,Báo Pháp Luật TP.HCM,2022-09-14T12:01:31+07:00
https://baomoi.com/pho-tong-thong-my-toi-han-quoc-de-tran-an-them-han-gan/c/43861973.epi,"Phó Tổng thống Mỹ tới Hàn Quốc: Để trấn an, thêm hàn gắn",Báo Thế Giới & Việt Nam,
https://baomoi.com/vu-khi-nguy-hiem-doi-voi-eu/c/43858012.epi,'Vũ khí' nguy hiểm đối với EU,Báo Tin Tức TTXVN,
https://baomoi.com/cai-to-hoi-dong-bao-an-lien-hop-quoc-khi-xu-the-cung-chinh-la-diem-nghen/c/43857738.epi,Cải tổ Hội đồng Bảo an Liên hợp quốc: Khi xu thế cũng chính là điểm nghẽn,Báo An Ninh Thế Giới,
https://baomoi.com/van-bai-nang-luong-cua-nga-o-chau-a-trong-boi-canh-xung-dot-ukraine/c/43856483.epi,Ván bài năng lượng của Nga ở châu Á trong bối cảnh xung đột Ukraine,Báo VOV,
https://baomoi.com/ai-duoc-huong-loi-tu-kich-ban-dong-chay-phuong-bac-bi-pha-hoai/c/43854709.epi,Ai được hưởng lợi từ kịch bản Dòng chảy phương Bắc bị phá hoại?,Báo VOV,
https://baomoi.com/tac-dong-toan-cau-sau-khi-fed-tang-lai-suat-len-cao-nhat-tu-nam-2008/c/43851284.epi,Tác động toàn cầu sau khi FED tăng lãi suất lên cao nhất từ năm 2008,Báo Tin Tức TTXVN,
https://baomoi.com/nguoi-phu-nu-khien-ca-chau-au-lo-lang/c/43847833.epi,Người phụ nữ khiến cả châu Âu lo lắng,Tạp chí Tri Thức Trực Tuyến,
https://baomoi.com/chinh-phu-moi-o-italy-se-tac-dong-the-nao-voi-eu-va-cuoc-xung-dot-nga-ukraine/c/43845884.epi,Chính phủ mới ở Italy sẽ tác động thế nào với EU và cuộc xung đột Nga - Ukraine?,Báo Tin Tức TTXVN,
https://baomoi.com/ha-noi-15-du-an-khu-do-thi-moi-thieu-truong-hoc-nha-tre/c/43778700.epi,"Hà Nội: 15 dự án khu đô thị mới thiếu trường học, nhà trẻ",Báo Công An Nhân Dân,2022-09-20T17:48:00+07:00
https://baomoi.com/chu-tich-quoc-hoi-tieu-cuc-trong-dau-thau-thi-luat-hong-o-dau/c/43181171.epi,Chủ tịch Quốc hội: Tiêu cực trong đấu thầu thì luật 'hổng' ở đâu?,Báo VOV,2022-09-20T17:41:00+07:00
https://baomoi.com/quy-hoach-phai-danh-quy-dat-de-phat-trien-cac-du-an-nha-o-xa-hoi/c/43778238.epi,Quy hoạch phải dành quỹ đất để phát triển các dự án nhà ở xã hội,Báo Kinh Tế Đô Thị,2022-09-20T17:38:00+07:00
https://baomoi.com/cach-giau-do-thong-minh-khi-phong-nho-hep/c/43777991.epi,"Cách giấu đồ thông minh khi phòng nhỏ, hẹp",Tạp chí Tri Thức Trực Tuyến,2022-09-20T17:52:31+07:00
https://baomoi.com/xu-phat-cong-ty-xay-dung-hon-6-nghin-m2-san-khong-phep/c/43778699.epi,Xử phạt công ty xây dựng hơn 6 nghìn m2 sàn không phép,Báo Công An Nhân Dân,2022-09-20T17:36:00+07:00
https://baomoi.com/khanh-hoa-thanh-tra-viec-chap-hanh-phap-luat-du-an-muong-thanh-vien-trieu/c/43778224.epi,Khánh Hòa thanh tra việc chấp hành pháp luật dự án Mường Thanh Viễn Triều,Báo Tiền Phong,2022-09-20T17:34:00+07:00
https://baomoi.com/da-nang-phat-trien-cao-tang-vung-trung-tam-thanh-pho-mo-rong/c/43778531.epi,Đà Nẵng phát triển cao tầng vùng trung tâm thành phố mở rộng,Báo Kinh Tế Đô Thị,2022-09-20T17:34:00+07:00
https://baomoi.com/39-du-an-o-cu-chi-trien-khai-cham-doi-von-vi-gia-boi-thuong-thap/c/43777984.epi,"39 dự án ở Củ Chi triển khai chậm, đội vốn vì giá bồi thường thấp",Báo Người Lao Động,2022-09-20T17:31:00+07:00
https://baomoi.com/vinh-phuc-day-nhanh-tien-do-giai-ngan-von-dau-tu-cong/c/43778053.epi,Vĩnh phúc đẩy nhanh tiến độ giải ngân vốn đầu tư công,Tạp chí Công thương,2022-09-20T17:30:00+07:00
https://baomoi.com/quang-ngai-dau-tu-ha-tang-giao-thong-ket-hop-phat-trien-du-lich/c/43777902.epi,Quảng Ngãi: Đầu tư hạ tầng giao thông kết hợp phát triển du lịch,Báo Kinh Tế Đô Thị,2022-09-20T17:28:00+07:00
https://baomoi.com/khanh-hoa-yeu-cau-tap-doan-phuc-son-nop-ngan-sach-gan-12-000-ty-dong/c/43777823.epi,Khánh Hòa yêu cầu Tập đoàn Phúc Sơn nộp ngân sách gần 12.000 tỷ đồng,Tạp chí Tri Thức Trực Tuyến,2022-09-20T17:34:40+07:00
https://baomoi.com/doan-dbqh-tinh-an-giang-tiep-xuc-gap-go-lanh-dao-ubnd-tinh-an-giang-va-cac-so-nganh/c/43783637.epi,"ĐOÀN ĐBQH TỈNH AN GIANG TIẾP XÚC, GẶP GỠ LÃNH ĐẠO UBND TỈNH AN GIANG VÀ CÁC SỞ, NGÀNH",Cổng TTĐT Quốc Hội,2022-09-20T17:19:00+07:00
https://baomoi.com/quang-tri-muon-ap-dung-co-che-dac-thu-trong-xay-dung-duong-giao-thong-nong-thon/c/43777853.epi,Quảng Trị muốn áp dụng cơ chế đặc thù trong xây dựng đường giao thông nông thôn,Tạp Chí Giao Thông Vận Tải,2022-09-20T17:18:00+07:00
https://baomoi.com/soc-trang-tam-dung-chu-truong-xay-dung-tuong-ca-chep-hoa-rong/c/43779124.epi,Sóc Trăng tạm dừng chủ trương xây dựng tượng cá chép hóa rồng,Báo Giáo Dục & Thời Đại,2022-09-20T17:15:00+07:00
https://baomoi.com/ubtv-qh-de-nghi-lam-ro-quy-dinh-ve-quy-chung-khong-chia-trong-luat-htx/c/43777904.epi,UBTV QH đề nghị làm rõ quy định về quỹ chung không chia trong Luật HTX,Tạp chí Mekong Asean,2022-09-20T17:13:00+07:00
