url,title,publisher,time
https://baomoi.com/lam-dong-cham-dut-du-an-thuong-lam-va-trung-bay-ca-phe-cua-cong-ty-trung-nguyen/c/43805669.epi,Lâm Đồng chấm dứt dự án thưởng lãm và trưng bày cà phê của Công ty Trung Nguyên,Báo VietnamNet,2022-09-23T14:18:00+07:00
https://baomoi.com/binh-thuan-thu-hoi-du-an-chan-nuoi-bo-sua-gan-3-000-ty-dong/c/43805490.epi,Bình Thuận: Thu hồi dự án chăn nuôi bò sữa gần 3.000 tỷ đồng,Báo Đầu Tư,2022-09-23T14:05:00+07:00
https://baomoi.com/can-danh-gia-tinh-ben-vung-trong-giam-ngheo-va-xay-dung-nong-thon-moi/c/43805465.epi,Cần đánh giá tính bền vững trong giảm nghèo và xây dựng nông thôn mới,Báo Nhân Dân,2022-09-23T14:04:00+07:00
https://baomoi.com/flc-tu-nguyen-hoan-tra-2-du-an-nghin-ty-o-quang-ngai/c/43805422.epi,FLC tự nguyện hoàn trả 2 dự án nghìn tỷ ở Quảng Ngãi,Báo Tiền Phong,2022-09-23T14:01:00+07:00
https://baomoi.com/chap-thuan-chu-truong-dau-tu-nha-may-pin-lithium-hon-6-329-ty-dong-tai-kkt-vung-ang/c/43805446.epi,Chấp thuận chủ trương đầu tư Nhà máy Pin Lithium hơn 6.329 tỷ đồng tại KKT Vũng Áng,Báo Hà Tĩnh,2022-09-23T14:01:00+07:00
https://baomoi.com/binh-thuan-thu-hoi-du-an-gan-3-000-ty-dong-do-cham-trien-khai/c/43805326.epi,Bình Thuận thu hồi dự án gần 3.000 tỷ đồng do chậm triển khai,Báo VietnamPlus,2022-09-23T13:52:00+07:00
https://baomoi.com/danh-gia-viec-huy-dong-nguon-luc-trien-khai-3-muc-tieu-quoc-gia/c/43805342.epi,Đánh giá việc huy động nguồn lực triển khai 3 mục tiêu quốc gia,Báo VietnamPlus,2022-09-23T13:48:00+07:00
https://baomoi.com/thu-hoi-du-an-trang-trai-kieu-mau-o-binh-thuan-vi-dap-chieu-nhieu-nam/c/43805312.epi,Thu hồi dự án 'trang trại kiểu mẫu' ở Bình Thuận vì đắp chiếu nhiều năm,Báo Pháp Luật TP.HCM,2022-09-23T13:46:13+07:00
https://baomoi.com/binh-thuan-kien-quyet-thu-hoi-du-an-gan-3-000-ty-dong-do-cham-trien-khai/c/43805321.epi,Bình Thuận kiên quyết thu hồi dự án gần 3.000 tỷ đồng do chậm triển khai,Bnews,2022-09-23T13:43:00+07:00
https://baomoi.com/cac-co-so-karaoke-phai-co-loi-thoat-nan-thu-2-moi-duoc-cap-phep/c/43827848.epi,Các cơ sở karaoke phải có lối thoát nạn thứ 2 mới được cấp phép,Báo Pháp Luật & Xã Hội,2022-09-23T13:29:00+07:00
https://baomoi.com/chu-tich-ubnd-tp-tran-sy-thanh-thao-go-xu-ly-ngay-nhieu-van-de-nong-cua-huyen-dong-anh/c/43805323.epi,"Chủ tịch UBND TP Trần Sỹ Thanh: Tháo gỡ, xử lý ngay nhiều vấn đề 'nóng' của huyện Đông Anh",Báo Kinh Tế Đô Thị,2022-09-23T13:16:00+07:00
https://baomoi.com/se-tiep-tuc-that-bai-trong-cai-tao-chung-cu-cu-neu-khong-quy-dinh-thoi-han-so-huu/c/43805198.epi,Sẽ tiếp tục thất bại trong cải tạo chung cư cũ nếu không quy định thời hạn sở hữu,Bnews,2022-09-23T13:04:00+07:00
https://baomoi.com/de-xuat-4-noi-dung-giam-sat-toi-cao-ve-xay-dung-nong-thon-moi-giam-ngheo/c/43805212.epi,"Đề xuất 4 nội dung giám sát tối cao về xây dựng nông thôn mới, giảm nghèo",Báo Kinh Tế Đô Thị,2022-09-23T13:01:00+07:00
https://baomoi.com/tp-cao-lanh-can-thuc-hien-chat-che-cong-tac-quy-hoach-phan-khu-va-chi-tiet/c/43805114.epi,TP Cao Lãnh cần thực hiện chặt chẽ công tác quy hoạch phân khu và chi tiết,Báo Đồng Tháp,2022-09-23T12:57:00+07:00
https://baomoi.com/dbqh-nguyen-thi-suu-can-quy-dinh-so-luong-toi-da-thanh-vien-ban-giam-sat-dau-tu-cua-cong-dong-trong-luat-thuc-hien-dan-chu-o-co-so/c/43805794.epi,ĐBQH NGUYỄN THỊ SỬU: CẦN QUY ĐỊNH SỐ LƯỢNG TỐI ĐA THÀNH VIÊN BAN GIÁM SÁT ĐẦU TƯ CỦA CỘNG ĐỒNG TRONG LUẬT THỰC HIỆN DÂN CHỦ Ở CƠ SỞ,Cổng TTĐT Quốc Hội,2022-09-23T12:39:00+07:00
https://baomoi.com/hoi-thao-khoa-hoc-du-an-mo-sat-thach-khe-ha-tinh-tiep-tuc-hay-dung-khai-thac/c/43804933.epi,Hội thảo khoa học Dự án mỏ sắt Thạch Khê Hà Tĩnh - Tiếp tục hay dừng khai thác?,Báo Công Thương,2022-09-23T12:35:01+07:00
https://baomoi.com/co-dia-phuong-lam-ha-tang-nong-thon-rat-tot-nhung-sau-mot-tran-lu-mat-het/c/43804945.epi,'Có địa phương làm hạ tầng nông thôn rất tốt nhưng sau một trận lũ mất hết',Báo VTC News,2022-09-23T12:29:00+07:00
https://baomoi.com/cu-tri-kien-nghi-tang-cuong-quan-ly-dat-dai/c/43805058.epi,Cử tri kiến nghị tăng cường quản lý đất đai,Báo Hà Nội Mới,2022-09-23T12:11:00+07:00
https://baomoi.com/mong-cai-quang-ninh-canh-cua-dau-tu-mo-rong/c/43804683.epi,Móng Cái (Quảng Ninh): 'Cánh cửa' đầu tư mở rộng,Báo Xây Dựng,2022-09-23T12:05:00+07:00
https://baomoi.com/chu-tich-ubnd-thanh-pho-chi-dao-giai-quyet-36-kien-nghi-de-xuat-cua-huyen-dong-anh/c/43805285.epi,"Chủ tịch UBND thành phố chỉ đạo giải quyết 36 kiến nghị, đề xuất của huyện Đông Anh",Báo Hà Nội Mới,2022-09-23T12:01:00+07:00
https://baomoi.com/du-kien-thang-12-se-chon-xong-nha-thau-thi-cong-quoc-lo-14e/c/43804574.epi,Dự kiến tháng 12 sẽ chọn xong nhà thầu thi công Quốc lộ 14E,Bnews,2022-09-23T11:59:00+07:00
https://baomoi.com/se-chuyen-xe-chuyen-dung-sang-xe-o-to-phuc-vu-cong-tac-chung/c/43805278.epi,Sẽ chuyển xe chuyên dùng sang xe ô tô phục vụ công tác chung,Truyền Hình Quốc Hội Việt Nam,2022-09-23T11:59:00+07:00
https://baomoi.com/chu-tich-ubnd-tp-ha-noi-tran-sy-thanh-chi-dao-thao-go-hang-loat-van-de-nong-tai-huyen-dong-anh/c/43804994.epi,Chủ tịch UBND TP Hà Nội Trần Sỹ Thanh chỉ đạo tháo gỡ hàng loạt vấn đề 'nóng' tại huyện Đông Anh,Báo An Ninh Thủ Đô,2022-09-23T11:56:50+07:00
https://baomoi.com/hon-70-khieu-nai-to-cao-dong-nguoi-lien-quan-thu-hoi-dat/c/43805183.epi,"Hơn 70% khiếu nại, tố cáo đông người liên quan thu hồi đất",Truyền Hình Quốc Hội Việt Nam,2022-09-23T11:54:00+07:00
https://baomoi.com/tao-dong-thuan-trong-giai-phong-mat-bang-phuc-vu-du-an-duong-vanh-dai-4/c/43805214.epi,Tạo đồng thuận trong giải phóng mặt bằng phục vụ dự án đường Vành đai 4,Truyền Hình Quốc Hội Việt Nam,2022-09-23T11:52:00+07:00
https://baomoi.com/di-tich-300-tuoi-o-tp-hcm-thanh-phe-tich/c/43804787.epi,Di tích 300 tuổi ở TP.HCM thành phế tích,Báo VTC News,2022-09-23T11:51:12+07:00
https://baomoi.com/ban-giao-nha-dai-doan-ket-cho-ho-ngheo-o-tx-ky-anh/c/43804548.epi,Bàn giao nhà đại đoàn kết cho hộ nghèo ở TX Kỳ Anh,Báo Hà Tĩnh,2022-09-23T11:49:00+07:00
https://baomoi.com/hai-phong-cam-phao-tieu-khu-vuc-nuoi-trong-thuy-san-khong-phep-tai-huyen-kien-thuy/c/43208597.epi,Hải Phòng cắm phao tiêu khu vực nuôi trồng thủy sản không phép tại huyện Kiến Thụy,Báo VOV,2022-09-23T11:40:00+07:00
https://baomoi.com/chi-150-000-usd-dem-de-ngu-trong-khach-san-5-sao-duoi-day-bien/c/43804457.epi,Chi 150.000 USD/ đêm để… ngủ trong khách sạn 5 sao dưới đáy biển,Báo An Ninh Thế Giới,2022-09-23T11:35:00+07:00
https://baomoi.com/hung-yen-dinh-bui-bong-di-tich-lich-su-quoc-gia-vua-tu-bo-da-xuong-cap/c/43828594.epi,Hưng Yên: Đình Bùi Bồng - Di tích lịch sử quốc gia vừa tu bổ đã xuống cấp,Bảo Vệ Công Lý,2022-09-23T11:50:00+07:00
https://baomoi.com/dat-vang-o-tp-hcm-bi-vinafood-2-thau-tom-lap-du-an-khong-vay-hang-nghin-ty/c/43804390.epi,'Đất vàng' ở TP HCM bị Vinafood 2 thâu tóm: Lập dự án 'khống' vay hàng nghìn tỷ,Chuyên trang Vietnamdaily - Báo Tri thức & Cuộc sống,2022-09-23T11:33:00+07:00
https://baomoi.com/chinh-phu-lap-to-nghien-cuu-them-hai-san-bay-o-bien-hoa-va-ninh-thuan/c/43804329.epi,Chính phủ lập tổ nghiên cứu thêm hai sân bay ở Biên Hòa và Ninh Thuận,Tạp chí Tri Thức Trực Tuyến,2022-09-23T11:47:24+07:00
https://baomoi.com/su-dung-dat-trong-lua-khong-dung-muc-dich-se-bi-xu-phat-the-nao/c/43804879.epi,Sử dụng đất trồng lúa không đúng mục đích sẽ bị xử phạt thế nào?,Đại Biểu Nhân Dân,2022-09-23T11:31:00+07:00
https://baomoi.com/vu-khu-du-lich-xay-chui-giua-rung-o-tt-hue-chu-dau-tu-phot-lo-chi-dao-cua-ubnd-tinh/c/43804317.epi,Vụ khu du lịch xây 'chui' giữa rừng ở TT-Huế: Chủ đầu tư phớt lờ chỉ đạo của UBND tỉnh,Báo Tiền Phong,2022-09-23T11:30:00+07:00
https://baomoi.com/bac-ninh-tiep-xuc-cu-tri-tao-dong-thuan-trong-giai-phong-mat-bang-trien-khai-duong-vanh-dai-4/c/43804593.epi,"BẮC NINH: TIẾP XÚC CỬ TRI - TẠO ĐỒNG THUẬN TRONG GIẢI PHÓNG MẶT BẰNG, TRIỂN KHAI ĐƯỜNG VÀNH ĐAI 4",Cổng TTĐT Quốc Hội,2022-09-23T11:27:00+07:00
https://baomoi.com/hoi-thao-thuc-trang-va-dinh-huong-xac-lap-danh-muc-cay-xanh-do-thi/c/43804221.epi,Hội thảo thực trạng và định hướng xác lập danh mục cây xanh đô thị,Báo Quảng Ngãi,2022-09-23T11:18:00+07:00
https://baomoi.com/thanh-tra-phat-hien-nhieu-vi-pham-tai-cong-ty-quan-ly-thuy-nong-dien-bien/c/43804269.epi,Thanh tra phát hiện nhiều vi phạm tại Công ty Quản lý thủy nông Điện Biên,Báo Đầu Tư,2022-09-23T11:14:00+07:00
https://baomoi.com/tinh-chuyen-dua-san-bay-bien-hoa-vao-khai-thac-dan-dung/c/43804358.epi,Tính chuyện đưa sân bay Biên Hòa vào khai thác dân dụng,Tạp chí Kinh Tế Sài Gòn,2022-09-23T11:04:44+07:00
https://baomoi.com/so-vh-tt-tp-hcm-de-di-tich-300-tuoi-thanh-phe-tich-va-trach-nhiem-cua-ubnd-phuong/c/43804059.epi,Sở VH-TT TP.HCM: Để di tích 300 tuổi thành phế tích và trách nhiệm của UBND phường,Báo VOV,2022-09-23T10:58:00+07:00
https://baomoi.com/ba-ria-vung-tau-thu-hoi-dat-khu-cong-nghiep-bo-hoang/c/43803899.epi,Bà Rịa-Vũng Tàu thu hồi đất khu công nghiệp bỏ hoang,Báo Tiền Phong,2022-09-23T10:44:00+07:00
https://baomoi.com/tai-sao-nguoi-nhat-thich-ngu-duoi-san-thay-vi-ngu-tren-giuong/c/43803908.epi,Tại sao người Nhật thích ngủ dưới sàn thay vì ngủ trên giường?,Báo Tổ Quốc,2022-09-23T10:43:00+07:00
https://baomoi.com/toa-nha-bi-ghet-nhat-the-gioi-vi-kha-nang-lam-nha-cua-xe-co-xung-quanh-bien-dang/c/43803911.epi,"Tòa nhà bị 'ghét' nhất thế giới vì 'khả năng' làm nhà cửa, xe cộ xung quanh biến dạng",Báo Phụ Nữ Việt Nam,2022-09-23T10:43:00+07:00
https://baomoi.com/binh-thuan-thu-hoi-du-an-3-000-ty-dong-do-cham-trien-khai/c/43807257.epi,Bình Thuận thu hồi dự án 3.000 tỷ đồng do chậm triển khai,Tạp chí Mekong Asean,2022-09-23T10:39:00+07:00
https://baomoi.com/chi-cap-phep-xay-dung-cho-co-so-karaoke-co-loi-thoat-thu-hai/c/43804763.epi,Chỉ cấp phép xây dựng cho cơ sở karaoke có lối thoát thứ hai,Đài Phát thanh và truyền hình Hà Nội,2022-09-23T10:36:00+07:00
https://baomoi.com/ngan-chan-phat-sinh-cac-truong-hop-vi-pham-xay-dung-tren-dat-nong-nghiep/c/43799867.epi,Ngăn chặn phát sinh các trường hợp vi phạm xây dựng trên đất nông nghiệp,Báo Thanh Hóa,2022-09-23T10:33:00+07:00
https://baomoi.com/quan-karaoke-vu-truong-nop-ty-le-phi-bao-hiem-chay-no-0-4-nam/c/43804022.epi,"Quán karaoke, vũ trường nộp tỷ lệ phí bảo hiểm cháy nổ 0,4%/năm",Báo Chính Phủ,2022-09-23T10:31:00+07:00
https://baomoi.com/can-som-nang-cap-cac-tram-bom-tuoi-tieu-nuoc-o-dong-trieu/c/43803719.epi,"Cần sớm nâng cấp các trạm bơm tưới, tiêu nước ở Đông Triều",Báo Quảng Ninh,2022-09-23T10:18:24+07:00
https://baomoi.com/cuong-che-quan-the-biet-phu-xay-dung-trai-phep-tren-dat-nong-truong/c/43803762.epi,Cưỡng chế quần thể 'biệt phủ' xây dựng trái phép trên đất nông trường,Báo Công An Nhân Dân,2022-09-23T10:14:00+07:00
https://baomoi.com/kim-cuong-decor-don-vi-thiet-ke-thi-cong-noi-that-uy-tin/c/43804008.epi,Kim Cương Decor: Đơn vị thiết kế thi công nội thất uy tín,Báo Thanh Hóa,2022-09-23T10:07:00+07:00
https://baomoi.com/trai-nghiem-mua-sam-giua-thien-nhien-o-binh-chau/c/43803347.epi,Trải nghiệm 'mua sắm giữa thiên nhiên' ở Bình Châu,Tạp chí Tri Thức Trực Tuyến,2022-09-23T10:15:20+07:00
https://baomoi.com/ngoi-nha-dac-biet-co-thiet-ke-xoay-ve-1-goc/c/43803242.epi,Ngôi nhà đặc biệt có thiết kế xoay về 1 góc,Báo Pháp Luật TP.HCM,2022-09-23T10:00:18+07:00
https://baomoi.com/gan-het-nam-nhung-tinh-dak-nong-chua-co-ke-hoach-quy-hoach-su-dung-dat/c/43803240.epi,"Gần hết năm nhưng tỉnh Đắk Nông chưa có kế hoạch, quy hoạch sử dụng đất",Báo Pháp Luật TP.HCM,2022-09-23T09:59:25+07:00
https://baomoi.com/cao-bang-ti-le-nguoi-dan-nong-thon-su-dung-nuoc-hop-ve-sinh-dat-91/c/43803377.epi,Cao Bằng: Tỉ lệ người dân nông thôn sử dụng nước hợp vệ sinh đạt 91%,Báo Sức Khỏe & Đời Sống,2022-09-23T09:54:00+07:00
https://baomoi.com/ngan-hang-rao-ban-khu-nghi-duong-khoang-nong-rong-gan-tram-ha-o-ninh-binh/c/43803189.epi,Ngân hàng rao bán Khu nghỉ dưỡng khoáng nóng rộng gần trăm ha ở Ninh Bình,Báo Tiền Phong,2022-09-23T09:49:00+07:00
https://baomoi.com/agribank-ban-no-khu-du-lich-nghi-duong-khoang-nong-cuc-phuong-ca-tram-ty-dong/c/43803149.epi,Agribank bán nợ Khu du lịch nghỉ dưỡng khoáng nóng Cúc Phương cả trăm tỷ đồng,Doanh Nhân VN,2022-09-23T09:48:00+07:00
https://baomoi.com/do-an-quy-hoach-do-thi-cam-lam-bo-xay-dung-de-nghi-lam-ho-so-trinh-tu-thu-tuc/c/43803135.epi,"Đồ án quy hoạch đô thị Cam Lâm: Bộ Xây dựng đề nghị làm hồ sơ, trình tự, thủ tục",Báo Tiền Phong,2022-09-23T09:47:00+07:00
https://baomoi.com/duong-vanh-dai-3-tphcm-tu-giac-mo-den-hien-thuc/c/43803325.epi,Đường Vành đai 3 TPHCM: Từ giấc mơ đến hiện thực,Công An TP.HCM,2022-09-23T09:47:00+07:00
https://baomoi.com/de-xuat-bo-tri-noxh-tap-trung-thay-quy-dinh-trich-20-quy-dat/c/43803077.epi,Đề xuất bố trí NƠXH tập trung thay quy định trích 20% quỹ đất,Báo Tiền Phong,2022-09-23T09:46:00+07:00
https://baomoi.com/ket-noi-voi-cac-truc-phat-trien-kinh-te-de-tang-tinh-kha-thi-du-an-san-bay-quang-tri/c/43803264.epi,Kết nối với các trục phát triển kinh tế để tăng tính khả thi dự án sân bay Quảng Trị,Báo Gia Đình & Xã Hội,2022-09-23T09:37:00+07:00
https://baomoi.com/thi-truong-bat-dong-san-da-nang-tram-lang/c/43802926.epi,Thị trường bất động sản Đà Nẵng trầm lắng,Tạp chí Tri Thức Trực Tuyến,2022-09-23T09:46:42+07:00
https://baomoi.com/bac-kan-hon-95-ho-gia-dinh-su-dung-nuoc-hop-ve-sinh/c/43803376.epi,Bắc Kạn: Hơn 95% hộ gia đình sử dụng nước hợp vệ sinh,Báo Sức Khỏe & Đời Sống,2022-09-23T09:31:00+07:00
https://baomoi.com/thong-bao-y-kien-chi-dao-cua-bi-thu-tinh-uy-tai-phien-tiep-dan-dinh-ky-thang-9/c/43802898.epi,Thông báo ý kiến chỉ đạo của Bí thư Tỉnh ủy tại phiên tiếp dân định kỳ tháng 9,Báo Hà Tĩnh,2022-09-23T09:27:00+07:00
https://baomoi.com/tinh-tiet-bat-thuong-vu-thi-the-cu-ba-95-tuoi-chon-trong-vuon-nha-con-trai/c/43863202.epi,Tình tiết bất thường vụ thi thể cụ bà 95 tuổi chôn trong vườn nhà con trai,Báo Giao Thông,
https://baomoi.com/thieu-nien-bi-canh-sat-duoi-theo-danh-dap-noi-gi/c/43864629.epi,Thiếu niên bị cảnh sát đuổi theo đánh đập nói gì?,Báo VTC News,
https://baomoi.com/vot-chiec-vali-la-troi-noi-tren-song-nguoi-dan-soc-nang-khi-mo-ra/c/43866863.epi,"Vớt chiếc vali 'lạ' trôi nổi trên sông, người dân sốc nặng khi mở ra",Tạp chí SaoStar,2022-09-30T07:00:00+07:00
https://baomoi.com/ket-dau-long-cua-nu-dai-gia-sau-khi-vao-khach-san-voi-huan-luyen-vien-gym/c/43868351.epi,Kết đau lòng của nữ đại gia sau khi vào khách sạn với huấn luyện viên gym,Báo VietnamNet,2022-09-30T09:08:00+07:00
https://baomoi.com/hien-truong-7-thi-the-troi-dat-o-bai-bien-phu-quoc/c/43864061.epi,Hiện trường 7 thi thể trôi dạt ở bãi biển Phú Quốc,Tạp chí Tri Thức Trực Tuyến,
https://baomoi.com/dang-giua-chuyen-bay-vo-phat-hien-chong-chet-tren-ghe-may-bay/c/43864902.epi,"Đang giữa chuyến bay, vợ phát hiện chồng chết trên ghế máy bay",Báo Người Lao Động,
https://baomoi.com/ba-luat-su-bao-chua-cho-ba-nguyen-phuong-hang/c/43866209.epi,Ba luật sư bào chữa cho bà Nguyễn Phương Hằng,Báo Tiền Phong,2022-09-30T05:37:00+07:00
https://baomoi.com/an-mang-dau-long-gia-dinh-tan-nat/c/43864558.epi,"Án mạng đau lòng, gia đình tan nát",Báo Người Lao Động,
https://baomoi.com/ha-noi-chu-so-huu-khu-dat-vang-o-quan-hoang-mai-bi-ngan-hang-rao-ban-no-khung/c/43872056.epi,Hà Nội: Chủ sở hữu khu đất vàng ở quận Hoàng Mai bị ngân hàng rao bán nợ khủng,Báo Infonet,2022-09-30T15:03:00+07:00
https://baomoi.com/bidv-ban-khoan-no-hon-4-900-ty-cua-chu-dau-tu-du-an-kenton-node/c/43849773.epi,BIDV bán khoản nợ hơn 4.900 tỷ của chủ đầu tư dự án Kenton Node,Báo Đại Đoàn Kết,2022-09-28T11:23:00+07:00
https://baomoi.com/bidv-dai-ha-gia-toi-410-ty-dong-khoan-no-4-900-ty-cua-chu-dau-tu-du-an-kenton/c/43825182.epi,BIDV đại hạ giá tới 410 tỷ đồng khoản nợ 4.900 tỷ của chủ đầu tư dự án Kenton,Chuyên trang Vietnamdaily - Báo Tri thức & Cuộc sống,2022-09-26T07:08:00+07:00
https://baomoi.com/nhieu-ngan-hang-giam-gia-ban-tai-san-the-chap-de-thu-hoi-no/c/43801390.epi,Nhiều ngân hàng giảm giá bán tài sản thế chấp để thu hồi nợ,Báo Sài Gòn Giải Phóng,2022-09-23T07:02:00+07:00
https://baomoi.com/nhieu-ngan-hang-rao-ban-tai-san-khung-voi-gia-beo/c/43722360.epi,Nhiều ngân hàng rao bán tài sản 'khủng' với giá bèo,Báo Pháp Luật TP.HCM,2022-09-14T12:01:31+07:00
https://baomoi.com/pho-tong-thong-my-toi-han-quoc-de-tran-an-them-han-gan/c/43861973.epi,"Phó Tổng thống Mỹ tới Hàn Quốc: Để trấn an, thêm hàn gắn",Báo Thế Giới & Việt Nam,
https://baomoi.com/vu-khi-nguy-hiem-doi-voi-eu/c/43858012.epi,'Vũ khí' nguy hiểm đối với EU,Báo Tin Tức TTXVN,
https://baomoi.com/cai-to-hoi-dong-bao-an-lien-hop-quoc-khi-xu-the-cung-chinh-la-diem-nghen/c/43857738.epi,Cải tổ Hội đồng Bảo an Liên hợp quốc: Khi xu thế cũng chính là điểm nghẽn,Báo An Ninh Thế Giới,
https://baomoi.com/van-bai-nang-luong-cua-nga-o-chau-a-trong-boi-canh-xung-dot-ukraine/c/43856483.epi,Ván bài năng lượng của Nga ở châu Á trong bối cảnh xung đột Ukraine,Báo VOV,
https://baomoi.com/ai-duoc-huong-loi-tu-kich-ban-dong-chay-phuong-bac-bi-pha-hoai/c/43854709.epi,Ai được hưởng lợi từ kịch bản Dòng chảy phương Bắc bị phá hoại?,Báo VOV,
https://baomoi.com/tac-dong-toan-cau-sau-khi-fed-tang-lai-suat-len-cao-nhat-tu-nam-2008/c/43851284.epi,Tác động toàn cầu sau khi FED tăng lãi suất lên cao nhất từ năm 2008,Báo Tin Tức TTXVN,
https://baomoi.com/nguoi-phu-nu-khien-ca-chau-au-lo-lang/c/43847833.epi,Người phụ nữ khiến cả châu Âu lo lắng,Tạp chí Tri Thức Trực Tuyến,
https://baomoi.com/chinh-phu-moi-o-italy-se-tac-dong-the-nao-voi-eu-va-cuoc-xung-dot-nga-ukraine/c/43845884.epi,Chính phủ mới ở Italy sẽ tác động thế nào với EU và cuộc xung đột Nga - Ukraine?,Báo Tin Tức TTXVN,
https://baomoi.com/nam-2024-cang-hang-khong-con-dao-se-don-duoc-nhung-loai-tau-bay-nao/c/43802963.epi,"Năm 2024, Cảng hàng không Côn Đảo sẽ đón được những loại tàu bay nào?",Báo An Ninh Thủ Đô,2022-09-23T09:16:00+07:00
https://baomoi.com/nhung-cay-cau-tram-ty-dap-chieu-nhieu-nam-o-tp-hcm/c/43804589.epi,Những cây cầu trăm tỷ 'đắp chiếu' nhiều năm ở TP.HCM,Báo VTC News,2022-09-23T09:15:00+07:00
https://baomoi.com/tra-vinh-lap-them-cum-cong-nghiep-voi-von-dau-tu-tren-185-ty-dong/c/43802823.epi,Trà Vinh lập thêm cụm công nghiệp với vốn đầu tư trên 185 tỷ đồng,Báo VietnamPlus,2022-09-23T09:13:00+07:00
https://baomoi.com/cong-bo-chi-gioi-duong-do-nut-giao-vanh-dai-4-voi-dai-lo-thang-long/c/43802850.epi,Công bố chỉ giới đường đỏ nút giao Vành đai 4 với Đại lộ Thăng Long,Truyền Hình Thông Tấn,2022-09-23T09:13:00+07:00
https://baomoi.com/nha-ngoai-thanh-ha-noi-ngay-cang-len-gia/c/43802748.epi,Nhà ngoại thành Hà Nội ngày càng lên giá,Tạp chí Tri Thức Trực Tuyến,2022-09-23T09:22:01+07:00
https://baomoi.com/vu-bat-thuong-quy-dinh-moi-thau-tai-nha-may-nhiet-dien-vung-ang-1-chu-dau-tu-va-nha-thau-noi-gi/c/43802728.epi,Vụ 'Bất thường quy định mời thầu tại Nhà máy Nhiệt điện Vũng Áng 1': Chủ đầu tư và nhà thầu nói gì?,Báo Công An Nhân Dân,2022-09-23T08:59:00+07:00
https://baomoi.com/hang-loat-du-an-tren-dat-vang-bi-thu-hoi/c/43802591.epi,Hàng loạt dự án trên đất 'vàng' bị thu hồi,Báo Người Lao Động,2022-09-23T08:51:00+07:00
https://baomoi.com/xoa-so-bon-tong-cuc-thuoc-bo-tai-nguyen-va-moi-truong/c/43803143.epi,'Xóa sổ' bốn Tổng cục thuộc Bộ Tài nguyên và Môi trường,Báo An Ninh Thủ Đô,2022-09-23T08:50:21+07:00
https://baomoi.com/quang-ninh-cong-ty-flc-bi-phat-200-trieu-dong-do-khai-thac-nuoc-ngam-trai-phep/c/43802565.epi,Quảng Ninh: Công ty FLC bị phạt 200 triệu đồng do khai thác nước ngầm trái phép,Báo Công Thương,2022-09-23T08:47:10+07:00
https://baomoi.com/bo-xay-dung-cap-phep-cho-quan-karaoke-phai-xem-xet-loi-thoat-nan-thu-2/c/43802581.epi,Bộ Xây dựng: Cấp phép cho quán karaoke phải xem xét lối thoát nạn thứ 2,Báo VietnamNet,2022-09-23T08:43:00+07:00
https://baomoi.com/nhieu-hang-muc-xay-dung-sai-phep-tai-du-an-nuoi-ca-cong-nghe-cao/c/43802497.epi,Nhiều hạng mục xây dựng sai phép tại dự án nuôi cá công nghệ cao,Báo Công An Nhân Dân,2022-09-23T08:39:00+07:00
https://baomoi.com/ra-soat-trach-nhiem-tai-du-an-hien-dai-hoa-trung-tam-dieu-hanh-van-tai-duong-sat/c/43802486.epi,Rà soát trách nhiệm tại dự án hiện đại hóa trung tâm điều hành vận tải đường sắt,Tạp Chí Giao Thông Vận Tải,2022-09-23T08:37:00+07:00
https://baomoi.com/check-in-3-tiem-ca-phe-moi-o-quan-1/c/43802364.epi,Check-in 3 tiệm cà phê mới ở quận 1,Tạp chí Tri Thức Trực Tuyến,2022-09-23T08:48:48+07:00
https://baomoi.com/studio-doc-dao-o-uc-noi-ai-cung-co-the-tro-thanh-nghe-thuat-gia/c/43802536.epi,Studio độc đáo ở Úc - nơi ai cũng có thể trở thành nghệ thuật gia,Báo Phụ Nữ Việt Nam,2022-09-23T08:30:00+07:00
https://baomoi.com/vi-sao-flc-bi-phat-vu-dao-gieng-khoan-o-san-golf/c/43802288.epi,Vì sao FLC bị phạt vụ đào giếng khoan ở sân golf?,Báo Infonet,2022-09-23T08:27:00+07:00
https://baomoi.com/cam-do-xe-khoa-banh-xe-vi-pham-tai-duong-noi-khu-do-thi-co-pham-luat/c/43802307.epi,"Cấm đỗ xe, khóa bánh xe vi phạm tại đường nội khu đô thị - có phạm luật?",Báo An Ninh Thủ Đô,2022-09-23T08:21:14+07:00
https://baomoi.com/thu-hoi-dat-voi-du-an-co-20-ho-dan-khong-dong-y-co-nen-khong/c/43802141.epi,Thu hồi đất với dự án có 20% hộ dân không đồng ý: Có nên không?,Báo Pháp Luật TP.HCM,2022-09-23T08:19:26+07:00
https://baomoi.com/soi-noi-thi-dua-chao-mung-ky-niem-155-nam-thanh-lap-huyen-huong-khe/c/43802104.epi,Sôi nổi thi đua chào mừng kỷ niệm 155 năm thành lập huyện Hương Khê,Báo Hà Tĩnh,2022-09-23T08:17:00+07:00
https://baomoi.com/thu-tuong-lap-to-cong-tac-nghien-cuu-dau-tu-khai-thac-mot-so-cang-hang-khong/c/43802157.epi,"Thủ tướng lập Tổ công tác nghiên cứu, đầu tư khai thác một số cảng hàng không",Tạp chí Mekong Asean,2022-09-23T08:17:00+07:00
https://baomoi.com/bung-nhung-quan-ly-nha-dat-cong-san-tai-quang-ngai/c/43802049.epi,"Bùng nhùng quản lý nhà, đất công sản tại Quảng Ngãi",Báo Đầu Tư,2022-09-23T08:15:00+07:00
https://baomoi.com/tro-xi-cua-nha-may-nhiet-dien-vinh-tan-4-lam-vat-lieu-xay-dung-vat-lieu-san-lap/c/43805640.epi,"Tro xỉ của Nhà máy Nhiệt điện Vĩnh Tân 4 làm vật liệu xây dựng, vật liệu san lấp",Báo Xây Dựng,2022-09-23T08:15:00+07:00
https://baomoi.com/de-xuat-tach-tuyen-huu-nghi-chi-lang-khoi-cao-toc-bac-giang-lang-son/c/43802047.epi,Đề xuất tách tuyến Hữu Nghị - Chi Lăng khỏi cao tốc Bắc Giang - Lạng Sơn,Báo Đầu Tư,2022-09-23T08:12:00+07:00
https://baomoi.com/xay-dung-trai-phep-o-danh-thang-ba-lang-an-da-xu-ly-nhu-the-nao/c/43801970.epi,Xây dựng trái phép ở danh thắng Ba Làng An: Đã xử lý như thế nào?,Báo Đầu Tư,2022-09-23T08:10:00+07:00
https://baomoi.com/diem-lai-nhung-sai-pham-tai-3-du-an-bt-cua-tap-doan-phuc-son/c/43802139.epi,Điểm lại những sai phạm tại 3 dự án BT của Tập đoàn Phúc Sơn,Chuyên trang Vietnamdaily - Báo Tri thức & Cuộc sống,2022-09-23T08:10:00+07:00
https://baomoi.com/xem-xet-dieu-chinh-ho-so-de-nghi-cong-nhan-quan-the-di-tich-danh-thang-yen-tu-la-di-san-the-gioi/c/43802014.epi,Xem xét điều chỉnh hồ sơ đề nghị công nhận quần thể di tích danh thắng Yên Tử là di sản thế giới,Báo Xây Dựng,2022-09-23T08:04:00+07:00
https://baomoi.com/hieu-qua-giao-khoan-rung-dat-rung-cho-nguoi-co-tu-quan-ly/c/43200854.epi,"Hiệu quả giao khoán rừng, đất rừng cho người Cơ Tu quản lý",Báo VOV,2022-09-23T08:02:00+07:00
https://baomoi.com/lo-nhieu-sai-pham-trong-quan-ly-tai-nguyen-khoang-san-va-dat-dai/c/43802369.epi,Lộ nhiều sai phạm trong quản lý tài nguyên khoáng sản và đất đai,Báo Công An Nhân Dân,2022-09-23T08:02:00+07:00
