url,title,publisher,time
https://baomoi.com/mua-biet-thu-tang-con-nhat-kim-anh-giau-co-nao-o-tuoi-u40/c/43870980.epi,"Mua biệt thự tặng con, Nhật Kim Anh giàu cỡ nào ở tuổi U40?",Báo Kiến Thức,2022-09-30T13:30:00+07:00
https://baomoi.com/dien-bien-moi-nhat-vu-khu-du-lich-xay-chui-giua-rung-o-tt-hue/c/43873133.epi,Diễn biến mới nhất vụ khu du lịch xây 'chui' giữa rừng ở TT-Huế,Báo Tiền Phong,2022-09-30T16:22:00+07:00
https://baomoi.com/quy-dinh-thoi-han-so-huu-nha-chung-cu-se-lam-tang-gia-nha-dat/c/43872261.epi,Quy định thời hạn sở hữu nhà chung cư sẽ làm tăng giá nhà đất?,Báo VietnamNet,2022-09-30T15:20:00+07:00
https://baomoi.com/bo-truong-nguyen-thanh-nghi-noi-ve-quy-dinh-thoi-han-so-huu-chung-cu/c/43873471.epi,Bộ trưởng Nguyễn Thanh Nghị nói về quy định thời hạn sở hữu chung cư,Báo Pháp Luật TP.HCM,2022-09-30T16:42:45+07:00
https://baomoi.com/quang-tri-se-thu-hoi-chu-truong-dau-tu-du-an-371-ti-dong/c/43873559.epi,Quảng Trị sẽ thu hồi chủ trương đầu tư dự án 371 tỉ đồng,Báo Pháp Luật TP.HCM,2022-09-30T16:54:42+07:00
https://baomoi.com/ngoi-nha-nho-voi-thiet-ke-thong-minh-o-pho-co/c/43873550.epi,Ngôi nhà nhỏ với thiết kế thông minh ở phố cổ,Báo Phụ Nữ Việt Nam,2022-09-30T16:49:00+07:00
https://baomoi.com/can-tho-1-chu-dau-tu-bi-chan-chinh-vi-rao-ban-can-ho-khong-dung-su-that/c/43873517.epi,Cần Thơ: 1 chủ đầu tư bị chấn chỉnh vì rao bán căn hộ không đúng sự thật,Báo Pháp Luật TP.HCM,2022-09-30T16:47:13+07:00
https://baomoi.com/dieu-chinh-qui-hoach-khong-vi-cong-dong/c/43873372.epi,Điều chỉnh qui hoạch không vì cộng đồng,Báo Công an Đà Nẵng,2022-09-30T16:37:00+07:00
https://baomoi.com/tp-ha-long-126-ho-dan-dong-y-hien-dat-de-trien-khai-thi-cong-2-du-an-trong-diem/c/43873165.epi,TP Hạ Long: 126 hộ dân đồng ý hiến đất để triển khai thi công 2 dự án trọng điểm,Báo Quảng Ninh,2022-09-30T16:24:43+07:00
https://baomoi.com/chu-trong-doi-thoai-giai-quyet-kien-nghi-nguyen-vong-chinh-dang-cua-nhan-dan/c/43873306.epi,"Chú trọng đối thoại, giải quyết kiến nghị, nguyện vọng chính đáng của Nhân dân",Đại Biểu Nhân Dân,2022-09-30T16:20:00+07:00
https://baomoi.com/tp-hcm-thoi-diem-chin-muoi-de-co-luat-to-chuc-chinh-quyen-do-thi/c/43873075.epi,TP HCM: Thời điểm 'chín muồi' để có Luật Tổ chức chính quyền đô thị,Báo Người Lao Động,2022-09-30T16:17:59+07:00
https://baomoi.com/bao-dam-quyen-cua-nguoi-su-dung-dat/c/43873554.epi,Bảo đảm quyền của người sử dụng đất,Đại Biểu Nhân Dân,2022-09-30T16:16:00+07:00
https://baomoi.com/trinh-quoc-hoi-giai-phap-xu-ly-vuong-mac-mot-so-tram-thu-phi-bot/c/43873054.epi,Trình Quốc hội giải pháp xử lý vướng mắc một số trạm thu phí BOT,Báo Tiền Phong,2022-09-30T16:15:00+07:00
https://baomoi.com/10-cach-tan-dung-do-cu-de-trong-rau-gia-vi/c/43873122.epi,10 cách tận dụng đồ cũ để trồng rau gia vị,Báo Phụ Nữ Việt Nam,2022-09-30T16:14:00+07:00
https://baomoi.com/them-2-khu-tap-the-cu-o-ha-noi-se-duoc-pha-do-xay-moi-vao-cuoi-nam-2023/c/43873107.epi,Thêm 2 khu tập thể cũ ở Hà Nội sẽ được phá dỡ xây mới vào cuối năm 2023,Tạp chí Mekong Asean,2022-09-30T16:12:00+07:00
https://baomoi.com/dai-bieu-quoc-hoi-tiep-xuc-cu-tri-tai-cac-huyen-tan-phu-dinh-quan-cu-tri-kien-nghi-thao-go-nhieu-van-de-con-vuong-mac/c/43872997.epi,"Đại biểu Quốc hội tiếp xúc cử tri tại các huyện Tân Phú, Định Quán: Cử tri kiến nghị tháo gỡ nhiều vấn đề còn vướng mắc",Báo Đồng Nai,2022-09-30T16:08:00+07:00
https://baomoi.com/hai-phong-thong-tin-ve-viec-to-chuc-cuong-che-thao-do-cac-cong-trinh-vi-pham-tai-vuon-quoc-gia-cat-ba/c/43873098.epi,Hải Phòng: Thông tin về việc tổ chức cưỡng chế tháo dỡ các công trình vi phạm tại Vườn quốc gia Cát Bà,Báo Xây Dựng,2022-09-30T16:04:00+07:00
https://baomoi.com/phai-deo-bam-noi-dung-cong-viec-som-giai-quyet-van-de-dan-sinh-tai-huyen-soc-son/c/43872865.epi,"Phải đeo bám nội dung công việc, sớm giải quyết vấn đề dân sinh tại huyện Sóc Sơn",Báo Lao Động Thủ Đô,2022-09-30T16:02:00+07:00
https://baomoi.com/de-xuat-chung-cu-co-thoi-han-nguoi-dan-lieu-co-man-ma/c/43872836.epi,Đề xuất chung cư có thời hạn: Người dân liệu có mặn mà?,Tạp chí SaoStar,2022-09-30T15:58:00+07:00
https://baomoi.com/bac-kan-them-mot-xuong-tai-che-phe-lieu-trai-phep-bi-phat-hien/c/43872805.epi,Bắc Kạn: Thêm một xưởng tái chế phế liệu trái phép bị phát hiện,Báo Công Thương,2022-09-30T15:57:27+07:00
https://baomoi.com/ha-noi-sap-cai-tao-vuon-hoa-con-coc/c/43872682.epi,Hà Nội sắp cải tạo vườn hoa Con Cóc,Báo Tiền Phong,2022-09-30T15:50:00+07:00
https://baomoi.com/kien-nghi-xu-ly-xe-cho-rac-qua-tai-tai-khu-lien-hop-xu-ly-chat-thai-nam-son/c/43872599.epi,Kiến nghị xử lý xe chở rác quá tải tại Khu liên hợp xử lý chất thải Nam Sơn,Báo Sức Khỏe & Đời Sống,2022-09-30T15:46:00+07:00
https://baomoi.com/thuc-hien-chung-thuc-tren-cong-dich-vu-cong-quoc-gia-di-vao-nen-nep/c/43872845.epi,Thực hiện chứng thực trên Cổng dịch vụ công Quốc gia đi vào nền nếp,Báo Pháp Luật & Xã Hội,2022-09-30T15:40:00+07:00
https://baomoi.com/chu-tich-ubnd-tp-ha-noi-sat-sao-som-giai-quyet-tung-van-de-cu-tri-kien-nghi/c/43872558.epi,"Chủ tịch UBND TP Hà Nội: Sát sao, sớm giải quyết từng vấn đề cử tri kiến nghị",Báo Tổ Quốc,2022-09-30T15:39:00+07:00
https://baomoi.com/quang-binh-ap-luc-hoan-thanh-tai-du-an-quang-truong-bien-trung-trach/c/43872515.epi,Quảng Bình: Áp lực hoàn thành tại Dự án quảng trường biển Trung Trạch,Báo Xây Dựng,2022-09-30T15:38:00+07:00
https://baomoi.com/dong-nai-yeu-cau-cong-khai-thong-tin-du-an-bat-dong-san/c/43872557.epi,Đồng Nai: Yêu cầu công khai thông tin dự án bất động sản,Tài Chính Doanh Nghiệp,2022-09-30T15:38:00+07:00
https://baomoi.com/ha-noi-danh-gia-phan-hang-41-san-pham-ocop-dau-tien-cua-nam-2022/c/43872459.epi,"Hà Nội đánh giá, phân hạng 41 sản phẩm OCOP đầu tiên của năm 2022",Báo Nhân Dân,2022-09-30T15:31:00+07:00
https://baomoi.com/bo-xay-dung-xu-nghiem-vi-pham-quy-hoach-kiem-soat-nha-cao-tang-o-noi-do/c/43872393.epi,"Bộ Xây dựng: Xử nghiêm vi phạm quy hoạch, kiểm soát nhà cao tầng ở nội đô",Báo VietnamNet,2022-09-30T15:30:00+07:00
https://baomoi.com/bat-dong-san-du-lich-van-la-mo-vang-cho-cac-nha-dau-tu/c/43872380.epi,Bất động sản du lịch vẫn là mỏ vàng cho các nhà đầu tư,Báo Pháp Luật TP.HCM,2022-09-30T15:29:53+07:00
https://baomoi.com/chu-dau-tu-nha-thuong-mai-nen-duoc-chon-hinh-thuc-thuc-hien-nghia-vu-noxh/c/43872326.epi,Chủ đầu tư nhà thương mại nên được chọn hình thức thực hiện nghĩa vụ NƠXH,Báo VietnamNet,2022-09-30T15:23:00+07:00
https://baomoi.com/xay-nha-nhanh-khang-dinh-thuong-hieu-xay-nha-than-toc/c/43872345.epi,Xây Nhà Nhanh - Khẳng định thương hiệu xây nhà thần tốc,Báo An Ninh Thủ Đô,2022-09-30T15:22:45+07:00
https://baomoi.com/de-xuat-quy-dinh-ve-dong-chay-toi-thieu-cua-song-suoi/c/43873034.epi,"Đề xuất quy định về dòng chảy tối thiểu của sông, suối",Báo Chính Phủ,2022-09-30T15:20:00+07:00
https://baomoi.com/van-don-quyet-liet-chuyen-doi-phao-xop/c/43872343.epi,Vân Đồn: Quyết liệt chuyển đổi phao xốp,Báo Quảng Ninh,2022-09-30T15:19:10+07:00
https://baomoi.com/ban-giai-phap-nao-vet-luong-hang-hai-dinh-an-can-thocho-tau-hon-10-000-tan-ra-vao/c/43872480.epi,Bàn giải pháp nạo vét luồng hàng hải Định An - Cần Thơcho tàu hơn 10.000 tấn ra vào,Tạp Chí Giao Thông Vận Tải,2022-09-30T15:14:00+07:00
https://baomoi.com/tang-cuong-vai-tro-lanh-dao-cua-dang-trong-thuc-hien-quy-che-dan-chu-co-so/c/43872168.epi,Tăng cường vai trò lãnh đạo của Đảng trong thực hiện quy chế dân chủ cơ sở,Báo Điện tử Đảng cộng sản VN,2022-09-30T15:12:00+07:00
https://baomoi.com/de-xuat-tieu-chi-tieu-chuan-chat-luong-cung-cap-dich-vu-giam-dinh-di-vat-co-vat/c/43872374.epi,"Đề xuất tiêu chí, tiêu chuẩn chất lượng cung cấp dịch vụ giám định di vật, cổ vật",Báo Chính Phủ,2022-09-30T15:11:00+07:00
https://baomoi.com/novagroup-de-xuat-y-tuong-quy-hoach-xay-dung-phat-trien-khu-kinh-te-cua-khau-tinh-dong-thap/c/43873546.epi,Novagroup đề xuất ý tưởng quy hoạch xây dựng phát triển khu kinh tế cửa khẩu tỉnh Đồng Tháp,Báo Đồng Tháp,2022-09-30T15:09:00+07:00
https://baomoi.com/doanh-nghiep-de-xuat-y-tuong-quy-hoach-khu-nam-phan-rang-rong-7-500-ha/c/43872132.epi,Doanh nghiệp đề xuất ý tưởng quy hoạch Khu Nam Phan Rang rộng 7.500 ha,Báo Đầu Tư,2022-09-30T15:08:00+07:00
https://baomoi.com/dien-luc-ninh-binh-hieu-qua-tu-cac-cong-trinh-dau-tu-xay-dung-luoi-dien/c/43872184.epi,Điện lực Ninh Bình: Hiệu quả từ các công trình đầu tư xây dựng lưới điện,Đại Biểu Nhân Dân,2022-09-30T15:05:00+07:00
https://baomoi.com/quan-diem-trai-chieu-doi-voi-quy-dinh-thoi-han-so-huu-nha-chung-cu/c/43872234.epi,Quan điểm trái chiều đối với quy định thời hạn sở hữu nhà chung cư,Tạp chí Một Thế Giới,2022-09-30T15:04:00+07:00
https://baomoi.com/ha-noi-chu-so-huu-khu-dat-vang-o-quan-hoang-mai-bi-ngan-hang-rao-ban-no-khung/c/43872056.epi,Hà Nội: Chủ sở hữu khu đất vàng ở quận Hoàng Mai bị ngân hàng rao bán nợ khủng,Báo Infonet,2022-09-30T15:03:00+07:00
https://baomoi.com/bo-van-hoa-the-thao-va-du-lich-bai-bo-5-van-ban-quy-pham-phap-luat/c/43872087.epi,"Bộ Văn hóa, Thể thao và Du lịch bãi bỏ 5 văn bản quy phạm pháp luật",Báo Bà Rịa - Vũng Tàu,2022-09-30T15:03:00+07:00
https://baomoi.com/chinh-sach-dat-dai-trong-nong-nghiep-dong-gop-y-kien-sua-doi-luat-dat-dai-2013/c/43872183.epi,'Chính sách đất đai trong nông nghiệp - Đóng góp ý kiến sửa đổi Luật Đất đai 2013',Đại Biểu Nhân Dân,2022-09-30T15:03:00+07:00
https://baomoi.com/cu-tri-ha-noi-lo-lang-vi-nhieu-vu-chay-no-nghiem-trong-lien-tiep-xay-ra/c/43871990.epi,Cử tri Hà Nội lo lắng vì nhiều vụ cháy nổ nghiêm trọng liên tiếp xảy ra,Báo Sức Khỏe & Đời Sống,2022-09-30T15:00:00+07:00
https://baomoi.com/buc-tranh-cuoc-song-dang-mo-uoc-tai-fenice/c/43872133.epi,Bức tranh cuộc sống đáng mơ ước tại FENICE,Báo Đầu Tư,2022-09-30T15:00:00+07:00
https://baomoi.com/xuyen-moc-se-co-diem-check-in-moi/c/43871956.epi,Xuyên Mộc sẽ có điểm check in mới,Báo Bà Rịa - Vũng Tàu,2022-09-30T14:53:00+07:00
https://baomoi.com/21-tinh-thanh-tham-gia-gop-y-luat-nha-o/c/43871887.epi,"21 tỉnh, thành tham gia góp ý Luật Nhà ở",Báo Đồng Nai,2022-09-30T14:49:00+07:00
https://baomoi.com/phat-trien-them-dien-gio-o-mien-bac/c/43871884.epi,Phát triển thêm điện gió ở miền Bắc,Báo VietnamNet,2022-09-30T14:48:00+07:00
https://baomoi.com/du-thao-luat-dat-dai-sua-doi-khong-thu-hoi-dat-lam-du-an-khi-chi-80-nguoi-dan-dong-y/c/43871919.epi,Dự thảo Luật đất đai (sửa đổi): Không thu hồi đất làm dự án khi chỉ 80% người dân đồng ý,Doanh Nhân VN,2022-09-30T14:46:00+07:00
https://baomoi.com/tiep-nhan-1-958-don-khieu-nai-to-cao-kien-nghi-phan-anh-cua-cong-dan/c/43871791.epi,"Tiếp nhận 1.958 đơn khiếu nại, tố cáo, kiến nghị, phản ánh của công dân",Quảng Bình,2022-09-30T14:41:00+07:00
https://baomoi.com/cum-cong-nghiep-phai-phuc-vu-muc-tieu-di-doi-doanh-nghiep-vao-khu-san-xuat-tap-trung/c/43871731.epi,Cụm công nghiệp phải phục vụ mục tiêu di dời doanh nghiệp vào khu sản xuất tập trung,Báo Đồng Nai,2022-09-30T14:40:00+07:00
https://baomoi.com/can-tho-cong-ty-dat-xanh-mien-tay-bi-tuyt-coi-vi-quang-cao-sai-su-that/c/43871829.epi,Cần Thơ: Công ty Đất Xanh Miền Tây bị 'tuýt còi' vì quảng cáo sai sự thật,Bảo Vệ Công Lý,2022-09-30T14:50:00+07:00
https://baomoi.com/thuoc-nao-tri-duoc-can-benh-cham-tien-do/c/43871697.epi,Thuốc nào 'trị' được căn bệnh 'chậm tiến độ'?,Báo Văn Nghệ Công An,2022-09-30T14:31:00+07:00
https://baomoi.com/quy-dinh-ve-thoi-gian-dong-tien-sau-khi-trung-dau-gia-quyen-su-dung-dat/c/43871788.epi,Quy định về thời gian đóng tiền sau khi trúng đấu giá quyền sử dụng đất,Tài Chính Doanh Nghiệp,2022-09-30T14:25:00+07:00
https://baomoi.com/bac-lieu-ban-thuong-truc-ban-tri-su-phat-giao-tinh-hop-trien-khai-cong-tac-phat-su/c/43871633.epi,Bạc Liêu: Ban Thường trực Ban Trị sự Phật giáo tỉnh họp triển khai công tác Phật sự,Giác ngộ,2022-09-30T14:18:00+07:00
https://baomoi.com/danh-gia-lai-tong-the-du-an-nao-vet-ket-hop-thu-hoi-san-pham-luong-dinh-an/c/43871391.epi,Đánh giá lại tổng thể dự án nạo vét kết hợp thu hồi sản phẩm luồng Định An,Báo Pháp Luật TP.HCM,2022-09-30T14:15:31+07:00
https://baomoi.com/chu-tich-ha-noi-phai-deo-bam-sot-sang-nhu-viec-nha-minh-doi-voi-cac-van-de-dan-sinh-buc-xuc/c/43871351.epi,"Chủ tịch Hà Nội: Phải đeo bám, sốt sắng như việc nhà mình đối với các vấn đề dân sinh bức xúc",Báo An Ninh Thủ Đô,2022-09-30T14:07:57+07:00
https://baomoi.com/trong-thang-10-phai-co-du-thao-chinh-tri-luong-dinh-an/c/43871398.epi,"Trong tháng 10, phải có dự thảo chỉnh trị luồng Định An",Báo Giao Thông,2022-09-30T14:06:00+07:00
https://baomoi.com/ngoi-nha-o-dong-que-xao-xac-bien-hinh-ngo-ngang-sau-cai-tao/c/43871244.epi,Ngôi nhà ở đồng quê xào xạc biến hình ngỡ ngàng sau cải tạo,Báo VietnamNet,2022-09-30T14:00:00+07:00
https://baomoi.com/uu-tien-phat-trien-cong-trinh-xanh-theo-huong-ben-vung/c/43871456.epi,Ưu tiên phát triển công trình xanh theo hướng bền vững,Báo Pháp Luật & Xã Hội,2022-09-30T13:58:00+07:00
https://baomoi.com/ngo-ngang-voi-mat-do-xay-dung-chuan-nghi-duong-tai-felicity-phu-quoc/c/43871292.epi,Ngỡ ngàng với mật độ xây dựng chuẩn nghỉ dưỡng tại Felicity Phu Quoc,Báo VTC News,2022-09-30T13:53:23+07:00
https://baomoi.com/tich-cuc-ho-tro-nha-dau-tu-tai-kcn-vsip-quang-ngai/c/43871151.epi,Tích cực hỗ trợ nhà đầu tư tại KCN VSIP Quảng Ngãi,Báo Quảng Ngãi,2022-09-30T13:52:00+07:00
https://baomoi.com/quyet-liet-quyet-tam-giai-quyet-cac-vu-viec-kien-nghi-cua-cu-tri-va-nhan-dan/c/43871719.epi,"Quyết liệt, quyết tâm giải quyết các vụ việc, kiến nghị của cử tri và nhân dân",Báo Hà Nội Mới,2022-09-30T13:50:00+07:00
https://baomoi.com/chua-co-quy-dinh-rieng-cho-quyen-tiep-can-dat-cua-dan-toc-thieu-so/c/43871962.epi,Chưa có quy định riêng cho quyền tiếp cận đất của dân tộc thiểu số,Tạp chí Người Đưa Tin,2022-09-30T13:49:00+07:00
https://baomoi.com/tang-cuong-doi-thoai-de-tao-su-dong-thuan-trong-thuc-hien-cac-nhiem-vu/c/43871065.epi,Tăng cường đối thoại để tạo sự đồng thuận trong thực hiện các nhiệm vụ,Báo Kinh Tế Đô Thị,2022-09-30T13:40:00+07:00
https://baomoi.com/chu-tich-ubnd-tp-tran-sy-thanh-tiep-xuc-cu-tri-huyen-soc-son/c/43871066.epi,Chủ tịch UBND TP Trần Sỹ Thanh tiếp xúc cử tri huyện Sóc Sơn,Báo Kinh Tế Đô Thị,2022-09-30T13:35:00+07:00
https://baomoi.com/thuy-dien-dai-binh-chua-du-dieu-kien-cho-phep-tich-nuoc-chay-thu-thiet-bi/c/43870959.epi,"Thủy điện Đại Bình chưa đủ điều kiện cho phép tích nước, chạy thử thiết bị",Báo Đầu Tư,2022-09-30T13:13:00+07:00
https://baomoi.com/ngoi-nha-co-duoc-to-chuc-di-san-chau-a-thai-binh-duong-bao-ton-o-xu-thanh/c/43870907.epi,Ngôi nhà cổ được tổ chức Di sản châu Á - Thái Bình Dương bảo tồn ở xứ Thanh,Báo Thanh Hóa,2022-09-30T13:10:00+07:00
https://baomoi.com/so-kh-dt-ha-tinh-ho-tro-180-trieu-dong-cho-3-ho-ngheo-huong-khe-lam-nha-o/c/43870843.epi,Sở KH&ĐT Hà Tĩnh hỗ trợ 180 triệu đồng cho 3 hộ nghèo Hương Khê làm nhà ở,Báo Hà Tĩnh,2022-09-30T13:03:00+07:00
https://baomoi.com/xem-lich-am-hom-nay-thu-bay-ngay-1-10/c/43870916.epi,Xem lịch âm hôm nay thứ Bảy ngày 1/10,Báo VTC News,2022-09-30T13:00:00+07:00
https://baomoi.com/can-tach-bach-ro-rang-muc-dich-su-dung-de-ap-dung-co-che-thu-hoi-dat/c/43871673.epi,Cần tách bạch rõ ràng mục đích sử dụng để áp dụng cơ chế thu hồi đất,Tạp chí Người Đưa Tin,2022-09-30T12:58:00+07:00
https://baomoi.com/de-xuat-so-huu-chung-cu-co-thoi-han-chuyen-gia-canh-bao-lan-song-thoi-gia/c/43870886.epi,Đề xuất sở hữu chung cư có thời hạn: Chuyên gia cảnh báo làn sóng 'thổi giá',Báo VTC News,2022-09-30T12:57:19+07:00
https://baomoi.com/nguoi-nong-dan-co-khi-phai-vac-cuoc-qua-san-golf-moi-toi-duoc-ruong/c/43871963.epi,Người nông dân có khi phải vác cuốc qua sân golf mới tới được ruộng,Tạp chí Người Đưa Tin,2022-09-30T12:53:00+07:00
https://baomoi.com/mach-nuoc-dau-tu-nha-dat-von-mong/c/43870812.epi,'Mách nước' đầu tư nhà đất vốn mỏng,Báo Đầu Tư Chứng Khoán,2022-09-30T12:50:00+07:00
https://baomoi.com/can-quy-dinh-ro-dieu-khoan-tham-dinh-du-thao-ket-luan-thanh-tra/c/43870838.epi,Cần quy định rõ điều khoản thẩm định Dự thảo Kết luận thanh tra,Truyền Hình Quốc Hội Việt Nam,2022-09-30T12:46:00+07:00
https://baomoi.com/dong-hanh-chung-suc-dua-thi-xa-ky-anh-som-tro-thanh-thanh-pho/c/43870749.epi,"Đồng hành, chung sức đưa thị xã Kỳ Anh sớm trở thành thành phố",Báo Hà Tĩnh,2022-09-30T12:45:00+07:00
https://baomoi.com/cu-tri-quan-thanh-xuan-ha-noi-som-ap-dung-xu-phat-ca-nhan-ho-gia-dinh-khong-phan-loai-rac-thai-sinh-hoat/c/43870814.epi,"Cử tri Quận Thanh Xuân, Hà Nội: Sớm áp dụng xử phạt cá nhân, hộ gia đình không phân loại rác thải sinh hoạt",Truyền Hình Quốc Hội Việt Nam,2022-09-30T12:44:00+07:00
https://baomoi.com/tang-cuong-cong-khai-minh-bach-huong-toi-xay-dung-chinh-quyen-so-chinh-quyen-phuc-vu/c/43871338.epi,"Tăng cường công khai, minh bạch, hướng tới xây dựng chính quyền số, chính quyền phục vụ",Báo Hà Nội Mới,2022-09-30T12:38:00+07:00
https://baomoi.com/rung-ngop-vi-thuy-dien/c/43870642.epi,Rừng 'ngộp' vì thủy điện!,Báo Công an Đà Nẵng,2022-09-30T12:34:00+07:00
https://baomoi.com/tu-1-10-mot-so-khoan-phi-le-phi-trong-kinh-doanh-van-tai-duoc-giam-den-50/c/43870545.epi,"Từ 1/10: Một số khoản phí, lệ phí trong kinh doanh vận tải được giảm đến 50%",Báo Đại Đoàn Kết,2022-09-30T12:14:00+07:00
https://baomoi.com/quang-nam-quyet-liet-xu-ly-doanh-nghiep-san-xuat-che-bien-khoang-san-gay-o-nhiem/c/43870492.epi,"Quảng Nam: Quyết liệt xử lý doanh nghiệp sản xuất, chế biến khoáng sản gây ô nhiễm",Báo Lao Động Thủ Đô,2022-09-30T12:01:00+07:00
https://baomoi.com/pho-truong-doan-db-quoc-hoi-tp-chuyen-tai-du-giai-quyet-thau-dao-kien-nghi-cu-tri/c/43870520.epi,"Phó Trưởng Đoàn ĐB Quốc hội TP: Chuyển tải đủ, giải quyết thấu đáo kiến nghị cử tri",Báo Kinh Tế Đô Thị,2022-09-30T12:00:00+07:00
https://baomoi.com/can-lam-ro-trach-nhiem/c/43870491.epi,Cần làm rõ trách nhiệm!,Báo Pháp Luật & Xã Hội,2022-09-30T11:58:00+07:00
https://baomoi.com/ha-noi-danh-gia-phan-hang-41-san-pham-ocop-cua-3-quan-huyen/c/43870771.epi,"Hà Nội đánh giá, phân hạng 41 sản phẩm OCOP của 3 quận huyện",Báo Kinh Tế Đô Thị,2022-09-30T11:55:00+07:00
https://baomoi.com/thua-thien-hue-thi-xa-huong-thuy-thong-qua-quy-hoach-su-dung-dat-giai-doan-2021-2030/c/43870330.epi,Thừa Thiên Huế: Thị xã Hương Thủy thông qua quy hoạch sử dụng đất giai đoạn 2021-2030,Tạp chí Doanh Nghiệp Việt Nam,2022-09-30T11:45:00+07:00
https://baomoi.com/de-xuat-tang-gan-20-000-ty-dong-cho-sieu-du-an-vanh-dai-3-tphcm/c/43870268.epi,Đề xuất tăng gần 20.000 tỷ đồng cho 'siêu dự án' vành đai 3 TPHCM,Báo Tiền Phong,2022-09-30T11:43:00+07:00
https://baomoi.com/thach-that-ha-noi-cong-trinh-khung-xay-dung-trai-phep-tren-dat-nong-truong/c/43870439.epi,Thạch Thất (Hà Nội): Công trình 'khủng' xây dựng trái phép trên đất nông trường,Bảo Vệ Công Lý,2022-09-30T11:56:00+07:00
https://baomoi.com/ha-noi-them-2-khu-tap-the-cu-duoc-pha-do-xay-moi-vao-cuoi-nam-2023/c/43870215.epi,"Hà Nội: Thêm 2 khu tập thể cũ được phá dỡ, xây mới vào cuối năm 2023",Báo VietnamPlus,2022-09-30T11:36:00+07:00
https://baomoi.com/doanh-nghiep-lam-du-an-xam-hai-dao-hon-mieu-trong-vinh-nha-trang/c/43870269.epi,"Doanh nghiệp làm dự án, xâm hại đảo Hòn Miễu trong vịnh Nha Trang",Báo VietnamNet,2022-09-30T11:36:00+07:00
https://baomoi.com/7-kieu-nha-dia-the-xau-cang-o-cang-hao-tai-ton-loc/c/43870144.epi,7 kiểu nhà địa thế xấu càng ở càng hao tài tốn lộc,Tạp chí Gia Đình Việt Nam,2022-09-30T11:30:00+07:00
https://baomoi.com/sua-doi-chinh-sach-dat-dai-trong-nong-nghiep-dam-bao-quyen-loi-nguoi-dan/c/43870198.epi,"Sửa đổi chính sách đất đai trong nông nghiệp, đảm bảo quyền lợi người dân",Báo Tin Tức TTXVN,2022-09-30T11:25:00+07:00
https://baomoi.com/chung-cu-so-huu-co-thoi-han-se-van-hut-khach-vi-gia-tot/c/43870166.epi,Chung cư sở hữu có thời hạn sẽ vẫn hút khách vì giá 'tốt',Doanh Nhân VN,2022-09-30T11:23:00+07:00
https://baomoi.com/nguy-co-cao-toc-ben-luc-long-thanh-tiep-tuc-sa-lay-vi-vec/c/43870183.epi,Nguy cơ cao tốc Bến Lức - Long Thành tiếp tục sa lầy vì... VEC,Tạp Chí Giao Thông Vận Tải,2022-09-30T11:23:00+07:00
https://baomoi.com/ha-noi-them-2-khu-tap-the-cu-se-duoc-pha-do-xay-moi-vao-cuoi-nam-2023/c/43870200.epi,"Hà Nội: Thêm 2 khu tập thể cũ sẽ được phá dỡ, xây mới vào cuối năm 2023",Báo Tin Tức TTXVN,2022-09-30T11:22:00+07:00
https://baomoi.com/kham-pha-4-ngoi-nha-ky-la-tren-the-gioi/c/43870049.epi,Khám phá 4 ngôi nhà 'kỳ lạ' trên thế giới,Báo Gia Đình & Xã Hội,2022-09-30T11:19:00+07:00
https://baomoi.com/cu-tri-quan-thanh-xuan-tan-thanh-cao-viec-quoc-hoi-se-xem-xet-thong-qua-luat-thuc-hien-dan-chu-o-co-so/c/43870615.epi,"Cử tri quận Thanh Xuân tán thành cao việc Quốc hội sẽ xem xét, thông qua Luật Thực hiện dân chủ ở cơ sở",Báo Hà Nội Mới,2022-09-30T11:16:00+07:00
https://baomoi.com/quang-ngai-tim-huong-xu-ly-cac-ngoi-nha-thuoc-so-huu-nha-nuoc/c/43869869.epi,Quảng Ngãi tìm hướng xử lý các ngôi nhà thuộc sở hữu Nhà nước,Báo Đầu Tư,2022-09-30T11:09:00+07:00
https://baomoi.com/thai-nguyen-dieu-chuyen-von-cac-du-an-dau-tu-cong-khong-dam-bao-tien-do/c/43869916.epi,Thái Nguyên: Điều chuyển vốn các dự án đầu tư công không đảm bảo tiến độ,Báo Xây Dựng,2022-09-30T11:07:00+07:00
https://baomoi.com/thi-truong-bat-dong-san-can-tho-hua-hen-soi-dong-vao-cuoi-nam-2022/c/43869938.epi,Thị trường bất động sản Cần Thơ hứa hẹn sôi động vào cuối năm 2022,Báo Kinh Tế Đô Thị,2022-09-30T11:05:00+07:00
https://baomoi.com/7-yeu-to-nang-cao-tham-my-cho-khong-gian-noi-that/c/43869812.epi,7 yếu tố nâng cao thẩm mỹ cho không gian nội thất,Báo Người Lao Động,2022-09-30T11:04:13+07:00
https://baomoi.com/vinaconex-trung-thau-thi-cong-goi-coc-mong-cac-cong-trinh-phuc-vu-quan-ly-bay-cang-hang-khong-quoc-te-long-thanh/c/43869798.epi,Vinaconex trúng thầu thi công gói cọc móng các công trình phục vụ quản lý bay Cảng hàng không quốc tế Long Thành,Thời báo Tài chính,2022-09-30T11:02:00+07:00
https://baomoi.com/co-duoc-ky-phu-luc-de-dieu-chinh-co-cau-trong-hop-dong/c/43869803.epi,Có được ký phụ lục để điều chỉnh cơ cấu trong hợp đồng?,Báo Chính Phủ,2022-09-30T11:02:00+07:00
https://baomoi.com/de-xuat-chuyen-hang-ngan-hecta-dat-lua-o-tphcm-lam-du-an-bat-dong-san/c/43869839.epi,Đề xuất chuyển hàng ngàn hecta đất lúa ở TPHCM làm dự án bất động sản,Tạp chí Kinh Tế Sài Gòn,2022-09-30T11:00:09+07:00
https://baomoi.com/lay-y-kien-tham-gia-du-an-luat-dat-dai-sua-doi/c/43869800.epi,Lấy ý kiến tham gia Dự án Luật Đất đai (sửa đổi),Thái Nguyên,2022-09-30T11:00:00+07:00
https://baomoi.com/nen-xem-xet-de-xuat-hoan-doi-quy-dat-20-xay-nha-o-xa-hoi/c/43869939.epi,Nên xem xét đề xuất hoán đổi quỹ đất 20% xây nhà ở xã hội,Báo Kinh Tế Đô Thị,2022-09-30T10:54:00+07:00
https://baomoi.com/thi-xa-bim-son-thuc-hien-nao-vet-long-song-tam-diep/c/43869966.epi,Thị xã Bỉm Sơn: Thực hiện nạo vét lòng sông Tam Điệp,Báo Thanh Hóa,2022-09-30T10:54:00+07:00
https://baomoi.com/hoan-thanh-2-pho-di-bo-dau-tien-tai-thai-nguyen/c/27867251.epi,Hoàn thành 2 phố đi bộ đầu tiên tại Thái Nguyên,Thái Nguyên,2022-09-30T10:49:00+07:00
https://baomoi.com/cong-nhan-danh-hieu-6-phuong-xa-kieu-mau/c/43869855.epi,"Công nhận danh hiệu 6 phường, xã kiểu mẫu",Báo Thanh Hóa,2022-09-30T10:42:00+07:00
https://baomoi.com/119-co-quan-don-vi-duoc-cong-nhan-co-quan-don-vi-kieu-mau/c/43869856.epi,"119 cơ quan, đơn vị được công nhận 'Cơ quan, đơn vị kiểu mẫu'",Báo Thanh Hóa,2022-09-30T10:38:00+07:00
