url,title,publisher,time
https://baomoi.com/hoi-nghi-ban-thuong-vu-tinh-uy/c/43840868.epi,Hội nghị Ban Thường vụ Tỉnh ủy,Báo Quảng Ninh,2022-09-27T14:49:39+07:00
https://baomoi.com/quoc-hoi-giam-sat-truy-den-cung-lam-ro-trach-nhiem/c/43840858.epi,"Quốc hội giám sát 'truy đến cùng', làm rõ trách nhiệm",Báo VOV,2022-09-27T14:43:00+07:00
https://baomoi.com/quang-cao-dat-nen-o-tp-hcm-gap-khach-hang-lai-cheo-keo-du-an-o-binh-duong/c/43840722.epi,"Quảng cáo đất nền ở TP.HCM, gặp khách hàng lại chèo kéo dự án ở Bình Dương",Báo VietnamNet,2022-09-27T14:34:00+07:00
https://baomoi.com/dong-nai-chan-chinh-cong-tac-quan-ly-quy-hoach-va-trat-tu-xay-dung/c/43840742.epi,Đồng Nai chấn chỉnh công tác quản lý quy hoạch và trật tự xây dựng,Chuyên trang Vietnamdaily - Báo Tri thức & Cuộc sống,2022-09-27T14:32:00+07:00
https://baomoi.com/nhan-vien-cong-ty-dai-an-loc-bi-xu-phat-vi-rao-ban-du-an-ma/c/43840744.epi,Nhân viên Công ty Đại An Lộc bị xử phạt vì rao bán dự án 'ma',Chuyên trang Vietnamdaily - Báo Tri thức & Cuộc sống,2022-09-27T14:31:00+07:00
https://baomoi.com/dieu-kien-de-cac-ho-dan-dang-sinh-song-tren-song-duoc-ho-tro-dat-o/c/43842519.epi,Điều kiện để các hộ dân đang sinh sống trên sông được hỗ trợ đất ở,Báo Thanh Hóa,2022-09-27T14:28:00+07:00
https://baomoi.com/can-bo-sung-quy-dinh-lien-quan-mat-tran-to-quoc-trong-giam-sat-thuc-hien-chinh-sach-phap-luat-ve-dat-dai/c/43840534.epi,Cần bổ sung quy định liên quan Mặt trận Tổ quốc trong giám sát thực hiện chính sách pháp luật về đất đai,Báo Nghệ An,2022-09-27T14:23:00+07:00
https://baomoi.com/giai-quyet-kien-nghi-cua-cong-dan-pham-thi-tuoi-truoc-ngay-30-10-2022/c/43840606.epi,Giải quyết kiến nghị của công dân Phạm Thị Tươi trước ngày 30/10/2022,Thái Nguyên,2022-09-27T14:22:00+07:00
https://baomoi.com/chinh-phu-chi-dao-thanh-tra-cap-phep-khai-thac-khoang-san-lam-vat-lieu-xay-dung/c/43841503.epi,Chính phủ chỉ đạo thanh tra cấp phép khai thác khoáng sản làm vật liệu xây dựng,Báo Xây Dựng,2022-09-27T14:17:00+07:00
https://baomoi.com/tang-cuong-ra-soat-chenh-lech-von-chu-so-huu-so-voi-von-dieu-le-cua-doanh-nghiep/c/43847880.epi,Tăng cường rà soát chênh lệch vốn chủ sở hữu so với vốn điều lệ của doanh nghiệp,Báo Thanh Hóa,2022-09-27T14:13:00+07:00
https://baomoi.com/ra-soat-ty-le-ket-noi-dong-bo-xu-ly-ho-so-tren-cong-dich-vu-cong-quoc-gia/c/43842394.epi,"Rà soát tỷ lệ kết nối, đồng bộ xử lý hồ sơ trên Cổng Dịch vụ công Quốc gia",Báo Thanh Hóa,2022-09-27T14:06:00+07:00
https://baomoi.com/bo-van-hoa-the-thao-va-du-lich-bai-bo-05-vbqppl/c/43840252.epi,"Bộ Văn hóa, Thể thao và Du lịch bãi bỏ 05 VBQPPL",Báo Quảng Ngãi,2022-09-27T14:03:00+07:00
https://baomoi.com/ha-noi-thuc-tien-do-du-an-thoat-nuoc-7-000-ty-phai-hoan-thanh-dau-nam-2023/c/43840250.epi,Hà Nội: Thúc tiến độ dự án thoát nước 7.000 tỷ phải hoàn thành đầu năm 2023,Báo Đại Đoàn Kết,2022-09-27T14:02:00+07:00
https://baomoi.com/dong-anh-20-275-ho-so-ve-dat-dai-duoc-tiep-nhan-tu-thang-1-7-2022/c/43840336.epi,Đông Anh: 20.275 hồ sơ về đất đai được tiếp nhận từ tháng 1-7/2022,Tạp chí VnEconomy,2022-09-27T14:01:00+07:00
https://baomoi.com/quan-chat-xay-dung-chung-cu-cao-tang-trong-noi-thanh-de-giam-un-tac-giao-thong/c/43840337.epi,Quản chặt xây dựng chung cư cao tầng trong nội thành để giảm ùn tắc giao thông,Tạp chí VnEconomy,2022-09-27T14:01:00+07:00
https://baomoi.com/uniqlo-mo-rong-he-thong-ban-le-tai-thi-truong-viet-nam/c/43841377.epi,UNIQLO mở rộng hệ thống bán lẻ tại thị trường Việt Nam,Tạp chí VnEconomy,2022-09-27T14:01:00+07:00
https://baomoi.com/dong-tho-du-an-cho-va-thuong-mai-dich-vu-tai-tp-dien-bien-phu/c/43840461.epi,Động thổ dự án Chợ và Thương mại dịch vụ tại TP. Điện Biên Phủ,Báo VietnamNet,2022-09-27T14:00:00+07:00
https://baomoi.com/vo-chong-tre-cai-tao-nha-cap-4-cu-nat-thanh-khong-gian-dep-me-dam/c/43840769.epi,Vợ chồng trẻ cải tạo nhà cấp 4 cũ nát thành không gian đẹp mê đắm,Báo VietnamNet,2022-09-27T14:00:00+07:00
https://baomoi.com/lap-ke-hoach-dau-tu-von-ngan-sach-nha-nuoc-chua-sat-voi-kha-nang-thuc-hien/c/43840451.epi,Lập kế hoạch đầu tư vốn ngân sách nhà nước chưa sát với khả năng thực hiện,Tạp Chí Tài Chính,2022-09-27T13:58:00+07:00
https://baomoi.com/dung-bo-trong-hanh-lang-trong-can-nha-cua-ban/c/43840130.epi,Đừng bỏ trống hành lang trong căn nhà của bạn,Báo Gia Đình & Xã Hội,2022-09-27T13:49:00+07:00
https://baomoi.com/giai-quyet-dut-diem-ton-tai-cua-8-tram-thu-phi-du-an-bot-giao-thong/c/43840159.epi,"Giải quyết dứt điểm tồn tại của 8 trạm thu phí, dự án BOT giao thông",Báo VietnamPlus,2022-09-27T13:42:00+07:00
https://baomoi.com/binh-phuoc-chinh-thuc-thanh-lap-thi-xa-chon-thanh/c/43840048.epi,Bình Phước chính thức thành lập thị xã Chơn Thành,Báo Tiền Phong,2022-09-27T13:41:00+07:00
https://baomoi.com/cam-lam-huy-nhieu-quyet-dinh-chuyen-muc-dich-su-dung-dat/c/43840034.epi,Cam Lâm hủy nhiều quyết định chuyển mục đích sử dụng đất,Tạp chí Tri Thức Trực Tuyến,2022-09-27T13:54:29+07:00
https://baomoi.com/ctcp-dau-tu-bds-son-kim-sap-phat-hanh-500-ty-dong-trai-phieu/c/43840141.epi,CTCP Đầu tư BĐS Sơn Kim sắp phát hành 500 tỷ đồng trái phiếu,Tài Chính Doanh Nghiệp,2022-09-27T13:38:00+07:00
https://baomoi.com/huy-nhieu-quyet-dinh-chuyen-muc-dich-su-dung-dat-tai-cam-lam/c/43847443.epi,Hủy nhiều quyết định chuyển mục đích sử dụng đất tại Cam Lâm,Báo Kinh Tế Đô Thị,2022-09-27T13:31:00+07:00
https://baomoi.com/so-ke-dinh-thu-trieu-do-cua-ho-ngoc-ha-le-quyen/c/43839951.epi,So kè dinh thự triệu đô của Hồ Ngọc Hà - Lệ Quyên,Báo Kiến Thức,2022-09-27T13:30:00+07:00
https://baomoi.com/bo-van-hoa-yeu-cau-quan-ly-chat-cac-cuoc-thi-nhan-sac-huy-ket-qua-quoc-thi-vi-pham-phap-luat/c/43839916.epi,"Bộ Văn hóa yêu cầu quản lý chặt các cuộc thi nhan sắc, hủy kết quả quộc thi vi phạm pháp luật",Tạp chí SaoStar,2022-09-27T13:24:00+07:00
https://baomoi.com/ve-nong-thon-thanh-do-thi-tam-voc-toan-cau-hang-dau-the-gioi/c/43839885.epi,"'Vẽ' nông thôn thành đô thị 'tầm vóc toàn cầu', 'hàng đầu thế giới'",Tạp chí Người Đô Thị,2022-09-27T13:22:00+07:00
https://baomoi.com/giai-quyet-dut-diem-cac-ton-tai-cua-8-tram-thu-phi-du-an-bot-giao-thong/c/43839811.epi,"Giải quyết dứt điểm các tồn tại của 8 trạm thu phí, dự án BOT giao thông",Bnews,2022-09-27T13:14:00+07:00
https://baomoi.com/huy-hang-loat-quyet-dinh-chuyen-muc-dich-su-dung-dat-o-cam-lam/c/43839803.epi,Hủy hàng loạt quyết định chuyển mục đích sử dụng đất ở Cam Lâm,Báo Người Lao Động,2022-09-27T13:11:45+07:00
https://baomoi.com/chi-dao-moi-nhat-cua-tinh-lam-dong-ve-phan-lo-tach-thua-dat/c/43839866.epi,"Chỉ đạo mới nhất của tỉnh Lâm Đồng về phân lô, tách thửa đất",Chuyên trang Vietnamdaily - Báo Tri thức & Cuộc sống,2022-09-27T13:11:00+07:00
https://baomoi.com/dong-nai-xem-xet-trach-nhiem-nguoi-dung-dau-buong-long-quan-ly-quy-hoach-xay-dung/c/43839782.epi,"Đồng Nai xem xét trách nhiệm người đứng đầu buông lỏng quản lý quy hoạch, xây dựng.",Báo Tiền Phong,2022-09-27T13:09:00+07:00
https://baomoi.com/cong-an-vach-tran-manh-loi-cua-chu-trang-facebook-dat-nen-quan-10/c/43839728.epi,Công an vạch trần mánh lới của chủ trang facebook 'Đất nền quận 10',Báo Người Lao Động,2022-09-27T13:03:47+07:00
https://baomoi.com/chon-tham-cho-tung-can-phong-cua-ban/c/43839667.epi,Chọn thảm cho từng căn phòng của bạn,Tạp chí Tri Thức Trực Tuyến,2022-09-27T13:11:42+07:00
https://baomoi.com/chinh-thuc-ra-mat-du-an-tnr-stars-dong-hoi-tai-quang-binh/c/43839765.epi,Chính thức ra mắt dự án TNR Stars Đồng Hới tại Quảng Bình,Tạp chí Gia Đình Việt Nam,2022-09-27T12:52:00+07:00
https://baomoi.com/tu-1-10-chinh-thuc-van-hanh-cuc-duong-bo-viet-nam/c/43839816.epi,Từ 1/10 chính thức vận hành Cục Đường bộ Việt Nam,Bnews,2022-09-27T12:52:00+07:00
https://baomoi.com/rao-ban-dat-nen-o-quan-10-ma-dan-den-du-an-o-binh-duong-bi-xu-ly-hanh-chinh/c/43839532.epi,"Rao bán đất nền ở quận 10 mà dẫn đến dự án ở Bình Dương, bị xử lý hành chính",Báo Pháp Luật TP.HCM,2022-09-27T12:36:54+07:00
https://baomoi.com/hoang-tan-toa-cao-oc-nghin-ty-dap-chieu-tren-dat-vang-ha-noi/c/43839523.epi,Hoang tàn tòa cao ốc nghìn tỷ 'đắp chiếu' trên đất vàng Hà Nội,Báo Tiền Phong,2022-09-27T12:34:00+07:00
https://baomoi.com/3-dieu-loi-cua-nha-pho-2-mat-tien/c/43839506.epi,3 điều lợi của nhà phố 2 mặt tiền,Báo Pháp Luật TP.HCM,2022-09-27T12:33:46+07:00
https://baomoi.com/tiep-thu-chinh-ly-hoan-chinh-du-thao-nghi-dinh-ve-quan-ly-cua-khau-bien-gioi-dat-lien/c/43839490.epi,Tiếp thu chỉnh lý hoàn chỉnh dự thảo Nghị định về quản lý cửa khẩu biên giới đất liền,Báo Biên phòng,2022-09-27T12:33:00+07:00
https://baomoi.com/minh-bach-thong-tin-dia-oc-chuyen-cu-van-moi/c/43839571.epi,"Minh bạch thông tin địa ốc, chuyện cũ vẫn mới",Báo Đầu Tư Chứng Khoán,2022-09-27T12:32:00+07:00
https://baomoi.com/no-luc-hoi-sinh-song-cau-bay/c/43839486.epi,Nỗ lực 'hồi sinh' sông Cầu Bây,Báo Kinh Tế Đô Thị,2022-09-27T12:30:00+07:00
https://baomoi.com/hien-thuc-hoa-giac-mo-an-cu-cho-nguoi-lao-dong/c/43839563.epi,Hiện thực hóa giấc mơ an cư cho người lao động,Báo Kinh Tế Đô Thị,2022-09-27T12:30:00+07:00
https://baomoi.com/ong-dung-lo-voi-cham-dut-thuong-vu-chuyen-nhuong-kdc-dai-nam-cho-vinasing/c/43839533.epi,Ông Dũng 'lò vôi' chấm dứt thương vụ chuyển nhượng KDC Đại Nam cho Vinasing,Báo VTC News,2022-09-27T12:22:00+07:00
https://baomoi.com/dong-nai-thanh-lap-2-to-cong-tac-xu-ly-phan-anh-nong-ve-xay-dung-dat-dai/c/43839374.epi,"Đồng Nai: Thành lập 2 tổ công tác xử lý phản ánh nóng về xây dựng, đất đai",Báo Pháp Luật TP.HCM,2022-09-27T12:21:27+07:00
https://baomoi.com/du-an-tram-bom-nghin-ty-dong-cham-tien-do-2-so-o-ha-noi-bi-nhac-ten/c/43839387.epi,"Dự án trạm bơm nghìn tỷ đồng chậm tiến độ, 2 Sở ở Hà Nội bị nhắc tên",Báo VTC News,2022-09-27T12:21:07+07:00
https://baomoi.com/xu-ly-cuong-quyet-du-an-khu-nha-o-du-lich-sinh-thai-au-co/c/43839385.epi,Xử lý cương quyết Dự án Khu nhà ở du lịch sinh thái Âu Cơ,Báo Nhân Dân,2022-09-27T12:18:00+07:00
https://baomoi.com/xen-dat-tru-so-hdnd-ubnd-tp-ha-noi-de-xay-ga-ngam-metro-sat-ho-hoan-kiem/c/43839342.epi,Xén đất trụ sở HĐND - UBND TP Hà Nội để xây ga ngầm Metro sát hồ Hoàn Kiếm,Báo Người Lao Động,2022-09-27T12:16:27+07:00
https://baomoi.com/thanh-tra-chinh-phu-len-ke-hoach-xac-minh-tai-san-cua-30-nguoi-co-chuc-vu-quyen-han/c/43839271.epi,"Thanh tra Chính phủ lên kế hoạch xác minh tài sản của 30 người có chức vụ, quyền hạn",Báo Tiền Phong,2022-09-27T12:07:00+07:00
https://baomoi.com/tinh-tiet-bat-thuong-vu-thi-the-cu-ba-95-tuoi-chon-trong-vuon-nha-con-trai/c/43863202.epi,Tình tiết bất thường vụ thi thể cụ bà 95 tuổi chôn trong vườn nhà con trai,Báo Giao Thông,
https://baomoi.com/thieu-nien-bi-canh-sat-duoi-theo-danh-dap-noi-gi/c/43864629.epi,Thiếu niên bị cảnh sát đuổi theo đánh đập nói gì?,Báo VTC News,
https://baomoi.com/vot-chiec-vali-la-troi-noi-tren-song-nguoi-dan-soc-nang-khi-mo-ra/c/43866863.epi,"Vớt chiếc vali 'lạ' trôi nổi trên sông, người dân sốc nặng khi mở ra",Tạp chí SaoStar,2022-09-30T07:00:00+07:00
https://baomoi.com/ket-dau-long-cua-nu-dai-gia-sau-khi-vao-khach-san-voi-huan-luyen-vien-gym/c/43868351.epi,Kết đau lòng của nữ đại gia sau khi vào khách sạn với huấn luyện viên gym,Báo VietnamNet,2022-09-30T09:08:00+07:00
https://baomoi.com/hien-truong-7-thi-the-troi-dat-o-bai-bien-phu-quoc/c/43864061.epi,Hiện trường 7 thi thể trôi dạt ở bãi biển Phú Quốc,Tạp chí Tri Thức Trực Tuyến,
https://baomoi.com/dang-giua-chuyen-bay-vo-phat-hien-chong-chet-tren-ghe-may-bay/c/43864902.epi,"Đang giữa chuyến bay, vợ phát hiện chồng chết trên ghế máy bay",Báo Người Lao Động,
https://baomoi.com/ba-luat-su-bao-chua-cho-ba-nguyen-phuong-hang/c/43866209.epi,Ba luật sư bào chữa cho bà Nguyễn Phương Hằng,Báo Tiền Phong,2022-09-30T05:37:00+07:00
https://baomoi.com/an-mang-dau-long-gia-dinh-tan-nat/c/43864558.epi,"Án mạng đau lòng, gia đình tan nát",Báo Người Lao Động,
https://baomoi.com/ha-noi-chu-so-huu-khu-dat-vang-o-quan-hoang-mai-bi-ngan-hang-rao-ban-no-khung/c/43872056.epi,Hà Nội: Chủ sở hữu khu đất vàng ở quận Hoàng Mai bị ngân hàng rao bán nợ khủng,Báo Infonet,2022-09-30T15:03:00+07:00
https://baomoi.com/bidv-ban-khoan-no-hon-4-900-ty-cua-chu-dau-tu-du-an-kenton-node/c/43849773.epi,BIDV bán khoản nợ hơn 4.900 tỷ của chủ đầu tư dự án Kenton Node,Báo Đại Đoàn Kết,2022-09-28T11:23:00+07:00
https://baomoi.com/bidv-dai-ha-gia-toi-410-ty-dong-khoan-no-4-900-ty-cua-chu-dau-tu-du-an-kenton/c/43825182.epi,BIDV đại hạ giá tới 410 tỷ đồng khoản nợ 4.900 tỷ của chủ đầu tư dự án Kenton,Chuyên trang Vietnamdaily - Báo Tri thức & Cuộc sống,2022-09-26T07:08:00+07:00
https://baomoi.com/nhieu-ngan-hang-giam-gia-ban-tai-san-the-chap-de-thu-hoi-no/c/43801390.epi,Nhiều ngân hàng giảm giá bán tài sản thế chấp để thu hồi nợ,Báo Sài Gòn Giải Phóng,2022-09-23T07:02:00+07:00
https://baomoi.com/nhieu-ngan-hang-rao-ban-tai-san-khung-voi-gia-beo/c/43722360.epi,Nhiều ngân hàng rao bán tài sản 'khủng' với giá bèo,Báo Pháp Luật TP.HCM,2022-09-14T12:01:31+07:00
https://baomoi.com/pho-tong-thong-my-toi-han-quoc-de-tran-an-them-han-gan/c/43861973.epi,"Phó Tổng thống Mỹ tới Hàn Quốc: Để trấn an, thêm hàn gắn",Báo Thế Giới & Việt Nam,
https://baomoi.com/vu-khi-nguy-hiem-doi-voi-eu/c/43858012.epi,'Vũ khí' nguy hiểm đối với EU,Báo Tin Tức TTXVN,
https://baomoi.com/cai-to-hoi-dong-bao-an-lien-hop-quoc-khi-xu-the-cung-chinh-la-diem-nghen/c/43857738.epi,Cải tổ Hội đồng Bảo an Liên hợp quốc: Khi xu thế cũng chính là điểm nghẽn,Báo An Ninh Thế Giới,
https://baomoi.com/van-bai-nang-luong-cua-nga-o-chau-a-trong-boi-canh-xung-dot-ukraine/c/43856483.epi,Ván bài năng lượng của Nga ở châu Á trong bối cảnh xung đột Ukraine,Báo VOV,
https://baomoi.com/ai-duoc-huong-loi-tu-kich-ban-dong-chay-phuong-bac-bi-pha-hoai/c/43854709.epi,Ai được hưởng lợi từ kịch bản Dòng chảy phương Bắc bị phá hoại?,Báo VOV,
https://baomoi.com/tac-dong-toan-cau-sau-khi-fed-tang-lai-suat-len-cao-nhat-tu-nam-2008/c/43851284.epi,Tác động toàn cầu sau khi FED tăng lãi suất lên cao nhất từ năm 2008,Báo Tin Tức TTXVN,
https://baomoi.com/nguoi-phu-nu-khien-ca-chau-au-lo-lang/c/43847833.epi,Người phụ nữ khiến cả châu Âu lo lắng,Tạp chí Tri Thức Trực Tuyến,
https://baomoi.com/chinh-phu-moi-o-italy-se-tac-dong-the-nao-voi-eu-va-cuoc-xung-dot-nga-ukraine/c/43845884.epi,Chính phủ mới ở Italy sẽ tác động thế nào với EU và cuộc xung đột Nga - Ukraine?,Báo Tin Tức TTXVN,
https://baomoi.com/ha-noi-kiem-diem-2-so-cham-tien-do-du-an-tram-bom-yen-nghia-4-300-ty-dong/c/43839247.epi,Hà Nội kiểm điểm 2 sở chậm tiến độ dự án Trạm bơm Yên Nghĩa 4.300 tỷ đồng,Báo Công An Nhân Dân,2022-09-27T11:59:00+07:00
https://baomoi.com/cho-mot-da-lat-phat-trien-hai-hoa-giau-ban-sac-van-hoa/c/43858295.epi,"Cho một Đà Lạt phát triển hài hòa, giàu bản sắc văn hóa",Báo Chính Phủ,2022-09-27T11:59:00+07:00
https://baomoi.com/go-the-vang-iuu-pho-thu-tuong-yeu-cau-mo-dot-cao-diem-kiem-tra/c/43839173.epi,"Gỡ 'thẻ vàng' IUU, Phó Thủ tướng yêu cầu mở đợt cao điểm kiểm tra",Báo VietnamNet,2022-09-27T11:56:00+07:00
https://baomoi.com/chuyen-320-can-bo-tu-tong-cuc-ve-cuc-duong-bo-viet-nam/c/43839262.epi,Chuyển 320 cán bộ từ Tổng cục về Cục Đường bộ Việt Nam,Báo Giao Thông,2022-09-27T11:53:00+07:00
https://baomoi.com/thanh-tra-chi-ro-nhieu-vi-pham-trong-dau-thau-tai-huyen-dien-bien/c/43839142.epi,Thanh tra chỉ rõ nhiều vi phạm trong đấu thầu tại huyện Điện Biên,Báo Đầu Tư,2022-09-27T11:52:00+07:00
https://baomoi.com/ha-noi-kien-nghi-ve-viec-bo-tri-quy-dat-cho-nha-o-xa-hoi/c/43839140.epi,Hà Nội kiến nghị về việc bố trí quỹ đất cho nhà ở xã hội,Bnews,2022-09-27T11:51:00+07:00
https://baomoi.com/dat-vang-o-tp-hcm-bi-vinafood-2-thau-tom-ai-huong-loi-hang-nghin-ty-dong/c/43839181.epi,Đất 'vàng' ở TP.HCM bị Vinafood 2 thâu tóm: Ai hưởng lợi hàng nghìn tỷ đồng?,Báo VTC News,2022-09-27T11:42:33+07:00
https://baomoi.com/binh-phuoc-canh-bao-viec-lap-vi-bang-mua-ban-nha-o-xa-hoi-la-trai-luat/c/43839048.epi,Bình Phước cảnh báo việc lập vi bằng mua bán nhà ở xã hội là trái luật,Bnews,2022-09-27T11:40:00+07:00
https://baomoi.com/bo-ke-hoach-va-dau-tu-dong-thuan-giao-von-cho-du-an-ham-deo-ca/c/43839027.epi,Bộ Kế hoạch và Đầu tư đồng thuận giao vốn cho dự án hầm Đèo Cả,Báo Nhân Dân,2022-09-27T11:38:00+07:00
https://baomoi.com/ubnd-tinh-thanh-hoa-xu-phat-amd-do-khai-thac-khoang-san-vuot-moc-gioi/c/43838776.epi,UBND tỉnh Thanh Hóa xử phạt AMD do khai thác khoáng sản vượt mốc giới,Chuyên trang Vietnamdaily - Báo Tri thức & Cuộc sống,2022-09-27T11:20:00+07:00
https://baomoi.com/co-500-trieu-dong-nen-vay-them-de-mua-nha-hay-o-thue/c/43838772.epi,"Có 500 triệu đồng, nên vay thêm để mua nhà hay ở thuê?",Báo Phụ Nữ Việt Nam,2022-09-27T11:07:00+07:00
https://baomoi.com/can-tiep-tuc-the-che-hoa-day-du-hien-phap-2013-vao-du-thao-luat-dat-dai-sua-doi/c/43838782.epi,Cần tiếp tục thể chế hóa đầy đủ Hiến pháp 2013 vào dự thảo Luật Đất đai sửa đổi,Bảo Vệ Công Lý,2022-09-27T11:17:00+07:00
https://baomoi.com/tram-bom-tieu-4-700-ty-cham-tien-do-2-so-o-ha-noi-bi-neu-ten/c/43839477.epi,"Trạm bơm tiêu 4.700 tỷ chậm tiến độ, 2 Sở ở Hà Nội bị nêu tên",Tạp chí Người Đưa Tin,2022-09-27T11:00:00+07:00
https://baomoi.com/tram-bom-nghin-ty-khat-nuoc-hai-so-cua-ha-noi-bi-beu-ten/c/43838471.epi,"Trạm bơm nghìn tỷ 'khát nước', hai sở của Hà Nội bị 'bêu' tên",Báo VietnamNet,2022-09-27T10:55:00+07:00
https://baomoi.com/so-xay-dung-quang-ngai-bac-de-xuat-dau-tu-khu-do-thi-sinh-thai-ven-song-tra-khuc/c/43838649.epi,Sở Xây dựng Quảng Ngãi 'bác' đề xuất đầu tư Khu đô thị sinh thái ven sông Trà Khúc,Tạp chí VnEconomy,2022-09-27T10:53:00+07:00
https://baomoi.com/phat-trien-kinh-te-vung-dong-bao-dan-toc-thieu-so-mien-nui-can-long-ghep-nguon-von-chuong-trinh-muc-tieu-quoc-gia/c/43838481.epi,"Phát triển kinh tế vùng đồng bào dân tộc thiểu số, miền núi: Cần lồng ghép nguồn vốn chương trình mục tiêu quốc gia",Báo Công Thương,2022-09-27T10:49:58+07:00
https://baomoi.com/can-tho-thong-nhat-cung-kien-giang-dong-thap-phat-trien-cac-du-an-tuyen-lien-ket-vung/c/43838404.epi,"Cần Thơ thống nhất cùng Kiên Giang, Đồng Tháp phát triển các dự án tuyến liên kết vùng",Tạp chí Doanh Nghiệp Việt Nam,2022-09-27T10:49:00+07:00
https://baomoi.com/dong-nai-chan-chinh-tinh-trang-vi-pham-quy-hoach-do-thi-va-trat-tu-xay-dung/c/43838348.epi,Đồng Nai: Chấn chỉnh tình trạng vi phạm quy hoạch đô thị và trật tự xây dựng,Báo Lao Động Thủ Đô,2022-09-27T10:45:00+07:00
https://baomoi.com/du-an-sdowntown-dang-hoan-thien-thu-tuc-phap-ly/c/43838274.epi,Dự án Sdowntown đang hoàn thiện thủ tục pháp lý,Báo Tiền Phong,2022-09-27T10:41:00+07:00
https://baomoi.com/ngan-hang-o-at-rao-ban-loat-bat-dong-san-cua-chu-dau-tu-de-thu-hoi-no/c/43838225.epi,Ngân hàng ồ ạt rao bán loạt bất động sản của chủ đầu tư để thu hồi nợ,Báo Tiền Phong,2022-09-27T10:37:00+07:00
https://baomoi.com/thua-thien-hue-trien-khai-cong-tac-ung-pho-bao-noru-tren-cac-cong-trinh-xay-dung/c/43838419.epi,Thừa Thiên - Huế: Triển khai công tác ứng phó bão Noru trên các công trình xây dựng,Báo Xây Dựng,2022-09-27T10:37:00+07:00
https://baomoi.com/gach-op-lat-cao-cap-lotus-viet-nam-nang-tam-gia-tri-ngoi-nha-viet/c/43838212.epi,Gạch ốp lát cao cấp Lotus Việt Nam - Nâng tầm giá trị ngôi nhà Việt,Báo VietnamNet,2022-09-27T10:30:00+07:00
https://baomoi.com/vu-dao-trom-1-5-trieu-tan-quang-ai-ky-cap-phep-cho-cty-lilama-lam-du-an-khach-san-tren-dat-mo/c/43838108.epi,"Vụ 'đào trộm' 1,5 triệu tấn quặng: Ai ký cấp phép cho Cty Lilama làm dự án khách sạn trên đất mỏ?",Báo Tiền Phong,2022-09-27T10:28:00+07:00
https://baomoi.com/dat-phong-nghi-qua-traveloka-den-noi-phat-hien-khach-san-da-dung-hoat-dong/c/43838444.epi,"Đặt phòng nghỉ qua Traveloka, đến nơi phát hiện khách sạn đã dừng hoạt động",Đại Biểu Nhân Dân,2022-09-27T10:28:00+07:00
https://baomoi.com/2-so-bi-beu-ten-vi-du-an-tram-bom-gan-5-000-ti-dong-khat-nuoc/c/43838090.epi,2 Sở bị 'bêu tên' vì dự án trạm bơm gần 5.000 tỉ đồng 'khát nước',Báo Người Lao Động,2022-09-27T10:26:01+07:00
https://baomoi.com/chap-thuan-phuong-an-tuyen-va-vi-tri-ga-ngam-c9-theo-phuong-an-1/c/43839145.epi,Chấp thuận phương án tuyến và vị trí ga ngầm C9 theo Phương án 1,Báo Hà Nội Mới,2022-09-27T10:18:00+07:00
https://baomoi.com/cong-ty-ngoc-quynh-lam-dong-bi-tu-choi-cap-phep-du-an-khai-thac-cat-long-song/c/43837967.epi,Công ty Ngọc Quỳnh Lâm Đồng bị từ chối cấp phép dự án khai thác cát lòng sông,Báo Đầu Tư,2022-09-27T10:08:00+07:00
https://baomoi.com/thanh-tra-chinh-phu-xac-minh-tai-san-cua-30-can-bo-trung-uong/c/43837815.epi,Thanh tra Chính phủ xác minh tài sản của 30 cán bộ Trung ương,Báo Pháp Luật TP.HCM,2022-09-27T10:06:41+07:00
https://baomoi.com/3-du-an-san-bay-sap-duoc-xay-dung-trong-thoi-gian-toi/c/43838200.epi,3 dự án sân bay sắp được xây dựng trong thời gian tới,Báo Gia Đình & Xã Hội,2022-09-27T10:04:00+07:00
https://baomoi.com/to-chuc-hoi-nghi-hoi-thao-huong-dan-pho-bien-luat-sua-doi-bo-sung-mot-so-dieu-cua-luat-so-huu-tri-tue-ve-quyen-tac-gia-quyen-lien-quan/c/43837741.epi,"Tổ chức Hội nghị - Hội thảo hướng dẫn, phổ biến Luật sửa đổi, bổ sung một số điều của Luật Sở hữu trí tuệ về quyền tác giả, quyền liên quan",Báo Tổ Quốc,2022-09-27T10:03:00+07:00
https://baomoi.com/vinh-phuc-nong-dan-nhung-lai-khong-the-lam-ruong-vi-dau/c/43837652.epi,"Vĩnh Phúc: Nông dân nhưng lại không thể làm ruộng, vì đâu?",Truyền Hình Quốc Hội Việt Nam,2022-09-27T09:53:00+07:00
https://baomoi.com/dam-bao-an-toan-cong-trinh-truoc-bao-so-4/c/43837714.epi,Đảm bảo an toàn công trình trước bão số 4,Truyền Hình Thông Tấn,2022-09-27T09:50:00+07:00
https://baomoi.com/bai-trong-giu-xe-khong-phep-tai-o-dat-105-lang-ha/c/43837584.epi,Bãi trông giữ xe không phép tại ô đất 105 Láng Hạ,Báo An Ninh Thủ Đô,2022-09-27T09:43:40+07:00
https://baomoi.com/nhung-buc-tuong-don-dieu-tro-nen-thu-hut-hon/c/43837262.epi,Những bức tường đơn điệu trở nên thu hút hơn,Tạp chí Tri Thức Trực Tuyến,2022-09-27T09:42:01+07:00
https://baomoi.com/dau-tu-bat-dong-san-son-kim-huy-dong-500-ti-dong-trai-phieu-de-mua-toa-van-phong-tai-thu-thiem/c/43837308.epi,Đầu tư Bất động sản Sơn Kim huy động 500 tỉ đồng trái phiếu để mua tòa văn phòng tại Thủ Thiêm,VietTimes,2022-09-27T09:27:00+07:00
https://baomoi.com/san-bay-sap-ve-dich-nha-dau-tu-ky-vong-bat-dong-san-phan-thiet/c/43837380.epi,"Sân bay sắp 'về đích', nhà đầu tư kỳ vọng bất động sản Phan Thiết",Đại Biểu Nhân Dân,2022-09-27T09:27:00+07:00
https://baomoi.com/vu-tranh-cai-tam-dung-tach-thua-dat-thuoc-tham-quyen-cua-van-phong-dang-ky-dat-dai-tp-nha-trang/c/43837266.epi,Vụ tranh cãi tạm dừng tách thửa đất: Thuộc thẩm quyền của văn phòng đăng ký đất đai TP Nha Trang,Báo Pháp Luật TP.HCM,2022-09-27T09:26:44+07:00
https://baomoi.com/choang-voi-nhung-can-penthouse-dang-cap-va-xa-xi-bac-nhat-hanh-tinh/c/43837361.epi,Choáng với những căn penthouse đẳng cấp và xa xỉ bậc nhất hành tinh,Tạp chí Petrotimes,2022-09-27T09:20:00+07:00
https://baomoi.com/lap-lang-tu-phat-giua-rung-ea-kiet/c/43837313.epi,Lập làng tự phát giữa rừng Ea Kiết,Báo Quân Đội Nhân Dân,2022-09-27T09:18:00+07:00
https://baomoi.com/da-nang-doanh-nghiep-phong-chong-bao-an-toan-va-bo-tri-san-xuat-kinh-doanh-phu-hop/c/43837120.epi,"Đà Nẵng: Doanh nghiệp phòng, chống bão an toàn và bố trí sản xuất, kinh doanh phù hợp",Báo Đầu Tư,2022-09-27T09:15:00+07:00
