url,title,publisher,time
https://baomoi.com/quoc-lo-1a-ngap-sau-trong-nuoc-o-to-noi-duoi-nhau-un-u-gan-2-cay-so/c/43872338.epi,"Quốc lộ 1A ngập sâu trong nước, ô tô nối đuôi nhau ùn ứ gần 2 cây số",Báo VTC News,2022-09-30T15:20:42+07:00
https://baomoi.com/tuoc-danh-hieu-cand-3-can-bo-cong-an-bao-luc-voi-2-thieu-nien/c/43871770.epi,Tước danh hiệu CAND 3 cán bộ công an bạo lực với 2 thiếu niên,Báo Công An Nhân Dân,2022-09-30T14:12:00+07:00
https://baomoi.com/nong-12-nguoi-tu-vong-tren-con-tau-dang-neo-cach-con-dao-63-hai-ly/c/43873335.epi,Nóng: 12 người tử vong trên con tàu đang neo cách Côn Đảo 63 hải lý,Báo Pháp Luật TP.HCM,2022-09-30T16:35:43+07:00
https://baomoi.com/qatar-lam-chu-nha-giai-u23-chau-a-2024/c/43872611.epi,Qatar làm chủ nhà giải U23 châu Á 2024,Tạp chí Tri Thức Trực Tuyến,2022-09-30T16:01:48+07:00
https://baomoi.com/quoc-lo-1a-ngap-sau-loat-o-to-xep-hang-dai-o-cua-ngo-mien-trung/c/43871886.epi,"Quốc lộ 1A ngập sâu, loạt ô tô xếp hàng dài ở cửa ngõ miền Trung",Báo VietnamNet,2022-09-30T14:51:00+07:00
https://baomoi.com/vot-chiec-vali-la-troi-noi-tren-song-nguoi-dan-soc-nang-khi-mo-ra/c/43866863.epi,"Vớt chiếc vali 'lạ' trôi nổi trên sông, người dân sốc nặng khi mở ra",Tạp chí SaoStar,2022-09-30T07:00:00+07:00
https://baomoi.com/ong-prayut-nhan-phan-quyet/c/43872519.epi,Ông Prayut nhận phán quyết,Tạp chí Tri Thức Trực Tuyến,2022-09-30T15:55:35+07:00
https://baomoi.com/nhung-nguoi-tho-dien-tram-minh-duoi-nuoc-khac-phuc-su-co-dien-sau-bao-noru/c/43872146.epi,Những người thợ điện trầm mình dưới nước khắc phục sự cố điện sau bão Noru,Báo Tiền Phong,2022-09-30T15:05:00+07:00
https://baomoi.com/chu-bo-doi-con-cua-don-bien-phong-tuy-hoa/c/43868820.epi,'Chú bộ đội con' của Đồn Biên phòng Tuy Hòa,Báo VTC News,2022-09-30T09:43:00+07:00
https://baomoi.com/du-khach-quoc-te-cung-nguoi-dan-hoi-an-don-ve-sinh-sau-bao-so-4/c/43870005.epi,Du khách quốc tế cùng người dân Hội An dọn vệ sinh sau bão số 4,Báo VOV,2022-09-30T11:18:00+07:00
https://baomoi.com/chua-xac-dinh-duoc-quoc-tich-cua-7-thi-the-troi-dat-vao-bo-bien-phu-quoc/c/43873095.epi,Chưa xác định được quốc tịch của 7 thi thể trôi dạt vào bờ biển Phú Quốc,Báo Người Lao Động,2022-09-30T16:18:36+07:00
https://baomoi.com/mua-lu-mien-trung-lam-6-nguoi-thiet-mang-va-mat-tich/c/43873542.epi,Mưa lũ miền Trung làm 6 người thiệt mạng và mất tích,Báo Điện tử Đảng cộng sản VN,2022-09-30T16:52:00+07:00
https://baomoi.com/thanh-lap-ban-chi-dao-trien-khai-du-an-duong-vanh-dai-4-vung-thu-do-ha-noi/c/43873764.epi,Thành lập Ban Chỉ đạo triển khai Dự án đường Vành đai 4 - Vùng Thủ đô Hà Nội,Báo Hà Nội Mới,2022-09-30T16:50:00+07:00
https://baomoi.com/cuu-thu-truong-bo-y-te-truong-quoc-cuong-duoc-giam-an-tu/c/43873277.epi,Cựu Thứ trưởng Bộ Y tế Trương Quốc Cường được giảm án tù,Báo VietnamNet,2022-09-30T16:28:00+07:00
https://baomoi.com/myanmar-may-bay-cho-khach-bi-tan-cong-khi-ha-canh-gan-san-bay-loikaw/c/43873024.epi,Myanmar: Máy bay chở khách bị tấn công khi hạ cánh gần sân bay Loikaw,Báo VietnamPlus,2022-09-30T16:12:00+07:00
https://baomoi.com/ha-noi-cay-co-thu-bat-ngo-bat-goc-do-trung-mot-nguoi-phu-nu-dang-di-xe-may/c/43872765.epi,"Hà Nội: Cây cổ thụ bất ngờ bật gốc, đổ trúng một người phụ nữ đang đi xe máy",Báo Infonet,2022-09-30T15:57:00+07:00
https://baomoi.com/tuyen-bo-dao-nha-dam-de-ronaldo-du-bi/c/43873615.epi,Tuyển Bồ Đào Nha dám để Ronaldo dự bị?,Tạp chí Tri Thức Trực Tuyến,2022-09-30T17:15:51+07:00
https://baomoi.com/ba-nguyen-phuong-hang-duoc-gia-dinh-moi-luat-su-noi-tieng-bao-chua/c/43871179.epi,Bà Nguyễn Phương Hằng được gia đình mời luật sư nổi tiếng bào chữa,Báo VietnamNet,2022-09-30T13:55:00+07:00
https://baomoi.com/cho-futsal-viet-nam-giai-ma-dia-chan-saudi-arabia/c/43870468.epi,Chờ futsal Việt Nam giải mã 'địa chấn' Saudi Arabia,Tạp chí Tri Thức Trực Tuyến,2022-09-30T12:19:58+07:00
https://baomoi.com/nguoi-viet-sap-duoc-mua-o-to-xe-may-gia-re/c/43872661.epi,"Người Việt sắp được mua ô tô, xe máy giá rẻ",Báo Pháp Luật TP.HCM,2022-09-30T15:48:05+07:00
https://baomoi.com/my-ra-thong-bao-quan-trong-ve-mau-ho-chieu-moi-cua-viet-nam/c/43870936.epi,Mỹ ra thông báo quan trọng về mẫu hộ chiếu mới của Việt Nam,Tạp chí Tri Thức Trực Tuyến,2022-09-30T13:38:31+07:00
https://baomoi.com/mot-pho-giam-doc-trung-tam-hanh-chinh-cong-bi-dinh-chi-cong-tac-sau-to-cao-cua-co-gai/c/43873519.epi,Một Phó giám đốc Trung tâm hành chính công bị đình chỉ công tác sau tố cáo của cô gái,Báo Người Lao Động,2022-09-30T16:50:58+07:00
https://baomoi.com/viet-nam-cuba-phan-dau-nang-kim-ngach-thuong-mai-hai-chieu-len-500-trieu-usd/c/43870060.epi,Việt Nam-Cuba phấn đấu nâng kim ngạch thương mại hai chiều lên 500 triệu USD,Báo Chính Phủ,2022-09-30T11:18:00+07:00
https://baomoi.com/tp-ho-chi-minh-16-nam-xay-dung-duoc-19-100-can-nha-o-xa-hoi/c/43864736.epi,TP Hồ Chí Minh: 16 năm xây dựng được 19.100 căn nhà ở xã hội,Báo Kinh Tế Đô Thị,2022-09-29T19:15:00+07:00
https://baomoi.com/cuoc-chien-giua-hai-nua-hagl-o-v-league/c/43870799.epi,Cuộc chiến giữa hai nửa HAGL ở V.League,Tạp chí Tri Thức Trực Tuyến,2022-09-30T13:15:59+07:00
https://baomoi.com/nhung-mien-thao-nguyen-xanh-o-viet-nam-khien-du-khach-luu-luyen-tu-cai-nhin-dau-tien/c/43867841.epi,Những 'miền thảo nguyên xanh' ở Việt Nam khiến du khách lưu luyến từ cái nhìn đầu tiên,Báo Tổ Quốc,2022-09-30T08:28:00+07:00
https://baomoi.com/dong-quay-son-dai-lua-ngoc-bich-giua-ruong-dong-mien-bien-vien/c/43867267.epi,"Dòng Quây Sơn, 'dải lụa' ngọc bích giữa ruộng đồng miền biên viễn",SG Tiếp Thị,2022-09-30T07:18:47+07:00
https://baomoi.com/lo-gach-co-tram-tuoi-o-sa-dec-nhuom-mau-reu-phong-thu-hut-du-khach-hieu-ky/c/43864326.epi,Lò gạch cổ trăm tuổi ở Sa Đéc nhuốm màu rêu phong thu hút du khách hiếu kỳ,Báo VTC News,
https://baomoi.com/tinh-bao-nga-phat-hien-dau-vet-phuong-tay-vu-nord-stream-bi-pha-hoai/c/43873163.epi,Tình báo Nga phát hiện dấu vết 'phương Tây' vụ Nord Stream bị phá hoại,Báo Công An Nhân Dân,2022-09-30T16:19:00+07:00
https://baomoi.com/ky-luat-canh-cao-chu-tich-vien-han-lam-khoa-hoc-xa-hoi-viet-nam-bui-nhat-quang/c/43871969.epi,Kỷ luật cảnh cáo Chủ tịch Viện Hàn lâm Khoa học xã hội Việt Nam Bùi Nhật Quang,Báo Tin Tức TTXVN,2022-09-30T14:49:00+07:00
https://baomoi.com/quan-doi-ukraine-keo-hang-dai-xe-boc-thep-den-zaporozhye/c/43873294.epi,Quân đội Ukraine 'kéo' hàng dài xe bọc thép đến Zaporozhye,Báo Infonet,2022-09-30T16:30:00+07:00
https://baomoi.com/shark-binh-toi-co-loi-voi-cac-con/c/43873158.epi,Shark Bình: 'Tôi có lỗi với các con',Tạp chí Tri Thức Trực Tuyến,2022-09-30T16:39:12+07:00
https://baomoi.com/nguoi-dang-clip-canh-sat-danh-nam-thieu-nien-o-soc-trang-co-vi-pham-phap-luat/c/43873492.epi,Người đăng clip cảnh sát đánh nam thiếu niên ở Sóc Trăng có vi phạm pháp luật?,Báo VTC News,2022-09-30T16:32:13+07:00
https://baomoi.com/benh-vien-cho-ray-se-phai-dong-cua-neu-khong-cho-dung-may-dat-may-muon/c/43870302.epi,"Bệnh viện Chợ Rẫy sẽ phải đóng cửa nếu không cho dùng máy đặt, máy mượn",Báo VietnamNet,2022-09-30T11:42:00+07:00
https://baomoi.com/chu-tich-ha-noi-tran-sy-thanh-nhung-nguoi-bi-bat-deu-co-ting-ting-ca/c/43871012.epi,Chủ tịch Hà Nội Trần Sỹ Thanh: 'Những người bị bắt đều có 'ting ting' cả',Báo Tiền Phong,2022-09-30T13:32:00+07:00
https://baomoi.com/truy-na-chu-quan-beer-club-tiktok/c/43873292.epi,Truy nã chủ quán Beer Club Tiktok,Báo Tin Tức TTXVN,2022-09-30T16:24:00+07:00
https://baomoi.com/nghe-an-ho-tro-bao-dam-luong-thuc-nuoc-uong-cho-nguoi-dan-trong-vung-bi-ngap/c/43873153.epi,"Nghệ An: Hỗ trợ, bảo đảm lương thực, nước uống cho người dân trong vùng bị ngập",Báo Tin Tức TTXVN,2022-09-30T16:15:00+07:00
https://baomoi.com/luc-cau-bat-day-dang-cao-vn-index-dao-chieu-tang-hon-6-diem/c/43873626.epi,"Lực cầu bắt đáy dâng cao, VN-Index đảo chiều tăng hơn 6 điểm",Báo Nhân Dân,2022-09-30T16:58:00+07:00
https://baomoi.com/my-toan-tinh-gi-khi-phat-canh-bao-do-yeu-cau-cong-dan-roi-nga/c/43873327.epi,Mỹ toan tính gì khi phát 'cảnh báo đỏ' yêu cầu công dân rời Nga?,Báo An Ninh Thủ Đô,2022-09-30T16:25:27+07:00
https://baomoi.com/benzema-co-the-an-mung-som-qua-bong-vang-2022/c/43873085.epi,Benzema có thể ăn mừng sớm Quả bóng vàng 2022,Tạp chí Tri Thức Trực Tuyến,2022-09-30T16:33:57+07:00
https://baomoi.com/vui-dap-han-quoc-nhat-ban-khien-bang-co-tuyen-viet-nam-kho-luong/c/43871429.epi,"Vùi dập Hàn Quốc, Nhật Bản khiến bảng có tuyển Việt Nam khó lường",Báo VietnamNet,2022-09-30T17:06:00+07:00
https://baomoi.com/ro-tin-my-tinh-lap-so-chi-huy-ukraine-ong-zelensky-dien-dam-voi-tong-thong-ba-lan/c/43872932.epi,"Rộ tin Mỹ tính lập 'sở chỉ huy Ukraine', ông Zelensky điện đàm với Tổng thống Ba Lan",Báo VietnamNet,2022-09-30T16:04:00+07:00
https://baomoi.com/dien-vien-binh-minh-gay-choang-voi-ngoai-hinh-xuong-cap-tram-trong-mat-den-nhem-di-su-kien/c/43871835.epi,"Diễn viên Bình Minh gây choáng với ngoại hình xuống cấp trầm trọng, mặt đen nhẻm đi sự kiện",Tạp chí SaoStar,2022-09-30T14:48:00+07:00
https://baomoi.com/tong-thu-ky-lhq-keu-goi-nga-khong-sap-nhap-4-vung-cua-ukraine/c/43872013.epi,Tổng thư ký LHQ kêu gọi Nga không sáp nhập 4 vùng của Ukraine,Báo VietnamNet,2022-09-30T15:01:00+07:00
https://baomoi.com/nha-san-xuat-phim-em-va-trinh-xin-loi-giao-su-michiko-yoshii/c/43873280.epi,Nhà sản xuất phim 'Em và Trịnh' xin lỗi giáo sư Michiko Yoshii,Báo VietnamNet,2022-09-30T16:28:00+07:00
https://baomoi.com/te-ngua-ve-thong-tin-ca-si-ngoc-son-so-huu-50-ha-dat-o-binh-thuan/c/43873727.epi,'Té ngửa' về thông tin ca sĩ Ngọc Sơn sở hữu 50 ha đất ở Bình Thuận,Báo Người Lao Động,2022-09-30T17:07:20+07:00
https://baomoi.com/hoa-hau-hoa-binh-viet-nam-gay-tranh-cai-ve-man-ho-ten-btc-len-tieng/c/43870266.epi,"Hoa hậu Hòa bình Việt Nam gây tranh cãi về màn hô tên, BTC lên tiếng",Báo Tiền Phong,2022-09-30T11:42:00+07:00
https://baomoi.com/dang-tim-kiem-nam-tai-xe-bo-lai-xe-may-nhay-cau-nhat-tan-xuong-song-hong/c/43873692.epi,Đang tìm kiếm nam tài xế bỏ lại xe máy nhảy cầu Nhật Tân xuống sông Hồng,Báo Giao Thông,2022-09-30T16:55:00+07:00
https://baomoi.com/chung-khoan-chau-a-dich-chuyen-nguoc-chieu/c/43873359.epi,Chứng khoán châu Á dịch chuyển ngược chiều,Báo Tin Tức TTXVN,2022-09-30T16:27:00+07:00
https://baomoi.com/hoc-sinh-tron-tren-tran-nha-vo-bi-bat-coc-nhan-tin-tong-tien-cha-me/c/43873221.epi,"Học sinh trốn trên trần nhà vờ bị bắt cóc, nhắn tin tống tiền cha mẹ",Báo Sài Gòn Giải Phóng,2022-09-30T16:29:00+07:00
https://baomoi.com/chu-thau-o-binh-duong-bi-dam-chet-vi-mau-thuan-tien-cong/c/43873612.epi,Chủ thầu ở Bình Dương bị đâm chết vì mâu thuẫn tiền công,Báo VOV,2022-09-30T16:57:00+07:00
https://baomoi.com/huy-toan-bo-ban-an-giet-nguoi-vi-co-nhieu-mau-thuan-chua-duoc-lam-ro/c/22545896.epi,Hủy toàn bộ bản án 'giết người' vì có nhiều mâu thuẫn chưa được làm rõ,Báo Công Lý,2022-09-30T15:51:00+07:00
https://baomoi.com/khoi-to-yeu-dau-xanh-hiep-dam-nu-huong-dan-vien-du-lich-o-ha-giang/c/43873775.epi,Khởi tố 'yêu dâu xanh' hiếp dâm nữ hướng dẫn viên du lịch ở Hà Giang,Báo VietnamNet,2022-09-30T17:10:00+07:00
https://baomoi.com/hon-dao-ky-la-o-han-quoc-noi-tat-tan-tat-moi-thu-deu-ngap-trong-sac-tim-goc-nao-cung-dep-long-lanh/c/43871502.epi,"Hòn đảo kỳ lạ ở Hàn Quốc nơi tất tần tật mọi thứ đều ngập trong sắc tím, góc nào cũng đẹp long lanh",Báo Tổ Quốc,2022-09-30T14:24:00+07:00
https://baomoi.com/quoc-gia-nho-nhat-the-gioi/c/43869138.epi,Quốc gia nhỏ nhất thế giới,Tạp chí Tri Thức Trực Tuyến,2022-09-30T10:27:44+07:00
https://baomoi.com/hinh-anh-huong-mua-he-han-quoc-dep-lim-tim-qua-ong-kinh-chang-trai-viet/c/43867710.epi,Hình ảnh hương mùa hè Hàn Quốc đẹp lịm tim qua ống kính chàng trai Việt,Báo VietnamNet,2022-09-30T08:15:00+07:00
https://baomoi.com/an-ninh-duoc-that-chat-khi-toa-ra-phan-quyet-ve-ghe-thu-tuong-thai-lan/c/43873267.epi,An ninh được thắt chặt khi tòa ra phán quyết về ghế Thủ tướng Thái Lan,Báo Người Lao Động,2022-09-30T16:29:27+07:00
https://baomoi.com/ha-noi-hon-93-chung-cu-nha-cao-tang-o-quan-cau-giay-vi-pham-an-toan-phong-chay-chua-chay/c/43873191.epi,"Hà Nội: Hơn 93% chung cư, nhà cao tầng ở quận Cầu Giấy vi phạm an toàn phòng cháy chữa cháy",Báo Sức Khỏe & Đời Sống,2022-09-30T16:26:00+07:00
https://baomoi.com/tong-thu-ky-lien-hiep-quoc-len-an-nga-sap-nhap-4-vung-cua-ukraine-moskva-bac-lai/c/43873566.epi,"Tổng thư ký Liên Hiệp Quốc lên án Nga sáp nhập 4 vùng của Ukraine, Moskva bác lại",Báo An Ninh Thủ Đô,2022-09-30T16:41:02+07:00
https://baomoi.com/vi-sao-dai-ta-mai-hoang-duoc-bo-cong-an-lay-y-kien-xet-tang-huan-chuong/c/43873582.epi,Vì sao Đại tá Mai Hoàng được Bộ Công an lấy ý kiến xét tặng Huân chương?,Báo Công Thương,2022-09-30T16:48:25+07:00
https://baomoi.com/cuoc-song-con-nguoi-se-nhu-the-nao-sau-50-nam-nua/c/43873301.epi,Cuộc sống con người sẽ như thế nào sau 50 năm nữa?,Báo Phụ Nữ Việt Nam,2022-09-30T16:28:00+07:00
https://baomoi.com/xuat-hien-hinh-thuc-lua-dao-moi-nham-chiem-doat-tai-khoan-mang-xa-hoi-tai-khoan-ngan-hang-nguoi-dan-can-luu-y-nhung-gi/c/43873030.epi,"Xuất hiện hình thức lừa đảo mới nhằm chiếm đoạt tài khoản mạng xã hội, tài khoản ngân hàng, người dân cần lưu ý những gì?",Báo Tổ Quốc,2022-09-30T16:15:00+07:00
https://baomoi.com/doan-xe-o-zaporizhzhia-trung-phao-23-dan-thuong-thiet-mang/c/43872723.epi,"Đoàn xe ở Zaporizhzhia trúng pháo, 23 dân thường thiệt mạng",Báo Công An Nhân Dân,2022-09-30T15:16:00+07:00
https://baomoi.com/du-an-xay-ham-chui-nguyen-van-linh-nguyen-huu-tho-bi-yeu-cau-dung-thi-cong/c/43873346.epi,Dự án xây hầm chui Nguyễn Văn Linh - Nguyễn Hữu Thọ bị yêu cầu dừng thi công,Báo VietnamNet,2022-09-30T16:37:00+07:00
https://baomoi.com/mien-bac-mien-trung-sap-co-khong-khi-lanh-tang-cuong/c/43873132.epi,"Miền Bắc, miền Trung sắp có không khí lạnh tăng cường",Báo Tiền Phong,2022-09-30T16:20:00+07:00
https://baomoi.com/dong-thap-tu-hinh-doi-tuong-tham-o-hon-228-ty-dong/c/43873628.epi,Đồng Tháp: Tử hình đối tượng tham ô hơn 228 tỷ đồng,Báo Nhân Dân,2022-09-30T16:59:00+07:00
https://baomoi.com/quang-hai-vuot-troi-sao-thai-lan-o-ngoai-hang-anh-trong-tro-choi-dien-tu/c/43873211.epi,Quang Hải vượt trội sao Thái Lan ở Ngoại Hạng Anh trong trò chơi điện tử,Báo VTC News,2022-09-30T16:27:08+07:00
https://baomoi.com/cuc-duong-sat-kien-nghi-dep-bo-pho-ca-phe-duong-tau-ha-noi/c/43873358.epi,Cục Đường sắt kiến nghị dẹp bỏ 'phố cà phê đường tàu' Hà Nội,Báo Tiền Phong,2022-09-30T16:37:00+07:00
https://baomoi.com/gia-gas-tiep-tuc-giam-manh-hon-18-000-dong-binh/c/43873518.epi,Giá gas tiếp tục giảm mạnh hơn 18.000 đồng/bình,Báo Pháp Luật TP.HCM,2022-09-30T16:49:55+07:00
https://baomoi.com/thu-tuong-yeu-cau-tap-trung-khac-phuc-hau-qua-bao-so-4-chu-dong-ung-pho-thien-tai-trong-thoi-gian-toi/c/43872585.epi,"Thủ tướng yêu cầu tập trung khắc phục hậu quả bão số 4, chủ động ứng phó thiên tai trong thời gian tới",Báo Chính Phủ,2022-09-30T15:35:00+07:00
https://baomoi.com/cong-an-noi-ve-vu-thi-the-cu-ba-95-tuoi-chon-trong-vuon-nha/c/43872645.epi,Công an nói về vụ thi thể cụ bà 95 tuổi chôn trong vườn nhà,Tạp chí Tri Thức Trực Tuyến,2022-09-30T16:05:20+07:00
https://baomoi.com/vu-gui-con-chua-benh-nhan-lai-hu-tro-cot-gia-dinh-be-trai-tiep-tuc-bac-loi-khai-cua-ke-dot-xac/c/43873343.epi,Vụ gửi con chữa bệnh nhận lại hũ tro cốt: Gia đình bé trai tiếp tục bác lời khai của kẻ đốt xác,Báo Tiền Phong,2022-09-30T16:34:00+07:00
https://baomoi.com/vinh-phuc-vo-tam-xang-dot-chong-khien-ca-hai-deu-bi-bong-nang/c/43870990.epi,Vĩnh Phúc: Vợ tẩm xăng đốt chồng khiến cả hai đều bị bỏng nặng,Báo Giao Thông,2022-09-30T13:23:00+07:00
https://baomoi.com/giam-doc-cong-an-soc-trang-noi-ve-vu-2-thieu-nien-bi-cong-an-danh/c/43873762.epi,Giám đốc Công an Sóc Trăng nói về vụ 2 thiếu niên bị công an đánh,Báo Pháp Luật TP.HCM,2022-09-30T17:10:27+07:00
https://baomoi.com/vu-vo-chet-chong-nguy-kich-o-phu-yen-khoi-to-bat-tam-giam-nguoi-chong/c/43872694.epi,"Vụ 'vợ chết, chồng nguy kịch ở Phú Yên': Khởi tố, bắt tạm giam người chồng",Báo Người Lao Động,2022-09-30T15:53:00+07:00
https://baomoi.com/co-gai-mat-1-ty-dong-khi-thanh-toan-don-hang-ao/c/43872503.epi,Cô gái mất 1 tỷ đồng khi thanh toán 'đơn hàng ảo',Báo Tiền Phong,2022-09-30T15:38:00+07:00
https://baomoi.com/thu-tuong-ra-soat-so-tan-nguoi-dan-ra-khoi-khu-vuc-co-nguy-co-sat-lo-dat-lu-quet/c/43873342.epi,"Thủ tướng: Rà soát, sơ tán người dân ra khỏi khu vực có nguy cơ sạt lở đất, lũ quét",Báo Tiền Phong,2022-09-30T16:35:00+07:00
https://baomoi.com/dang-bi-dieu-tra-phung-thi-nghe-khoi-kien-doi-biet-thu/c/43872617.epi,"Đang bị điều tra, Phùng Thị Nghệ khởi kiện đòi biệt thự",Báo Người Lao Động,2022-09-30T15:46:00+07:00
https://baomoi.com/dien-bien-moi-nhat-vu-khu-du-lich-xay-chui-giua-rung-o-tt-hue/c/43873133.epi,Diễn biến mới nhất vụ khu du lịch xây 'chui' giữa rừng ở TT-Huế,Báo Tiền Phong,2022-09-30T16:22:00+07:00
https://baomoi.com/mua-lu-o-nghe-an-lam-7-nguoi-chet-va-mat-tich/c/43873721.epi,Mưa lũ ở Nghệ An làm 7 người chết và mất tích,Báo VietnamNet,2022-09-30T17:04:00+07:00
https://baomoi.com/khoi-to-bat-tam-giam-nguyen-chi-cuc-truong-chi-cuc-du-tru-nha-nuoc-moc-chau/c/43873785.epi,"Khởi tố, bắt tạm giam nguyên Chi cục trưởng Chi cục Dự trữ Nhà nước Mộc Châu",Báo Tiền Phong,2022-09-30T17:12:00+07:00
https://baomoi.com/lam-ro-vu-hoc-sinh-lop-10-dung-dao-ruot-duoi-ban-trong-gio-ra-choi/c/43873369.epi,Làm rõ vụ học sinh lớp 10 dùng dao rượt đuổi bạn trong giờ ra chơi,Báo Tiền Phong,2022-09-30T16:38:00+07:00
https://baomoi.com/pho-giam-doc-so-noi-vu-bac-ninh-xin-nghi-viec/c/43872624.epi,Phó Giám đốc Sở Nội vụ Bắc Ninh xin nghỉ việc,Báo VTC News,2022-09-30T15:37:06+07:00
https://baomoi.com/truong-hoc-bi-nhan-chim-trong-lu-1-500-ho-dan-bi-co-lap/c/43873493.epi,"Trường học bị nhấn chìm trong lũ, 1.500 hộ dân bị cô lập",Báo VTC News,2022-09-30T16:47:43+07:00
https://baomoi.com/tin-vui-cho-khach-viet-di-du-lich-han-quoc/c/43872435.epi,Tin vui cho khách Việt đi du lịch Hàn Quốc,Báo Người Lao Động,2022-09-30T15:33:39+07:00
https://baomoi.com/tuyen-quang-tam-dung-hoat-dong-212-co-so-karaoke-quan-bar-vu-truong-vi-pham-ve-phong-chay/c/43872689.epi,"Tuyên Quang: Tạm dừng hoạt động 212 cơ sở karaoke, quán bar, vũ trường vi phạm về phòng cháy",Báo Tin Tức TTXVN,2022-09-30T15:44:00+07:00
https://baomoi.com/nu-ke-toan-lap-bao-cao-gia-chiem-doat-19-ty-dong-cua-cong-ty/c/43873162.epi,Nữ kế toán lập báo cáo giả chiếm đoạt 19 tỷ đồng của công ty,Báo Công An Nhân Dân,2022-09-30T16:20:00+07:00
https://baomoi.com/de-phong-sat-lo-dat-vung-nui-tai-cac-tinh-tu-thanh-hoa-den-ha-tinh/c/43873691.epi,Đề phòng sạt lở đất vùng núi tại các tỉnh từ Thanh Hóa đến Hà Tĩnh,Báo VietnamPlus,2022-09-30T17:00:00+07:00
https://baomoi.com/mua-xe-cho-bang-chung-ban/c/43873462.epi,Mua xe cho bằng chúng bạn,Báo Giao Thông,2022-09-30T16:43:00+07:00
https://baomoi.com/bo-truong-gtvt-bo-nhiem-hang-loat-can-bo-chu-chot/c/43873057.epi,Bộ trưởng GTVT bổ nhiệm hàng loạt cán bộ chủ chốt,Báo VietnamNet,2022-09-30T16:12:00+07:00
https://baomoi.com/loi-thua-nhan-hiem-thay-tu-vatican/c/43873241.epi,Lời thừa nhận hiếm thấy từ Vatican,Tạp chí Tri Thức Trực Tuyến,2022-09-30T16:46:06+07:00
https://baomoi.com/bao-hiem-that-nghiep-ho-tro-41-046-ty-dong-cho-doanh-nghiep-lao-dong/c/43873434.epi,"Bảo hiểm thất nghiệp hỗ trợ 41.046 tỷ đồng cho doanh nghiệp, lao động",Báo VietnamPlus,2022-09-30T16:37:00+07:00
https://baomoi.com/arsenal-dau-tottenham-dau-ban-linh-dua-toc-do/c/43873204.epi,"Arsenal đấu Tottenham: Đấu bản lĩnh, đua tốc độ",Báo VietnamNet,2022-09-30T16:23:00+07:00
https://baomoi.com/cuu-nguoi-phu-nu-dinh-nhay-cau-chuong-duong-vi-chuyen-tinh-cam/c/43873540.epi,Cứu người phụ nữ định nhảy cầu Chương Dương vì chuyện tình cảm,Báo Tiền Phong,2022-09-30T16:52:00+07:00
https://baomoi.com/nam-thanh-nien-sat-hai-nu-nhan-vien-massage-tai-chung-cu-mini-khoc-nuc-no-tai-toa/c/43871134.epi,Nam thanh niên sát hại nữ nhân viên massage tại chung cư mini khóc nức nở tại tòa,Báo Người Lao Động,2022-09-30T13:46:33+07:00
https://baomoi.com/tp-hcm-cam-xe-duong-le-loi-sang-cuoi-tuan/c/43872772.epi,TP.HCM cấm xe đường Lê Lợi sáng cuối tuần,Tạp chí Tri Thức Trực Tuyến,2022-09-30T16:13:05+07:00
https://baomoi.com/bo-truong-nguyen-thanh-nghi-noi-ve-quy-dinh-thoi-han-so-huu-chung-cu/c/43873471.epi,Bộ trưởng Nguyễn Thanh Nghị nói về quy định thời hạn sở hữu chung cư,Báo Pháp Luật TP.HCM,2022-09-30T16:42:45+07:00
https://baomoi.com/nguoi-phu-nu-bi-ung-thu-dai-truc-trang-vi-loai-do-uong-quen-thuoc/c/43872919.epi,Người phụ nữ bị ung thư đại trực tràng vì loại đồ uống quen thuộc,Báo Phụ Nữ Việt Nam,2022-09-30T16:00:00+07:00
https://baomoi.com/phan-dau-nang-kim-ngach-thuong-mai-hai-chieu-viet-nam-cuba-len-500-trieu-usd/c/43873483.epi,Phấn đấu nâng kim ngạch thương mại hai chiều Việt Nam - Cuba lên 500 triệu USD,Báo Điện tử Đảng cộng sản VN,2022-09-30T16:44:00+07:00
https://baomoi.com/quang-tri-se-thu-hoi-chu-truong-dau-tu-du-an-371-ti-dong/c/43873559.epi,Quảng Trị sẽ thu hồi chủ trương đầu tư dự án 371 tỉ đồng,Báo Pháp Luật TP.HCM,2022-09-30T16:54:42+07:00
https://baomoi.com/sau-bao-so-4-nuoc-bien-o-thua-thien-hue-xuat-hien-mau-bat-thuong/c/43873186.epi,"Sau bão số 4, nước biển ở Thừa Thiên-Huế xuất hiện màu bất thường",Tạp chí Người Đưa Tin,2022-09-30T16:23:00+07:00
https://baomoi.com/40-nguoi-tu-vong-bo-y-te-canh-bao-nguy-co-benh-dai-bung-phat/c/43873543.epi,"40 người tử vong, Bộ Y tế cảnh báo nguy cơ bệnh dại bùng phát",Báo Người Lao Động,2022-09-30T16:52:10+07:00
https://baomoi.com/tp-ho-chi-minh-tieu-huy-hon-1-5-tan-ma-tuy/c/43872166.epi,"TP Hồ Chí Minh: Tiêu hủy hơn 1,5 tấn ma túy",Báo Tin Tức TTXVN,2022-09-30T15:03:00+07:00
https://baomoi.com/cuu-song-be-gai-11-tuoi-bi-da-chan-thuong-nguy-kich-bang-ky-thuat-ecmo/c/43873552.epi,Cứu sống bé gái 11 tuổi bị đa chấn thương nguy kịch bằng kỹ thuật ECMO,Báo VietnamPlus,2022-09-30T16:50:00+07:00
https://baomoi.com/ai-se-do-dau-tai-tro-cho-cau-lac-bo-bong-da-binh-thuan-da-chuyen-nghiep/c/43872922.epi,"Ai sẽ đỡ đầu, tài trợ cho Câu lạc bộ bóng đá Bình Thuận đá chuyên nghiệp?",Báo Pháp Luật TP.HCM,2022-09-30T16:06:18+07:00
https://baomoi.com/mua-lu-mien-trung-lam-6-nguoi-thiet-mang-va-mat-tich/c/43873542.epi,Mưa lũ miền Trung làm 6 người thiệt mạng và mất tích,Báo Điện tử Đảng cộng sản VN,2022-09-30T16:52:00+07:00
https://baomoi.com/nhat-duoc-vi-tien-anh-cong-nhan-o-da-nang-nho-cong-an-tim-nguoi-tra-lai/c/43873136.epi,"Nhặt được ví tiền, anh công nhân ở Đà Nẵng nhờ công an tìm người trả lại",Báo Infonet,2022-09-30T16:21:00+07:00
https://baomoi.com/ria-novosti-quan-chuc-kherson-thiet-mang-vi-ten-lua-ukraine/c/43872155.epi,RIA Novosti: Quan chức Kherson thiệt mạng vì tên lửa Ukraine,Tạp chí Tri Thức Trực Tuyến,2022-09-30T15:26:52+07:00
https://baomoi.com/tuoc-danh-hieu-cong-an-nhan-dan-3-cong-an-danh-2-thieu-nien-di-xe-may/c/43872953.epi,Tước danh hiệu công an nhân dân 3 công an đánh 2 thiếu niên đi xe máy,Báo Infonet,2022-09-30T16:08:00+07:00
https://baomoi.com/clip-bat-trom-o-tiem-tap-hoa-khien-nguoi-xem-bat-cuoi/c/43872126.epi,Clip bắt trộm ở tiệm tạp hóa khiến người xem bật cười,Báo Infonet,2022-09-30T15:05:00+07:00
https://baomoi.com/gia-xang-trong-nuoc-hoan-toan-co-the-giam-ve-muc-18-000-dong-lit/c/43873774.epi,Giá xăng trong nước hoàn toàn có thể giảm về mức 18.000 đồng/lít?,Báo Pháp Luật TP.HCM,2022-09-30T17:11:52+07:00
https://baomoi.com/sua-quy-dinh-ho-so-cong-nhan-to-chuc-du-dieu-kien-khao-nghiem-thuoc-bao-ve-thuc-vat/c/43872451.epi,Sửa quy định hồ sơ công nhận tổ chức đủ điều kiện khảo nghiệm thuốc bảo vệ thực vật,Báo Chính Phủ,2022-09-30T15:27:00+07:00
