url,title,publisher,time
https://baomoi.com/vu-khi-nguy-hiem-doi-voi-eu/c/43858012.epi,'Vũ khí' nguy hiểm đối với EU,Báo Tin Tức TTXVN,
https://baomoi.com/cai-to-hoi-dong-bao-an-lien-hop-quoc-khi-xu-the-cung-chinh-la-diem-nghen/c/43857738.epi,Cải tổ Hội đồng Bảo an Liên hợp quốc: Khi xu thế cũng chính là điểm nghẽn,Báo An Ninh Thế Giới,
https://baomoi.com/van-bai-nang-luong-cua-nga-o-chau-a-trong-boi-canh-xung-dot-ukraine/c/43856483.epi,Ván bài năng lượng của Nga ở châu Á trong bối cảnh xung đột Ukraine,Báo VOV,
https://baomoi.com/ai-duoc-huong-loi-tu-kich-ban-dong-chay-phuong-bac-bi-pha-hoai/c/43854709.epi,Ai được hưởng lợi từ kịch bản Dòng chảy phương Bắc bị phá hoại?,Báo VOV,
https://baomoi.com/tac-dong-toan-cau-sau-khi-fed-tang-lai-suat-len-cao-nhat-tu-nam-2008/c/43851284.epi,Tác động toàn cầu sau khi FED tăng lãi suất lên cao nhất từ năm 2008,Báo Tin Tức TTXVN,
https://baomoi.com/nguoi-phu-nu-khien-ca-chau-au-lo-lang/c/43847833.epi,Người phụ nữ khiến cả châu Âu lo lắng,Tạp chí Tri Thức Trực Tuyến,
https://baomoi.com/chinh-phu-moi-o-italy-se-tac-dong-the-nao-voi-eu-va-cuoc-xung-dot-nga-ukraine/c/43845884.epi,Chính phủ mới ở Italy sẽ tác động thế nào với EU và cuộc xung đột Nga - Ukraine?,Báo Tin Tức TTXVN,
https://baomoi.com/bo-truong-ngoai-giao-bui-thanh-son-tham-chinh-thuc-cong-hoa-ao/c/43871188.epi,Bộ trưởng Ngoại giao Bùi Thanh Sơn thăm chính thức Cộng hòa Áo,Tạp chí Petrotimes,2022-09-30T13:39:00+07:00
https://baomoi.com/ti-phu-warren-buffett-day-con-5-cach-tieu-tien-thong-minh/c/43870240.epi,Tỉ phú Warren Buffett dạy con 5 cách tiêu tiền thông minh,Báo Phụ Nữ Việt Nam,2022-09-30T11:29:00+07:00
https://baomoi.com/doanh-nghiep-lam-du-an-xam-hai-dao-hon-mieu-trong-vinh-nha-trang/c/43870269.epi,"Doanh nghiệp làm dự án, xâm hại đảo Hòn Miễu trong vịnh Nha Trang",Báo VietnamNet,2022-09-30T11:36:00+07:00
https://baomoi.com/hoa-hoan-tai-co-quan-bau-cu-quoc-gia-paraguay-1-nguoi-thiet-mang/c/43870418.epi,"Hỏa hoạn tại cơ quan bầu cử quốc gia Paraguay, 1 người thiệt mạng",Báo VietnamPlus,2022-09-30T11:57:00+07:00
https://baomoi.com/neymar-am-uc-khi-bi-mbappe-dam-sau-lung/c/43871172.epi,Neymar ấm ức khi bị Mbappe 'đâm sau lưng',Báo Pháp Luật TP.HCM,2022-09-30T13:53:34+07:00
https://baomoi.com/chan-chinh-xu-ly-hanh-vi-tieu-cuc-ve-xuat-nhap-khau-tai-cua-khau-bien-gioi/c/43869789.epi,"Chấn chỉnh, xử lý hành vi tiêu cực về xuất nhập khẩu tại cửa khẩu biên giới",Báo Đầu Tư,2022-09-30T11:03:00+07:00
https://baomoi.com/nhieu-huyen-cua-nghe-an-tiep-tuc-cho-hoc-sinh-nghi-hoc-do-mua-lu/c/43871477.epi,Nhiều huyện của Nghệ An tiếp tục cho học sinh nghỉ học do mưa lũ,Báo Giáo Dục & Thời Đại,2022-09-30T14:14:00+07:00
https://baomoi.com/vi-sao-philippines-hung-chiu-hang-chuc-con-bao-moi-nam-nguyen-nhan-so-2-kho-luong/c/43869796.epi,Vì sao Philippines hứng chịu hàng chục cơn bão mỗi năm? Nguyên nhân số 2 khó lường,Báo Tổ Quốc,2022-09-30T11:00:00+07:00
https://baomoi.com/bat-cai-thau-dung-ma-tuy-de-tra-cong-cho-cong-nhan/c/43870849.epi,Bắt cai thầu dùng ma túy để trả công cho công nhân,Báo Giao Thông,2022-09-30T12:52:00+07:00
https://baomoi.com/nghien-cuu-nang-do-cao-quy-dao-kinh-thien-van-hubble/c/43869370.epi,Nghiên cứu nâng độ cao quỹ đạo kính thiên văn Hubble,Báo Tin Tức TTXVN,2022-09-30T10:20:00+07:00
https://baomoi.com/ban-ngheo-het-bi-co-lap-dan-phan-khoi-cho-nhau-di-cho-dua-con-di-hoc/c/43870760.epi,"Bản nghèo hết bị cô lập, dân phấn khởi chở nhau đi chợ, đưa con đi học",Báo Sài Gòn Giải Phóng,2022-09-30T12:51:00+07:00
https://baomoi.com/nhung-chinh-sach-noi-bat-co-hieu-luc-tu-thang-10-2022/c/43870044.epi,Những chính sách nổi bật có hiệu lực từ tháng 10-2022,Báo Sài Gòn Giải Phóng,2022-09-30T11:20:00+07:00
https://baomoi.com/loc-xoay-trong-dem-cuon-bay-nhieu-mai-nha-dan-o-ha-tinh/c/43870322.epi,Lốc xoáy trong đêm cuốn bay nhiều mái nhà dân ở Hà Tĩnh,Báo VTC News,2022-09-30T11:31:52+07:00
https://baomoi.com/ong-kinh-sieu-can-canh-ulanzi-giup-iphone-5c-chup-dep-hon-ca-iphone-14-pro/c/43870422.epi,Ống kính siêu cận cảnh Ulanzi giúp iPhone 5C chụp đẹp hơn cả iPhone 14 Pro,Báo Tổ Quốc,2022-09-30T12:00:00+07:00
https://baomoi.com/hoang-gia-anh-cong-bo-dong-xu-co-in-hinh-vua-charles-iii/c/43870328.epi,Hoàng gia Anh công bố đồng xu có in hình Vua Charles III,Báo VietnamPlus,2022-09-30T11:45:00+07:00
https://baomoi.com/nu-cau-thu-dep-nhat-the-gioi-khong-muon-bo-bong-da-de-lam-nguoi-mau/c/43870450.epi,Nữ cầu thủ đẹp nhất thế giới không muốn bỏ bóng đá để làm người mẫu,Báo Giáo Dục & Thời Đại,2022-09-30T11:44:00+07:00
https://baomoi.com/choi-lon-chi-gan-3-ty-xay-be-boi-tai-nha-kiem-dam-2-nam-thu-ve-5-ty/c/43869579.epi,"Chơi lớn chi gần 3 tỷ xây bể bơi tại nhà, kiếm đậm 2 năm thu về 5 tỷ",Báo VietnamNet,2022-09-30T10:45:00+07:00
https://baomoi.com/chu-re-o-nghe-an-dung-thuyen-ruoc-dau-vao-hon-truong/c/43869320.epi,Chú rể ở Nghệ An dùng thuyền rước dâu vào hôn trường,Báo Tiền Phong,2022-09-30T10:27:00+07:00
https://baomoi.com/cong-bo-quyet-dinh-chi-dinh-tan-bi-thu-ban-can-su-dang-ubnd-tinh-gia-lai/c/43871069.epi,Công bố quyết định chỉ định tân Bí thư Ban Cán sự Đảng UBND tỉnh Gia Lai,Báo Chính Phủ,2022-09-30T13:36:00+07:00
https://baomoi.com/mot-ngoi-lang-nho-cua-duc-chua-bao-gio-phai-lo-lang-ve-hoa-don-dien/c/43871538.epi,Một ngôi làng nhỏ của Đức chưa bao giờ phải lo lắng về hóa đơn điện,Báo Tổ Quốc,2022-09-30T14:25:00+07:00
https://baomoi.com/bo-ngoai-giao-trao-quyet-dinh-bo-nhiem-can-bo-lanh-dao-quan-ly/c/43871478.epi,"Bộ Ngoại giao trao quyết định bổ nhiệm cán bộ lãnh đạo, quản lý",Báo Thế Giới & Việt Nam,2022-09-30T14:13:00+07:00
https://baomoi.com/cac-nha-khoa-hoc-trung-quoc-lan-dau-phat-hien-vi-nhua-trong-cuc-mau-dong-o-nguoi/c/43872165.epi,Các nhà khoa học Trung Quốc lần đầu phát hiện vi nhựa trong cục máu đông ở người,Báo VOV,2022-09-30T15:13:00+07:00
https://baomoi.com/thuoc-nao-tri-duoc-can-benh-cham-tien-do/c/43871697.epi,Thuốc nào 'trị' được căn bệnh 'chậm tiến độ'?,Báo Văn Nghệ Công An,2022-09-30T14:31:00+07:00
https://baomoi.com/nhieu-ho-chua-thuy-dien-tai-nghe-an-khan-cap-xa-nuoc/c/43869785.epi,Nhiều hồ chứa thủy điện tại Nghệ An khẩn cấp xả nước,Báo Tin Tức TTXVN,2022-09-30T10:48:00+07:00
https://baomoi.com/nga-my-tim-cach-hoi-sinh-thoa-thuan-hat-nhan-quan-trong/c/43872198.epi,Nga - Mỹ tìm cách hồi sinh thỏa thuận hạt nhân quan trọng,Báo An Ninh Thủ Đô,2022-09-30T15:06:49+07:00
https://baomoi.com/nghe-an-nhieu-vung-trung-thap-huyen-thanh-chuong-bi-ngap-sau/c/43869088.epi,Nghệ An: Nhiều vùng trũng thấp huyện Thanh Chương bị ngập sâu,Báo VietnamPlus,2022-09-30T10:08:00+07:00
https://baomoi.com/so-bi-giet-vi-mua-dung-buc-tranh-bi-danh-cap-gia-100-trieu-usd/c/43870325.epi,Sợ bị giết vì mua đúng bức tranh bị đánh cắp giá 100 triệu USD,Tạp chí Tri Thức Trực Tuyến,2022-09-30T12:03:50+07:00
https://baomoi.com/bo-nao-con-nguoi-luu-tru-ky-uc-nhu-the-nao/c/43871663.epi,Bộ não con người lưu trữ ký ức như thế nào?,Báo Tổ Quốc,2022-09-30T14:23:00+07:00
https://baomoi.com/5-bi-an-kinh-thien-trong-mo-tan-thuy-hoang-chuyen-gia-roi-nao/c/43870590.epi,"5 bí ẩn 'kinh thiên' trong mộ Tần Thủy Hoàng, chuyên gia rối não",Báo Kiến Thức,2022-09-30T12:25:00+07:00
https://baomoi.com/thi-truong-trai-phieu-toan-cau-trai-qua-dot-ban-thao-toi-te-nhat-ke-tu-nhung-nam-1990/c/43871427.epi,Thị trường trái phiếu toàn cầu trải qua đợt bán tháo tồi tệ nhất kể từ những năm 1990,Báo Đầu Tư Chứng Khoán,2022-09-30T14:15:09+07:00
https://baomoi.com/dai-su-nga-canh-bao-xung-dot-hat-nhan-chu-tich-ha-vien-phap-toi-ukraine/c/43868551.epi,"Đại sứ Nga cảnh báo xung đột hạt nhân, Chủ tịch Hạ viện Pháp tới Ukraine",Báo VietnamNet,2022-09-30T09:22:00+07:00
https://baomoi.com/nam-sinh-dak-lak-bi-nhieu-ban-dung-mu-bao-hiem-danh-toi-tap-sau-gio-tan-truong/c/43871838.epi,Nam sinh Đắk Lắk bị nhiều bạn dùng mũ bảo hiểm đánh tới tấp sau giờ tan trường,Báo Infonet,2022-09-30T14:48:00+07:00
https://baomoi.com/cuu-quan-chuc-fifa-di-tu-vi-nhan-hoi-lo/c/43869575.epi,Cựu quan chức FIFA đi tù vì nhận hối lộ,Tạp chí Tri Thức Trực Tuyến,2022-09-30T11:01:14+07:00
https://baomoi.com/quang-nam-khac-phuc-giao-thong-mien-nui-sat-lo-sau-bao-so-4/c/43870233.epi,Quảng Nam khắc phục giao thông miền núi sạt lở sau bão số 4,Báo VOV,2022-09-30T11:39:00+07:00
https://baomoi.com/nhat-ban-triet-pha-duong-day-lam-gia-the-cu-tru-cho-nguoi-nuoc-ngoai/c/43869858.epi,Nhật Bản triệt phá đường dây làm giả thẻ cư trú cho người nước ngoài,Báo VietnamPlus,2022-09-30T11:07:00+07:00
https://baomoi.com/nguoi-me-vi-dai-quyet-tim-lai-bo-me-de-cho-con-gai-nuoi/c/43870942.epi,'Người mẹ vĩ đại' quyết tìm lại bố mẹ đẻ cho con gái nuôi,Báo Infonet,2022-09-30T13:20:00+07:00
https://baomoi.com/tien-xu-in-hinh-vua-charles-iii-se-duoc-phat-hanh-vao-giang-sinh/c/43869996.epi,Tiền xu in hình Vua Charles III sẽ được phát hành vào Giáng sinh,Tạp chí Tri Thức Trực Tuyến,2022-09-30T11:35:16+07:00
https://baomoi.com/chinh-sach-moi-thang-10-bo-quy-dinh-tinh-ty-le-noi-dia-hoa-oto/c/43870842.epi,Chính sách mới tháng 10: Bỏ quy định tính tỷ lệ nội địa hóa ôtô,Tạp chí Tri Thức Trực Tuyến,2022-09-30T13:23:36+07:00
https://baomoi.com/thang-con-om-2-lan-bac-si-chi-ra-thu-pham/c/43872222.epi,"Tháng con ốm 2 lần, bác sĩ chỉ ra thủ phạm",Báo Infonet,2022-09-30T15:17:00+07:00
https://baomoi.com/han-quoc-chinh-thuc-bo-yeu-cau-xet-nghiem-covid-19-sau-khi-nhap-canh/c/43869930.epi,Hàn Quốc chính thức bỏ yêu cầu xét nghiệm Covid-19 sau khi nhập cảnh,Báo VOV,2022-09-30T10:58:00+07:00
https://baomoi.com/ha-noi-tang-cuong-thong-tin-tich-cuc-tren-khong-gian-mang/c/43873463.epi,Hà Nội: Tăng cường thông tin tích cực trên không gian mạng,Báo Kinh Tế Đô Thị,2022-09-30T15:02:00+07:00
https://baomoi.com/nhung-mon-an-cuc-de-tim-tao-ky-tich-cho-benh-tram-cam/c/43870236.epi,Những món ăn cực dễ tìm tạo 'kỳ tích' cho bệnh trầm cảm,Báo Người Lao Động,2022-09-30T11:40:03+07:00
https://baomoi.com/barca-phan-cong-psg-vi-ngoi-sao-messi/c/43871068.epi,Barca phản công PSG vì ngôi sao Messi,Báo Pháp Luật TP.HCM,2022-09-30T13:38:48+07:00
https://baomoi.com/tan-sinh-vien-chat-vat-tim-phong-tro/c/43870251.epi,Tân sinh viên chật vật tìm phòng trọ,Báo Giáo Dục & Thời Đại,2022-09-30T11:40:00+07:00
https://baomoi.com/quang-ngai-tim-huong-xu-ly-cac-ngoi-nha-thuoc-so-huu-nha-nuoc/c/43869869.epi,Quảng Ngãi tìm hướng xử lý các ngôi nhà thuộc sở hữu Nhà nước,Báo Đầu Tư,2022-09-30T11:09:00+07:00
https://baomoi.com/2-canh-sat-pccc-bi-thuong-khi-chua-chay-3-ki-ot-o-pho-nhan-hoa-ha-noi/c/43868985.epi,"2 cảnh sát PCCC bị thương khi chữa cháy 3 ki ốt ở phố Nhân Hòa, Hà Nội",Báo VOV,2022-09-30T09:52:00+07:00
https://baomoi.com/nhung-diem-dep-va-mon-ngon-tai-nam-dinh-khong-the-bo-qua/c/43869947.epi,Những điểm đẹp và món ngon tại Nam Định không thể bỏ qua,PN&CS,2022-09-30T11:07:00+07:00
https://baomoi.com/thu-tuong-cuba-du-dien-dan-xuc-tien-kinh-doanh-viet-nam-cuba/c/43869220.epi,Thủ tướng Cuba dự Diễn đàn xúc tiến kinh doanh Việt Nam-Cuba,Báo VietnamPlus,2022-09-30T10:18:00+07:00
https://baomoi.com/nu-chinh-bi-che-trong-phim-duyen-kiep-tung-la-ga-cung-vu-khac-tiep-ban-than-cua-ngoc-trinh/c/43871847.epi,"Nữ chính bị chê trong phim 'Duyên kiếp' từng là 'gà cưng' Vũ Khắc Tiệp, bạn thân của Ngọc Trinh",Sinh viên Việt Nam,2022-09-30T14:42:44+07:00
https://baomoi.com/jennie-blackpink-tiep-tuc-bi-phat-tan-anh-nhay-cam/c/43870659.epi,Jennie (BlackPink) tiếp tục bị phát tán ảnh nhạy cảm,Báo Tiền Phong,2022-09-30T12:37:00+07:00
https://baomoi.com/vu-gui-con-nhan-ve-hu-tro-cot-thoa-thuan-boi-thuong-5-ty-bat-thanh/c/43869551.epi,Vụ gửi con nhận về hũ tro cốt: Thỏa thuận bồi thường 5 tỷ bất thành,Báo Công An Nhân Dân,2022-09-30T09:46:00+07:00
https://baomoi.com/hoai-lam-xuat-hien-voi-hinh-anh-gay-xon-xao-song-ca-cung-mot-nam-than-gen-z/c/43871846.epi,"Hoài Lâm xuất hiện với hình ảnh gây xôn xao, song ca cùng một 'nam thần' gen Z",Sinh viên Việt Nam,2022-09-30T14:44:31+07:00
https://baomoi.com/co-6-tien-an-tien-su-ve-ma-tuy-nguoi-dan-ba-van-ngua-quen-duong-cu/c/43871680.epi,"Có 6 tiền án, tiền sự về ma túy, người đàn bà vẫn 'ngựa quen đường cũ'",Báo An Ninh Thủ Đô,2022-09-30T14:20:36+07:00
https://baomoi.com/han-quoc-tung-40-trieu-usd-de-go-roi-khung-hoang-kim-chi/c/43869953.epi,Hàn Quốc tung 40 triệu USD để gỡ rối khủng hoảng kim chi,Tạp chí Tri Thức Trực Tuyến,2022-09-30T11:31:23+07:00
https://baomoi.com/lich-thi-dau-vong-9-ngoai-hang-anh-2022-2023-tam-diem-derby-manchester/c/43871421.epi,Lịch thi đấu vòng 9 Ngoại hạng Anh 2022/2023: Tâm điểm derby Manchester,Báo VOV,2022-09-30T14:00:00+07:00
https://baomoi.com/nhieu-noi-bi-chia-cat-co-lap-sau-bao-noru/c/43871002.epi,"Nhiều nơi bị chia cắt, cô lập sau bão Noru",Báo Công an Đà Nẵng,2022-09-30T13:30:00+07:00
https://baomoi.com/thu-tuong-cuba-moi-goi-doanh-nghiep-viet-nam-dau-tu/c/43870902.epi,Thủ tướng Cuba mời gọi doanh nghiệp Việt Nam đầu tư,Báo VietnamNet,2022-09-30T13:15:00+07:00
https://baomoi.com/buc-tranh-nong-nghiep-quy-3-2022-san-luong-lua-giam-chan-nuoi-va-thuy-san-hoi-phuc-nhanh/c/43871434.epi,"Bức tranh nông nghiệp quý 3/2022: Sản lượng lúa giảm, chăn nuôi và thủy sản hồi phục nhanh",Tạp chí VnEconomy,2022-09-30T14:19:00+07:00
https://baomoi.com/mang-ma-tuy-vao-quan-karaoke-moi-nhieu-nguoi-trong-phong-hat-cung-su-dung/c/43871809.epi,Mang ma túy vào quán karaoke mời nhiều người trong phòng hát cùng sử dụng,Báo Bảo Vệ Pháp Luật,2022-09-30T14:35:00+07:00
https://baomoi.com/bi-mat-giup-tang-nang-suat-lam-viec-hon-1-000-lan-cua-cac-ceo/c/43869256.epi,Bí mật giúp 'tăng năng suất làm việc hơn 1.000 lần' của các CEO,Báo Phụ Nữ Việt Nam,2022-09-30T10:22:00+07:00
https://baomoi.com/cong-an-tinh-nghe-an-huy-dong-luc-luong-trang-dem-giup-dan-khac-phuc-hau-qua-mua-bao/c/43870718.epi,Công an tỉnh Nghệ An huy động lực lượng trắng đêm giúp dân khắc phục hậu quả mưa bão,Báo Dân Sinh,2022-09-30T12:38:00+07:00
https://baomoi.com/my-new-york-cam-ban-xe-chay-bang-nhien-lieu-hoa-thach-tu-nam-2035/c/43869605.epi,Mỹ: New York cấm bán xe chạy bằng nhiên liệu hóa thạch từ năm 2035,Báo VietnamPlus,2022-09-30T10:46:00+07:00
https://baomoi.com/quang-tri-cau-bi-lu-cuon-troi-6-thon-bi-co-lap/c/43870679.epi,"Quảng Trị: Cầu bị lũ cuốn trôi, 6 thôn bị cô lập",Báo VOV,2022-09-30T12:28:00+07:00
https://baomoi.com/no-luc-minh-bach-thi-truong-von/c/43870660.epi,Nỗ lực minh bạch thị trường vốn,Báo Đầu Tư Chứng Khoán,2022-09-30T12:35:34+07:00
https://baomoi.com/khai-tru-dang-nguyen-truong-ban-kiem-soat-ngan-hang-dong-a/c/43868883.epi,Khai trừ Đảng nguyên Trưởng Ban Kiểm soát Ngân hàng Đông Á,Báo An Ninh Thủ Đô,2022-09-30T09:38:52+07:00
https://baomoi.com/7-ly-do-ngay-cang-nhieu-benh-truyen-nhiem-bung-phat/c/43871988.epi,7 lý do ngày càng nhiều bệnh truyền nhiễm bùng phát,Tạp chí Tri Thức Trực Tuyến,2022-09-30T15:15:26+07:00
https://baomoi.com/sang-tao-noi-dung-tren-mang-xa-hoi-tu-can-bep/c/43869537.epi,Sáng tạo nội dung trên mạng xã hội từ căn bếp,Báo Phụ Nữ Việt Nam,2022-09-30T10:26:00+07:00
https://baomoi.com/montenegro-truc-xuat-6-nha-ngoai-giao-nga-moscow-tuyen-bo-se-dua-ra-phan-ung-thich-hop/c/43869671.epi,"Montenegro trục xuất 6 nhà ngoại giao Nga, Moscow tuyên bố sẽ đưa ra 'phản ứng thích hợp'",Báo Pháp Luật TP.HCM,2022-09-30T10:54:36+07:00
https://baomoi.com/lo-dien-top-10-dia-phuong-dung-dau-ve-von-dau-tu-thuc-hien-tu-nguon-nsnn-9-thang-dau-nam-2022/c/43869634.epi,Lộ diện top 10 địa phương đứng đầu về vốn đầu tư thực hiện từ nguồn NSNN 9 tháng đầu năm 2022,Báo Tổ Quốc,2022-09-30T10:50:00+07:00
https://baomoi.com/bi-phat-hon-12-000-usd-vi-mang-8-vali-thit-den-san-bay-singapore/c/43868886.epi,Bị phạt hơn 12.000 USD vì mang 8 vali thịt đến sân bay Singapore,Tạp chí Tri Thức Trực Tuyến,2022-09-30T10:08:13+07:00
https://baomoi.com/can-canh-vo-de-o-nghe-an-hang-tram-nguoi-dam-mua-xuyen-dem-ung-cuu/c/43868615.epi,"Cận cảnh vỡ đê ở Nghệ An, hàng trăm người dầm mưa xuyên đêm ứng cứu",Báo Sức Khỏe & Đời Sống,2022-09-30T09:31:00+07:00
https://baomoi.com/ngo-da-vuot-qua-cu-soc-chia-tay-dinh-tu-huong-giang-lai-de-lo-tam-trang-buon-ba/c/43871471.epi,"Ngỡ đã vượt qua cú sốc chia tay Đình Tú, Hương Giang lại để lộ tâm trạng buồn bã",Báo Hoa Học Trò,2022-09-30T14:05:45+07:00
https://baomoi.com/hot-girl-do-con-thai-lan-ra-sao-sau-man-giam-can/c/43871164.epi,'Hot girl đô con' Thái Lan ra sao sau màn giảm cân?,Báo Kiến Thức,2022-09-30T13:55:00+07:00
https://baomoi.com/nhan-vien-am-tham-sa-thai-nguoi-sep-kem-coi/c/43869110.epi,Nhân viên 'âm thầm sa thải' người sếp kém cỏi,Tạp chí Tri Thức Trực Tuyến,2022-09-30T13:33:04+07:00
https://baomoi.com/ngoi-den-nhat-cu-20-nam-duoc-do-ra-xay-lai-mot-lan/c/43871366.epi,Ngôi đền Nhật cứ 20 năm được dỡ ra xây lại một lần,Tạp chí Tri Thức Trực Tuyến,2022-09-30T14:28:41+07:00
https://baomoi.com/nghien-cuu-co-don-co-hai-hon-ca-hut-thuoc-la/c/43871324.epi,Nghiên cứu: Cô đơn có hại hơn cả hút thuốc lá,Báo Sài Gòn Đầu Tư Tài Chính,2022-09-30T14:09:00+07:00
https://baomoi.com/chap-lam-phat-toan-cau-doanh-nghiep-van-lac-quan-vao-trien-vong-don-hang-cuoi-nam/c/43870851.epi,"'Chấp' lạm phát toàn cầu, doanh nghiệp vẫn lạc quan vào triển vọng đơn hàng cuối năm",Tạp chí VnEconomy,2022-09-30T13:05:00+07:00
https://baomoi.com/biem-hoa-24h-sao-tre-arsenal-lam-ban-voi-benh-vien/c/43871678.epi,Biếm họa 24h: Sao trẻ Arsenal 'làm bạn' với bệnh viện,Báo VOV,2022-09-30T14:35:00+07:00
https://baomoi.com/ngo-ngang-voi-hinh-anh-a-hau-bao-ngoc-kem-sac-tai-hoa-hau-lien-luc-dia/c/43871737.epi,Ngỡ ngàng với hình ảnh Á hậu Bảo Ngọc 'kém sắc' tại Hoa hậu Liên lục địa,Báo VOV,2022-09-30T14:42:00+07:00
https://baomoi.com/sang-30-9-covid-19-se-con-tiep-tuc-la-moi-de-doa-ve-y-te-cong-cong-trong-thoi-gian-toi/c/43868730.epi,Sáng 30/9: COVID-19 sẽ còn tiếp tục là mối đe dọa về y tế công cộng trong thời gian tới,Báo Sức Khỏe & Đời Sống,2022-09-30T09:37:00+07:00
https://baomoi.com/anh-trai-bi-dam-tu-vong-trong-luc-ngan-em-ruot-duoi-chem-me/c/43870937.epi,Anh trai bị đâm tử vong trong lúc ngăn em ruột đuổi chém mẹ,Báo Giáo Dục & Thời Đại,2022-09-30T13:04:00+07:00
https://baomoi.com/u20-viet-nam-co-quan-xanh-chat-luong-truoc-them-giai-chau-a/c/43869525.epi,U20 Việt Nam có quân xanh chất lượng trước thềm giải châu Á?,Báo Giáo Dục & Thời Đại,2022-09-30T10:24:00+07:00
https://baomoi.com/moi-quan-he-cua-huynh-hieu-minh-va-angelababy-sau-ly-hon/c/43868786.epi,Mối quan hệ của Huỳnh Hiểu Minh và Angelababy sau ly hôn,Tạp chí Tri Thức Trực Tuyến,2022-09-30T10:00:09+07:00
https://baomoi.com/sau-7-nam-sang-my-dinh-cu-ut-rang-kim-hien-gio-ra-sao/c/43869004.epi,"Sau 7 năm sang Mỹ định cư, 'Út Ráng' Kim Hiền giờ ra sao?",Báo Phụ Nữ Việt Nam,2022-09-30T09:54:00+07:00
https://baomoi.com/clb-sai-gon-treo-thuong-2-ty-dong-de-thang-chung-ket-nguoc/c/43868667.epi,CLB Sài Gòn treo thưởng 2 tỷ đồng để thắng chung kết ngược,Tạp chí Tri Thức Trực Tuyến,2022-09-30T09:50:20+07:00
https://baomoi.com/sars-cov-2-tiep-tuc-dot-bien/c/43870412.epi,SARS-CoV-2 tiếp tục đột biến,Tạp chí Tri Thức Trực Tuyến,2022-09-30T12:13:19+07:00
https://baomoi.com/phe-duyet-tong-bien-che-nganh-kiem-sat-nhan-dan-va-toa-an-nhan-dan/c/43871348.epi,Phê duyệt tổng biên chế ngành Kiểm sát nhân dân và Tòa án nhân dân,Báo Tiền Phong,2022-09-30T14:11:00+07:00
https://baomoi.com/thit-trau-la-trong-dac-san-dan-da-ma-nuc-tieng-gan-xa-cua-nguoi-quang-tri/c/43869863.epi,Thịt trâu lá trơng - Đặc sản dân dã mà nức tiếng gần xa của người Quảng Trị,Báo Tổ Quốc,2022-09-30T11:00:00+07:00
https://baomoi.com/nam-thanh-nien-ngang-nhien-dap-pha-hom-cong-duc-trom-tien-giua-ban-ngay/c/43869379.epi,"Nam thanh niên ngang nhiên đập phá hòm công đức, trộm tiền giữa ban ngày",Báo Giao Thông,2022-09-30T10:30:00+07:00
https://baomoi.com/vu-chim-tau-o-binh-thuan-khien-6-nguoi-chet-ngu-dan-kien-chu-tau-vi-bi-an-chan-tien/c/43869642.epi,Vụ chìm tàu ở Bình Thuận khiến 6 người chết: Ngư dân kiện chủ tàu vì 'bị ăn chặn tiền',Báo Sài Gòn Giải Phóng,2022-09-30T10:52:00+07:00
https://baomoi.com/khi-nghe-si-khong-biet-xau-ho/c/43869600.epi,Khi nghệ sĩ không biết xấu hổ...,Tạp chí Petrotimes,2022-09-30T10:45:00+07:00
https://baomoi.com/khac-phuc-13-doan-co-nhieu-diem-den-hu-hong-tren-quoc-lo-54/c/43871946.epi,Khắc phục 13 đoạn có nhiều điểm đen hư hỏng trên Quốc lộ 54,Báo Giao Thông,2022-09-30T14:55:00+07:00
https://baomoi.com/gia-usd-ngan-hang-chinh-thuc-can-moc-24-000-dong/c/43868550.epi,Giá USD ngân hàng chính thức cán mốc 24.000 đồng,Báo VietnamNet,2022-09-30T09:20:00+07:00
https://baomoi.com/cong-an-dieu-tra-ke-tung-tin-lanh-dao-hdnd-dak-lak-dung-xe-cong-vao-viec-rieng/c/43870721.epi,Công an điều tra kẻ tung tin lãnh đạo HĐND Đắk Lắk dùng xe công vào việc riêng,Báo VTC News,2022-09-30T12:42:00+07:00
https://baomoi.com/thuong-vien-my-thong-qua-goi-vien-tro-khong-lo-cho-ukraine/c/43870014.epi,Thượng viện Mỹ thông qua gói viện trợ khổng lồ cho Ukraine,Báo Tiền Phong,2022-09-30T11:19:00+07:00
https://baomoi.com/moi-11-tuoi-nhung-con-gai-beck-vic-lon-bong-nhu-thieu-nu/c/43871024.epi,Mới 11 tuổi nhưng con gái Beck - Vic lớn bổng như thiếu nữ,Báo Kiến Thức,2022-09-30T13:33:00+07:00
https://baomoi.com/gia-do-la-my-tai-ngan-hang-vuot-moc-24-000-dong/c/43871187.epi,Giá đô la Mỹ tại ngân hàng vượt mốc 24.000 đồng,Tạp chí Kinh Tế Sài Gòn,2022-09-30T13:54:32+07:00
https://baomoi.com/dieu-tra-xu-ly-dich-khi-co-chum-ca-benh-adenovirus-tai-cong-dong-truong-hoc/c/43870830.epi,"Điều tra, xử lý dịch khi có chùm ca bệnh Adenovirus tại cộng đồng, trường học",Tạp chí Giáo dục Việt Nam,2022-09-30T12:47:00+07:00
https://baomoi.com/tuyen-bo-tu-mark-zuckerberg-cham-dut-ky-nguyen-phat-trien-nhanh-cua-meta/c/43870742.epi,Tuyên bố từ Mark Zuckerberg chấm dứt kỷ nguyên phát triển nhanh của Meta,Tạp chí Một Thế Giới,2022-09-30T12:50:00+07:00
https://baomoi.com/my-nhat-han-tap-tran-chong-tau-ngam-trong-boi-canh-cang-thang-o-ban-dao-trieu-tien/c/43870485.epi,Mỹ-Nhật-Hàn tập trận chống tàu ngầm trong bối cảnh căng thẳng ở bán đảo Triều Tiên,Báo Pháp Luật TP.HCM,2022-09-30T12:01:01+07:00
https://baomoi.com/phat-lo-nhieu-di-vat-cuc-quy-trong-quan-the-di-tich-thien-phai-truc-lam-yen-tu/c/43868871.epi,Phát lộ nhiều di vật cực quý trong quần thể di tích Thiền phái Trúc Lâm Yên Tử,Báo Tiền Phong,2022-09-30T09:50:00+07:00
https://baomoi.com/hungary-canh-bao-se-phan-doi-lenh-trung-phat-moi-cua-eu-nham-vao-nga/c/43869135.epi,Hungary cảnh báo sẽ phản đối lệnh trừng phạt mới của EU nhằm vào Nga,Báo VOV,2022-09-30T10:04:00+07:00
https://baomoi.com/bat-ke-cho-vay-tin-dung-den-hon-300-nam/c/43868774.epi,Bắt kẻ cho vay 'tín dụng đen' hơn 300%/năm,Báo Công An Nhân Dân,2022-09-30T09:22:00+07:00
https://baomoi.com/hon-40-ho-dan-o-yen-bai-van-bi-co-lap-vi-lu-cuon-mat-cau-tam/c/43871457.epi,Hơn 40 hộ dân ở Yên Bái vẫn bị cô lập vì lũ cuốn mất cầu tạm,Báo VOV,2022-09-30T14:19:00+07:00
https://baomoi.com/cau-vuot-nguyen-huu-canh-va-so-phan-long-dong-20-nam-nhieu-su-co/c/43869958.epi,Cầu vượt Nguyễn Hữu Cảnh và số phận long đong 20 năm nhiều sự cố,Báo Giao Thông,2022-09-30T11:00:00+07:00
https://baomoi.com/tieu-thuong-khon-kho-vi-cho-vinh-ngap-sau-sau-mua-lon/c/43870368.epi,Tiểu thương khốn khổ vì chợ Vinh ngập sâu sau mưa lớn,Báo Sức Khỏe & Đời Sống,2022-09-30T11:52:00+07:00
https://baomoi.com/nu-ca-si-bi-chi-trich-vi-phat-hanh-mv-tho-tuc/c/43869742.epi,Nữ ca sĩ bị chỉ trích vì phát hành MV thô tục,Báo Tiền Phong,2022-09-30T11:00:00+07:00
https://baomoi.com/tong-bi-thu-chong-tham-nhung-phai-kien-tri-nhan-van-bai-ban-va-thuyet-phuc/c/42970500.epi,"Tổng Bí thư: Chống tham nhũng phải kiên trì, nhân văn, bài bản và thuyết phục",Báo Điện tử Đảng cộng sản VN,
