url,title,publisher,time
https://baomoi.com/bo-anh-long-lay-cua-hoa-hau-thuy-tien-voi-vuong-mien-miss-grand-moi/c/43872864.epi,Bộ ảnh lộng lẫy của Hoa hậu Thùy Tiên với vương miện Miss Grand mới,Báo VOV,2022-09-30T15:46:00+07:00
https://baomoi.com/tiep-tuc-to-chuc-ky-thi-tot-nghiep-trung-hoc-pho-thong-nam-2023-va-nhung-nam-sau/c/43873629.epi,Tiếp tục tổ chức Kỳ thi tốt nghiệp trung học phổ thông năm 2023 và những năm sau,Báo Nhân Dân,2022-09-30T17:01:00+07:00
https://baomoi.com/von-hoa-apple-bay-hoi-120-ty-usd-trong-24-gio/c/43872976.epi,Vốn hóa Apple bay hơi 120 tỷ USD trong 24 giờ,Tạp chí Tri Thức Trực Tuyến,2022-09-30T16:26:55+07:00
https://baomoi.com/hai-thanh-pho-trong-diem-moi-trong-cuoc-giao-tranh-o-donbass-ukraine/c/43869485.epi,"Hai thành phố trọng điểm mới trong cuộc giao tranh ở Donbass, Ukraine",Báo Tin Tức TTXVN,2022-09-30T10:34:00+07:00
https://baomoi.com/cac-nha-khoa-hoc-da-co-the-tao-ra-nhung-con-ga-co-dac-diem-cua-khung-long/c/43871363.epi,Các nhà khoa học đã có thể tạo ra những con gà có đặc điểm của khủng long,Báo Phụ Nữ Việt Nam,2022-09-30T14:13:00+07:00
https://baomoi.com/manh-long-j-20-cua-trung-quoc-xuat-hien-quanh-eo-bien-dai-loan/c/43872121.epi,'Mãnh long' J-20 của Trung Quốc xuất hiện quanh eo biển Đài Loan,Báo Tiền Phong,2022-09-30T15:08:00+07:00
https://baomoi.com/ctcp-chung-khoan-pho-wall-bi-phat-175-trieu-dong/c/43873695.epi,CTCP Chứng khoán Phố Wall bị phạt 175 triệu đồng,Báo Nhân Dân,2022-09-30T17:05:00+07:00
https://baomoi.com/cau-giay-194-khu-chung-cu-nha-cao-tang-vi-pham-quy-dinh-ve-phong-chay-chua/c/43873064.epi,"Cầu Giấy: 194 khu chung cư, nhà cao tầng vi phạm quy định về phòng cháy chữa",Báo Dân Sinh,2022-09-30T16:06:00+07:00
https://baomoi.com/7-thi-the-troi-dat-vao-bo-bien-phu-quoc-nghi-lien-quan-vu-dam-tau/c/43871080.epi,7 thi thể trôi dạt vào bờ biển Phú Quốc nghi liên quan vụ đắm tàu,Báo Tiền Phong,2022-09-30T13:41:00+07:00
https://baomoi.com/ngan-hang-dau-gia-lo-dat-cua-cong-ty-lien-quan-ong-trinh-van-quyet/c/43872977.epi,Ngân hàng đấu giá lô đất của công ty liên quan ông Trịnh Văn Quyết,Tạp chí Tri Thức Trực Tuyến,2022-09-30T16:26:11+07:00
https://baomoi.com/tp-hcm-thieu-dieu-duong-tram-trong-tai-cac-benh-vien-cong/c/43872993.epi,TP.HCM thiếu điều dưỡng trầm trọng tại các bệnh viện công,Báo Dân Sinh,2022-09-30T16:04:00+07:00
https://baomoi.com/chuyen-nhuong-cau-thu-ngoai-hang-anh-ngay-30-9-newcastle-lien-he-james-maddison-mu-uu-tien-ruben-neves-barca-quan-tam-diogo-dalot/c/43872518.epi,Chuyển nhượng cầu thủ Ngoại hạng Anh ngày 30/9: Newcastle liên hệ James Maddison; MU ưu tiên Ruben Neves; Barca quan tâm Diogo Dalot,Báo Thế Giới & Việt Nam,2022-09-30T15:32:00+07:00
https://baomoi.com/tong-thong-phap-canh-bao-giai-tan-quoc-hoi-do-mau-thuan-ve-cai-cach-huu-tri/c/43873001.epi,Tổng thống Pháp cảnh báo giải tán Quốc hội do mâu thuẫn về cải cách hưu trí,Báo VOV,2022-09-30T16:00:00+07:00
https://baomoi.com/tp-hcm-kien-nghi-bo-sung-19-449-ty-dong-cho-du-an-vanh-dai-3/c/43872352.epi,TP HCM kiến nghị bổ sung 19.449 tỷ đồng cho Dự án Vành đai 3,Tạp chí Mekong Asean,2022-09-30T15:30:00+07:00
https://baomoi.com/trinh-quoc-hoi-giai-phap-xu-ly-vuong-mac-mot-so-tram-thu-phi-bot/c/43873054.epi,Trình Quốc hội giải pháp xử lý vướng mắc một số trạm thu phí BOT,Báo Tiền Phong,2022-09-30T16:15:00+07:00
https://baomoi.com/son-heung-min-toi-world-cup-khong-chi-de-nhin-ronaldo/c/43871987.epi,Son Heung-min tới World Cup không chỉ để nhìn Ronaldo,Tạp chí Tri Thức Trực Tuyến,2022-09-30T15:15:24+07:00
https://baomoi.com/giam-tu-20-50-mot-so-loai-phi-hoat-dong-kinh-doanh-van-tai-tu-1-10-2022/c/43873028.epi,Giảm từ 20 - 50% một số loại phí hoạt động kinh doanh vận tải từ 1/10/2022,Báo Chính Phủ,2022-09-30T16:13:00+07:00
https://baomoi.com/duc-dang-trong-tinh-trang-cuc-ky-cang-thang-ve-nguon-cung-nang-luong/c/43872454.epi,Đức đang trong tình trạng 'cực kỳ căng thẳng' về nguồn cung năng lượng,Bnews,2022-09-30T15:32:00+07:00
https://baomoi.com/gia-lam-hon-200-truong-hop-xe-qua-kho-qua-tai-bi-xu-ly/c/43872686.epi,"Gia Lâm: Hơn 200 trường hợp xe quá khổ, quá tải bị xử lý",Báo An Ninh Thủ Đô,2022-09-30T15:51:05+07:00
https://baomoi.com/my-dua-tau-san-bay-dat-do-nhat-tap-tran-cung-dong-minh/c/43872212.epi,Mỹ đưa tàu sân bay đắt đỏ nhất tập trận cùng đồng minh,Báo Tiền Phong,2022-09-30T15:16:00+07:00
https://baomoi.com/95-oto-kinh-doanh-van-tai-da-lap-camera-giam-sat-hanh-trinh/c/43872775.epi,95% ôtô kinh doanh vận tải đã lắp camera giám sát hành trình,Tạp chí Tri Thức Trực Tuyến,2022-09-30T16:13:31+07:00
https://baomoi.com/lai-suat-tien-gui-ngan-hang-vuot-8-nam/c/43871853.epi,Lãi suất tiền gửi ngân hàng vượt 8%/năm,Tạp chí Tri Thức Trực Tuyến,2022-09-30T15:04:28+07:00
https://baomoi.com/hon-80-000-nguoi-viet-sang-han-quoc-du-lich-trong-8-thang/c/43871753.epi,Hơn 80.000 người Việt sang Hàn Quốc du lịch trong 8 tháng,Báo Tiền Phong,2022-09-30T14:43:00+07:00
https://baomoi.com/de-xuat-nguoi-co-hop-dong-tu-1-thang-duoc-dong-bao-hiem-that-nghiep/c/43872784.epi,Đề xuất người có hợp đồng từ 1 tháng được đóng Bảo hiểm thất nghiệp,Báo Tiền Phong,2022-09-30T15:52:00+07:00
https://baomoi.com/bo-y-te-huong-dan-ve-sinh-ca-nhan-ve-sinh-nguon-nuoc-sau-bao-lu/c/43873349.epi,"Bộ Y tế hướng dẫn vệ sinh cá nhân, vệ sinh nguồn nước sau bão lũ",Báo Tin Tức TTXVN,2022-09-30T16:11:00+07:00
https://baomoi.com/hang-chuc-cong-nhan-doi-mua-gap-rut-hoan-thanh-ham-chui-le-van-luong/c/43872469.epi,Hàng chục công nhân 'đội mưa' gấp rút hoàn thành hầm chui Lê Văn Lương,Báo Sức Khỏe & Đời Sống,2022-09-30T15:36:00+07:00
https://baomoi.com/vua-gay-that-vong-voi-ngoai-hinh-xuong-doc-hoai-lam-bat-ngo-don-tin-vui-kho-tin/c/43873560.epi,"Vừa gây thất vọng với ngoại hình 'xuống dốc', Hoài Lâm bất ngờ đón 'tin vui' khó tin",Tạp chí SaoStar,2022-09-30T16:53:00+07:00
https://baomoi.com/them-2-khu-tap-the-cu-o-ha-noi-se-duoc-pha-do-xay-moi-vao-cuoi-nam-2023/c/43873107.epi,Thêm 2 khu tập thể cũ ở Hà Nội sẽ được phá dỡ xây mới vào cuối năm 2023,Tạp chí Mekong Asean,2022-09-30T16:12:00+07:00
https://baomoi.com/lo-ngai-trung-quoc-tang-cuong-anh-huong-lan-dau-tien-my-lam-dieu-nay/c/43872446.epi,"Lo ngại Trung Quốc tăng cường ảnh hưởng, lần đầu tiên Mỹ làm điều này",Báo Giao Thông,2022-09-30T15:14:00+07:00
https://baomoi.com/cuoc-khung-hoang-kim-chi-tai-han-quoc-va-chien-luoc-giu-gin-mon-an-ban-sac/c/43872898.epi,Cuộc khủng hoảng kim chi tại Hàn Quốc và chiến lược giữ gìn món ăn bản sắc,Báo Tổ Quốc,2022-09-30T16:03:00+07:00
https://baomoi.com/thuc-hu-tam-bien-sinh-vien-khong-de-o-to-trong-san-truong-xon-xao-mang-xa-hoi/c/43871814.epi,Thực hư tấm biển 'sinh viên không để ô tô trong sân trường' xôn xao mạng xã hội,Báo VietnamNet,2022-09-30T14:44:00+07:00
https://baomoi.com/ron-lu-thanh-chuong-noi-hang-tram-nha-dan-van-bi-nuoc-bua-vay/c/43871079.epi,"Rốn lũ Thanh Chương, nơi hàng trăm nhà dân vẫn bị nước bủa vây",Báo VietnamNet,2022-09-30T13:36:00+07:00
https://baomoi.com/3-thang-cao-diem-bac-giang-xu-ly-hon-11-000-truong-hop-vi-pham-giao-thong/c/43872729.epi,"3 tháng cao điểm, Bắc Giang xử lý hơn 11.000 trường hợp vi phạm giao thông",Báo VOV,2022-09-30T15:48:00+07:00
https://baomoi.com/nhung-sai-lam-moi-nguoi-mac-phai-khi-co-gang-giam-can/c/43872662.epi,Những sai lầm mọi người mắc phải khi cố gắng giảm cân,Báo Pháp Luật TP.HCM,2022-09-30T15:47:24+07:00
https://baomoi.com/mat-dan-ga-tien-ty-chu-trang-trai-treo-thuong-200-trieu-dong-tim-trom/c/43870794.epi,"Mất đàn gà tiền tỷ, chủ trang trại treo thưởng 200 triệu đồng tìm trộm",Báo Công An Nhân Dân,2022-09-30T12:55:00+07:00
https://baomoi.com/ta-hoa-phat-hien-nguoi-dan-ong-tu-vong-ngoai-canh-dong/c/43871047.epi,Tá hỏa phát hiện người đàn ông tử vong ngoài cánh đồng,Báo Người Lao Động,2022-09-30T13:35:20+07:00
https://baomoi.com/vac-xin-covid-19-lam-roi-loan-chu-ky-kinh-nguyet/c/43873412.epi,Vắc-xin Covid-19 làm rối loạn chu kỳ kinh nguyệt,Báo Giáo Dục & Thời Đại,2022-09-30T16:39:00+07:00
https://baomoi.com/canh-bao-chieu-nay-ha-noi-tiep-tuc-mua-lon-vao-gio-tan-tam/c/43872039.epi,Cảnh báo: Chiều nay Hà Nội tiếp tục mưa lớn vào giờ tan tầm,Báo Sức Khỏe & Đời Sống,2022-09-30T15:02:00+07:00
https://baomoi.com/mua-biet-thu-tang-con-nhat-kim-anh-giau-co-nao-o-tuoi-u40/c/43870980.epi,"Mua biệt thự tặng con, Nhật Kim Anh giàu cỡ nào ở tuổi U40?",Báo Kiến Thức,2022-09-30T13:30:00+07:00
https://baomoi.com/lo-ngai-hanh-vi-cua-trieu-tien-han-quoc-can-nhac-bien-phap-cung-ran-cung-my-tap-tran-mo-phong-tan-cong/c/43872589.epi,"Lo ngại hành vi của Triều Tiên, Hàn Quốc cân nhắc biện pháp cứng rắn, cùng Mỹ tập trận mô phỏng tấn công",Báo Thế Giới & Việt Nam,2022-09-30T15:42:00+07:00
https://baomoi.com/vu-truong-vu-ppp-lam-cuc-truong-cuc-duong-cao-toc-viet-nam/c/43872685.epi,Vụ trưởng Vụ PPP làm Cục trưởng Cục Đường cao tốc Việt Nam,Báo An Ninh Thủ Đô,2022-09-30T15:50:47+07:00
https://baomoi.com/david-beckham-noi-gian-voi-con-trai-brooklyn/c/43871888.epi,David Beckham nổi giận với con trai Brooklyn,Báo Tiền Phong,2022-09-30T14:51:00+07:00
https://baomoi.com/quy-dinh-69-lieu-thuoc-dac-tri-benh-chay-chuc-chay-quyen/c/43873115.epi,"Quy định 69 - Liều thuốc đặc trị bệnh chạy chức, chạy quyền",Báo Nhân Dân,2022-09-30T16:15:00+07:00
https://baomoi.com/ha-noi-sap-cai-tao-vuon-hoa-con-coc/c/43872682.epi,Hà Nội sắp cải tạo vườn hoa Con Cóc,Báo Tiền Phong,2022-09-30T15:50:00+07:00
https://baomoi.com/nguon-con-nga-va-trung-quoc-cho-xay-dung-cac-tram-ve-tinh-tren-mat-dat-cua-nhau/c/43873646.epi,Nguồn cơn Nga và Trung Quốc cho xây dựng các trạm vệ tinh trên mặt đất của nhau,Tạp chí Một Thế Giới,2022-09-30T17:00:00+07:00
https://baomoi.com/phan-lan-dong-cua-bien-gioi-voi-du-khach-nga/c/43872734.epi,Phần Lan đóng cửa biên giới với du khách Nga,Báo VOV,2022-09-30T15:41:00+07:00
https://baomoi.com/dot-pha-bat-ngo-ve-cach-chua-tri-ung-thu/c/43872838.epi,Đột phá bất ngờ về cách chữa trị ung thư,Tạp chí Tri Thức Trực Tuyến,2022-09-30T16:15:57+07:00
https://baomoi.com/loat-thuc-don-com-cu-ngon-lanh-cho-vo-sau-sinh-cua-anh-chong-kheo-tay/c/43872633.epi,Loạt thực đơn cơm cữ ngon lành cho vợ sau sinh của anh chồng khéo tay,Báo Infonet,2022-09-30T15:47:00+07:00
https://baomoi.com/duc-chi-200-ty-euro-de-ho-tro-nguoi-dan-vuot-qua-khung-hoang-nang-luong/c/43872651.epi,Đức chi 200 tỷ euro để hỗ trợ người dân vượt qua khủng hoảng năng lượng,Bnews,2022-09-30T15:50:00+07:00
https://baomoi.com/vu-no-o-kabul-do-danh-bom-lieu-chet-gan-50-nguoi-thuong-vong/c/43870885.epi,"Vụ nổ ở Kabul do đánh bom liều chết, gần 50 người thương vong",Báo VietnamPlus,2022-09-30T13:12:00+07:00
https://baomoi.com/khan-gia-that-vong-vi-nghe-si-viet-quang-cao-tra-hinh-boi-tu-vi/c/43870473.epi,Khán giả thất vọng vì nghệ sĩ Việt quảng cáo trá hình 'bói tử vi',Tạp chí Tri Thức Trực Tuyến,2022-09-30T12:19:47+07:00
https://baomoi.com/phe-chuan-khoi-to-doi-tuong-hiep-dam-huong-dan-vien-du-lich-tai-homestay/c/43870598.epi,Phê chuẩn khởi tố đối tượng hiếp dâm hướng dẫn viên du lịch tại Homestay,Báo Bảo Vệ Pháp Luật,2022-09-30T12:26:00+07:00
https://baomoi.com/triet-pha-duong-day-chuyen-hack-facebook-roi-ban-voi-gia-50-trieu-dong/c/43872502.epi,Triệt phá đường dây chuyên 'hack' facebook rồi bán với giá 50 triệu đồng,Báo An Ninh Thủ Đô,2022-09-30T15:23:36+07:00
https://baomoi.com/da-nang-phat-trien-nhanh-giao-duc-nghe-nghiep-dap-ung-nhu-cau-da-dang-cua-thi-truong-lao-dong/c/43873062.epi,"Đà Nẵng phát triển nhanh giáo dục nghề nghiệp, đáp ứng nhu cầu đa dạng của thị trường lao động",Báo Dân Sinh,2022-09-30T16:08:00+07:00
https://baomoi.com/doanh-thu-khong-tuong-cua-bong-dung-trung-so-sau-1-tuan-chieu-tai-viet-nam/c/43872008.epi,Doanh thu không tưởng của 'Bỗng dưng trúng số' sau 1 tuần chiếu tại Việt Nam,Báo VietnamNet,2022-09-30T14:50:00+07:00
https://baomoi.com/bo-chinh-tri-ky-luat-canh-cao-chu-tich-vien-han-lam-khoa-hoc-xa-hoi-bui-nhat-quang/c/43871638.epi,Bộ Chính trị kỷ luật cảnh cáo Chủ tịch Viện Hàn lâm Khoa học xã hội Bùi Nhật Quang,Báo Người Lao Động,2022-09-30T14:34:00+07:00
https://baomoi.com/tim-kiem-nam-thanh-nien-nghi-nhay-cau-nhat-tan-tu-tu/c/43872245.epi,Tìm kiếm nam thanh niên nghi nhảy cầu Nhật Tân tự tử,Báo Sức Khỏe & Đời Sống,2022-09-30T15:20:00+07:00
https://baomoi.com/xo-xat-hoc-duong-nu-sinh-bi-ban-dam-da-lien-tuc-vao-dau-bung/c/43871706.epi,"Xô xát học đường, nữ sinh bị bạn đấm đá liên tục vào đầu, bụng",Báo VOV,2022-09-30T14:32:00+07:00
https://baomoi.com/khung-hoang-nam-gioi/c/43872225.epi,Khủng hoảng nam giới,Tạp chí Tri Thức Trực Tuyến,2022-09-30T15:33:44+07:00
https://baomoi.com/nuoc-lu-bao-vay-nguoi-dan-nhieu-xa-o-ha-tinh-bi-co-lap/c/43872400.epi,"Nước lũ bao vây, người dân nhiều xã ở Hà Tĩnh bị cô lập",Báo Tiền Phong,2022-09-30T15:29:00+07:00
https://baomoi.com/tim-thay-thi-the-2-vo-chong-bi-lu-cuon/c/43870858.epi,Tìm thấy thi thể 2 vợ chồng bị lũ cuốn,Tạp chí Tri Thức Trực Tuyến,2022-09-30T13:24:39+07:00
https://baomoi.com/viet-nam-tu-nho-be-den-vi-dai-ky-tich-kinh-te-khien-the-gioi-kinh-ngac/c/43872604.epi,"Việt Nam: Từ 'nhỏ bé' đến 'vĩ đại', kỳ tích kinh tế khiến thế giới kinh ngạc",Báo Thế Giới & Việt Nam,2022-09-30T15:26:00+07:00
https://baomoi.com/gap-phien-toai-vi-tinh-nang-cuu-ho-tren-iphone-14/c/43872992.epi,Gặp phiền toái vì tính năng cứu hộ trên iPhone 14,Báo Dân Sinh,2022-09-30T16:00:00+07:00
https://baomoi.com/loat-nha-may-san-xuat-o-to-dong-cua-do-bao-o-to-sap-khan-hang/c/43871447.epi,"Loạt nhà máy sản xuất ô tô đóng cửa do bão, ô tô sắp khan hàng?",Báo Pháp Luật TP.HCM,2022-09-30T14:18:57+07:00
https://baomoi.com/apple-sa-thai-pho-chu-tich-sau-tro-dua-tren-tiktok/c/43870834.epi,Apple sa thải phó chủ tịch sau trò đùa trên TikTok,Báo Pháp Luật TP.HCM,2022-09-30T13:05:29+07:00
https://baomoi.com/binh-an-he-lo-tung-duoc-lam-bao-chau-xin-via-ngay-ruoc-le-quyen-da-den-gan/c/43873630.epi,"Bình An hé lộ từng được Lâm Bảo Châu 'xin vía', ngày rước Lệ Quyên đã đến gần?",Tạp chí SaoStar,2022-09-30T17:00:00+07:00
https://baomoi.com/hanh-trinh-xuyen-the-ky-lam-phuoc/c/43872539.epi,Hành trình xuyên thế kỷ làm phước,Báo Sức Khỏe & Đời Sống,2022-09-30T15:24:00+07:00
https://baomoi.com/pha-duong-day-lam-gia-thuoc-nuoi-trong-thuy-san-quy-mo-lon/c/43870207.epi,Phá đường dây làm giả thuốc nuôi trồng thủy sản quy mô lớn,Báo Tiền Phong,2022-09-30T11:38:00+07:00
https://baomoi.com/bo-xay-dung-xu-nghiem-vi-pham-quy-hoach-kiem-soat-nha-cao-tang-o-noi-do/c/43872393.epi,"Bộ Xây dựng: Xử nghiêm vi phạm quy hoạch, kiểm soát nhà cao tầng ở nội đô",Báo VietnamNet,2022-09-30T15:30:00+07:00
https://baomoi.com/rimario-tu-sao-xit-cua-hagl-den-nguoi-hung-cua-hai-phong/c/43870789.epi,Rimario - Từ 'sao xịt' của HAGL đến người hùng của Hải Phòng,Báo VOV,2022-09-30T12:54:00+07:00
https://baomoi.com/miss-grand-vietnam-noi-ro-van-de-ho-ten-chung-toi-da-yeu-cau-thi-sinh-tiet-che-lai-o-dem-chung-ket/c/43869673.epi,Miss Grand Vietnam nói rõ vấn đề 'hô tên': Chúng tôi đã yêu cầu thí sinh tiết chế lại ở đêm chung kết,Tạp chí SaoStar,2022-09-30T10:55:00+07:00
https://baomoi.com/phien-30-9-dong-usd-giam-gia-vang-chau-a-di-len/c/43872587.epi,"Phiên 30/9, đồng USD giảm, giá vàng châu Á đi lên",Bnews,2022-09-30T15:43:00+07:00
https://baomoi.com/nhung-nghe-si-tung-vuong-on-ao-tu-thien-phan-ung-ra-sao-truoc-hau-qua-cua-con-bao-noru/c/43871848.epi,Những nghệ sĩ từng vướng ồn ào từ thiện phản ứng ra sao trước hậu quả của cơn bão Noru?,Sinh viên Việt Nam,2022-09-30T14:46:05+07:00
https://baomoi.com/ha-tinh-hon-3-4-ty-dong-khac-phuc-duong-sat-lo-hu-hong-do-bao-so-4/c/43872672.epi,"Hà Tĩnh: Hơn 3,4 tỷ đồng khắc phục đường sạt lở, hư hỏng do bão số 4",Tạp Chí Giao Thông Vận Tải,2022-09-30T15:38:00+07:00
https://baomoi.com/nang-tam-hop-tac-van-tai-hang-hai-asean/c/43873533.epi,Nâng tầm hợp tác vận tải hàng hải ASEAN,Tạp Chí Giao Thông Vận Tải,2022-09-30T16:49:00+07:00
https://baomoi.com/chinh-sach-nao-cho-cac-du-an-dau-khi-da-va-dang-trien-khai-truoc-ngay-luat-dau-khi-sua-doi-co-hieu-luc/c/43869319.epi,Chính sách nào cho các dự án Dầu khí đã và đang triển khai trước ngày Luật Dầu khí (sửa đổi) có hiệu lực?,Tạp chí Người Đưa Tin,2022-09-30T10:24:00+07:00
https://baomoi.com/brazil-se-vo-dich-world-cup-2022/c/43872948.epi,Brazil sẽ vô địch World Cup 2022?,Báo Công Lý,2022-09-30T15:52:00+07:00
https://baomoi.com/thuc-tien-do-giai-ngan-cac-du-an-giao-thong/c/43873759.epi,Thúc tiến độ giải ngân các dự án giao thông,Bnews,2022-09-30T17:11:00+07:00
https://baomoi.com/bts-lam-gi-de-khong-mac-benh-ngoi-sao/c/43872896.epi,BTS làm gì để không mắc 'bệnh ngôi sao'?,Báo Giao Thông,2022-09-30T15:47:00+07:00
https://baomoi.com/chau-au-lo-mang-luoi-dien-thoai-di-dong-ngung-hoat-dong-vi-thieu-dien-vao-mua-dong/c/43871541.epi,Châu Âu lo mạng lưới điện thoại di động ngừng hoạt động vì thiếu điện vào mùa đông,Báo Tin Tức TTXVN,2022-09-30T14:23:00+07:00
https://baomoi.com/de-xuat-tieu-chuan-xet-thang-hang-chuc-danh-vien-chuc-tro-giup-vien-phap-ly/c/43872732.epi,"Đề xuất tiêu chuẩn, xét thăng hạng chức danh viên chức trợ giúp viên pháp lý",Báo Chính Phủ,2022-09-30T15:45:00+07:00
https://baomoi.com/luat-su-bao-chua-cho-thi-hao-nguyen-trai-va-ba-nguyen-thi-lo-qua-doi/c/43871716.epi,'Luật sư bào chữa cho thi hào Nguyễn Trãi và bà Nguyễn Thị Lộ' qua đời,Báo Pháp Luật TP.HCM,2022-09-30T14:39:41+07:00
https://baomoi.com/dau-sung-du-doi-o-thu-do-cua-burkina-faso/c/43872759.epi,Đấu súng dữ dội ở thủ đô của Burkina Faso,Báo Tin Tức TTXVN,2022-09-30T15:41:00+07:00
https://baomoi.com/dieu-chinh-chuong-trinh-xay-dung-luat-phap-lenh-nam-2022/c/43870698.epi,"Điều chỉnh Chương trình xây dựng luật, pháp lệnh năm 2022",Báo Tin Tức TTXVN,2022-09-30T12:39:00+07:00
https://baomoi.com/chu-dau-tu-nha-thuong-mai-nen-duoc-chon-hinh-thuc-thuc-hien-nghia-vu-noxh/c/43872326.epi,Chủ đầu tư nhà thương mại nên được chọn hình thức thực hiện nghĩa vụ NƠXH,Báo VietnamNet,2022-09-30T15:23:00+07:00
https://baomoi.com/kien-quyet-khong-khoan-nhuong-voi-tham-nhung-tieu-cuc/c/43036870.epi,"Kiên quyết không khoan nhượng với tham nhũng, tiêu cực",Báo Điện tử Đảng cộng sản VN,
https://baomoi.com/clip-cho-rang-bi-nhin-deu-nhom-thanh-nien-danh-da-man-nguoi-dan-ong-trong-quan-nhau/c/43873856.epi,"CLIP: Cho rằng bị nhìn đểu, nhóm thanh niên đánh dã man người đàn ông trong quán nhậu",Báo Người Lao Động,2022-09-30T17:19:28+07:00
https://baomoi.com/khong-khi-lanh-tran-ve-mien-bac-nhieu-noi-mua-lon-keo-dai/c/43873835.epi,"Không khí lạnh tràn về miền Bắc, nhiều nơi mưa lớn kéo dài",Báo VietnamNet,2022-09-30T17:14:00+07:00
https://baomoi.com/tp-hcm-nong-cau-chuyen-thoi-han-so-huu-nha-chung-cu/c/43873857.epi,TP HCM: 'Nóng' câu chuyện thời hạn sở hữu nhà chung cư,Báo Người Lao Động,2022-09-30T17:13:11+07:00
https://baomoi.com/to-chuc-dau-gia-tai-san-cong-roi-xu-luon-tien-dat-truoc/c/43873824.epi,Tổ chức đấu giá tài sản công rồi 'xù' luôn tiền đặt trước,Báo Nhân Dân,2022-09-30T17:13:00+07:00
https://baomoi.com/hon-200-nghe-nhan-dien-vien-tham-gia-lien-hoan-hat-then-dan-tinh-tinh-cao-bang/c/43873839.epi,"Hơn 200 nghệ nhân, diễn viên tham gia Liên hoan hát Then, đàn Tính tỉnh Cao Bằng",Báo VOV,2022-09-30T17:13:00+07:00
https://baomoi.com/khoi-to-bat-tam-giam-nguyen-chi-cuc-truong-chi-cuc-du-tru-nha-nuoc-moc-chau/c/43873785.epi,"Khởi tố, bắt tạm giam nguyên Chi cục trưởng Chi cục Dự trữ Nhà nước Mộc Châu",Báo Tiền Phong,2022-09-30T17:12:00+07:00
https://baomoi.com/thieu-nien-bi-canh-sat-duoi-theo-danh-dap-noi-gi/c/43864629.epi,Thiếu niên bị cảnh sát đuổi theo đánh đập nói gì?,Báo VTC News,
https://baomoi.com/vot-chiec-vali-la-troi-noi-tren-song-nguoi-dan-soc-nang-khi-mo-ra/c/43866863.epi,"Vớt chiếc vali 'lạ' trôi nổi trên sông, người dân sốc nặng khi mở ra",Tạp chí SaoStar,2022-09-30T07:00:00+07:00
https://baomoi.com/ket-dau-long-cua-nu-dai-gia-sau-khi-vao-khach-san-voi-huan-luyen-vien-gym/c/43868351.epi,Kết đau lòng của nữ đại gia sau khi vào khách sạn với huấn luyện viên gym,Báo VietnamNet,2022-09-30T09:08:00+07:00
https://baomoi.com/hien-truong-7-thi-the-troi-dat-o-bai-bien-phu-quoc/c/43864061.epi,Hiện trường 7 thi thể trôi dạt ở bãi biển Phú Quốc,Tạp chí Tri Thức Trực Tuyến,
https://baomoi.com/dang-giua-chuyen-bay-vo-phat-hien-chong-chet-tren-ghe-may-bay/c/43864902.epi,"Đang giữa chuyến bay, vợ phát hiện chồng chết trên ghế máy bay",Báo Người Lao Động,
https://baomoi.com/ba-luat-su-bao-chua-cho-ba-nguyen-phuong-hang/c/43866209.epi,Ba luật sư bào chữa cho bà Nguyễn Phương Hằng,Báo Tiền Phong,2022-09-30T05:37:00+07:00
https://baomoi.com/an-mang-dau-long-gia-dinh-tan-nat/c/43864558.epi,"Án mạng đau lòng, gia đình tan nát",Báo Người Lao Động,
https://baomoi.com/day-xe-tang-2-nguoi-dan-ong-bi-dien-giat-tu-vong/c/43864153.epi,"Đẩy xe tang, 2 người đàn ông bị điện giật tử vong",Báo Giao Thông,
https://baomoi.com/pho-tong-thong-my-toi-han-quoc-de-tran-an-them-han-gan/c/43861973.epi,"Phó Tổng thống Mỹ tới Hàn Quốc: Để trấn an, thêm hàn gắn",Báo Thế Giới & Việt Nam,
https://baomoi.com/vu-khi-nguy-hiem-doi-voi-eu/c/43858012.epi,'Vũ khí' nguy hiểm đối với EU,Báo Tin Tức TTXVN,
https://baomoi.com/cai-to-hoi-dong-bao-an-lien-hop-quoc-khi-xu-the-cung-chinh-la-diem-nghen/c/43857738.epi,Cải tổ Hội đồng Bảo an Liên hợp quốc: Khi xu thế cũng chính là điểm nghẽn,Báo An Ninh Thế Giới,
https://baomoi.com/van-bai-nang-luong-cua-nga-o-chau-a-trong-boi-canh-xung-dot-ukraine/c/43856483.epi,Ván bài năng lượng của Nga ở châu Á trong bối cảnh xung đột Ukraine,Báo VOV,
https://baomoi.com/ai-duoc-huong-loi-tu-kich-ban-dong-chay-phuong-bac-bi-pha-hoai/c/43854709.epi,Ai được hưởng lợi từ kịch bản Dòng chảy phương Bắc bị phá hoại?,Báo VOV,
https://baomoi.com/tac-dong-toan-cau-sau-khi-fed-tang-lai-suat-len-cao-nhat-tu-nam-2008/c/43851284.epi,Tác động toàn cầu sau khi FED tăng lãi suất lên cao nhất từ năm 2008,Báo Tin Tức TTXVN,
https://baomoi.com/nguoi-phu-nu-khien-ca-chau-au-lo-lang/c/43847833.epi,Người phụ nữ khiến cả châu Âu lo lắng,Tạp chí Tri Thức Trực Tuyến,
https://baomoi.com/chinh-phu-moi-o-italy-se-tac-dong-the-nao-voi-eu-va-cuoc-xung-dot-nga-ukraine/c/43845884.epi,Chính phủ mới ở Italy sẽ tác động thế nào với EU và cuộc xung đột Nga - Ukraine?,Báo Tin Tức TTXVN,
https://baomoi.com/nguoi-dan-ong-tim-thay-khuyen-mui-trong-phoi-sau-5-nam-that-lac/c/43873214.epi,Người đàn ông tìm thấy khuyên mũi trong phổi sau 5 năm thất lạc,Báo VietnamPlus,2022-09-30T16:12:00+07:00
https://baomoi.com/bo-gtvt-ung-ho-lam-san-bay-quan-binh-dau-tu-nhieu-tuyen-duong-o-bac-kan/c/43873643.epi,"Bộ GTVT ủng hộ làm sân bay Quân Bình, đầu tư nhiều tuyến đường ở Bắc Kạn",Tạp Chí Giao Thông Vận Tải,2022-09-30T16:59:00+07:00
https://baomoi.com/chot-ha-thang-9-thi-truong-co-phien-phuc-hoi-dau-tien/c/43872597.epi,"Chốt hạ tháng 9, thị trường có phiên phục hồi đầu tiên",Tạp chí Vnbusiness,2022-09-30T15:37:00+07:00
https://baomoi.com/cach-an-kieng-cua-duong-thua-lam/c/43872444.epi,Cách ăn kiêng của Dương Thừa Lâm,Tạp chí Tri Thức Trực Tuyến,2022-09-30T15:50:00+07:00
https://baomoi.com/gia-xang-trong-nuoc-co-the-giam-900-1-200-dong-lit/c/43872699.epi,Giá xăng trong nước có thể giảm 900 - 1.200 đồng/lít,Tạp chí Chất lượng Việt Nam,2022-09-30T15:27:00+07:00
https://baomoi.com/thong-nhat-chu-truong-dau-tu-nang-cap-ql63-qua-ca-mau/c/43873197.epi,Thống nhất chủ trương đầu tư nâng cấp QL63 qua Cà Mau,Tạp Chí Giao Thông Vận Tải,2022-09-30T16:26:00+07:00
https://baomoi.com/eu-xem-xet-cac-giai-phap-khan-cap-nham-ha-gia-nang-luong/c/43871203.epi,EU xem xét các giải pháp khẩn cấp nhằm hạ giá năng lượng,Báo VietnamPlus,2022-09-30T13:56:00+07:00
