url,title,publisher,time
https://baomoi.com/tiem-nang-lon-cua-viet-nam-khi-bien-rac-thai-thanh-nhien-lieu/c/43868962.epi,Tiềm năng lớn của Việt Nam khi biến rác thải thành nhiên liệu,Tạp chí Tri Thức Trực Tuyến,2022-09-30T10:15:10+07:00
https://baomoi.com/de-xuat-tieu-chi-tieu-chuan-chat-luong-cung-cap-dich-vu-giam-dinh-di-vat-co-vat/c/43872374.epi,"Đề xuất tiêu chí, tiêu chuẩn chất lượng cung cấp dịch vụ giám định di vật, cổ vật",Báo Chính Phủ,2022-09-30T15:11:00+07:00
https://baomoi.com/my-day-manh-phat-trien-thiet-bi-khong-nguoi-lai-duoi-nuoc/c/43871531.epi,Mỹ đẩy mạnh phát triển thiết bị không người lái dưới nước,Tạp chí Một Thế Giới,2022-09-30T14:25:00+07:00
https://baomoi.com/day-lai-xe-trong-khu-dan-cu-hai-giao-vien-bi-csgt-xu-phat/c/43869381.epi,"Dạy lái xe trong khu dân cư, hai giáo viên bị CSGT xử phạt",Tạp chí Tri Thức Trực Tuyến,2022-09-30T10:45:58+07:00
https://baomoi.com/de-xuat-duy-tri-co-so-thu-dung-dieu-tri-benh-nhan-covid-19/c/43870920.epi,"Đề xuất duy trì cơ sở thu dung, điều trị bệnh nhân Covid-19",Báo Hà Nội Mới,2022-09-30T11:20:00+07:00
https://baomoi.com/chang-trai-hai-phong-tu-hoc-de-chinh-phuc-olympia/c/43870821.epi,Chàng trai Hải Phòng tự học để chinh phục Olympia,Báo Giáo Dục & Thời Đại,2022-09-30T13:02:00+07:00
https://baomoi.com/ca-si-han-quoc-gay-xuong-mat-do-bat-can/c/43871642.epi,Ca sĩ Hàn Quốc gãy xương mặt do bất cẩn,Tạp chí Người Đưa Tin,2022-09-30T14:27:00+07:00
https://baomoi.com/nhieu-nguoi-bat-chap-lieu-mang-chi-vi-mong-muon-giam-can-nhanh/c/43870757.epi,Nhiều người bất chấp liều mạng chỉ vì mong muốn giảm cân nhanh,Báo Infonet,2022-09-30T12:50:00+07:00
https://baomoi.com/doan-dai-bieu-uy-ban-khoa-hoc-cong-nghe-va-moi-truong-tham-lam-viec-tai-hoa-ky/c/43872437.epi,"Đoàn đại biểu Ủy ban Khoa học, Công nghệ và Môi trường thăm, làm việc tại Hoa Kỳ",Đại Biểu Nhân Dân,2022-09-30T15:14:00+07:00
https://baomoi.com/de-xuat-keo-dai-chinh-sach-dac-thu-phong-chong-dich-covid-19/c/43870273.epi,Đề xuất kéo dài chính sách đặc thù phòng chống dịch Covid-19,Báo Đầu Tư,2022-09-30T11:41:00+07:00
https://baomoi.com/nu-than-tuong-2-lan-len-ngoi-quan-quan-ca-si-mat-na-ban-han/c/43871751.epi,Nữ thần tượng 2 lần lên ngôi Quán quân Ca Sĩ Mặt Nạ bản Hàn,Báo Tổ Quốc,2022-09-30T14:23:00+07:00
https://baomoi.com/hon-dao-ky-la-o-han-quoc-noi-tat-tan-tat-moi-thu-deu-ngap-trong-sac-tim-goc-nao-cung-dep-long-lanh/c/43871502.epi,"Hòn đảo kỳ lạ ở Hàn Quốc nơi tất tần tật mọi thứ đều ngập trong sắc tím, góc nào cũng đẹp long lanh",Báo Tổ Quốc,2022-09-30T14:24:00+07:00
https://baomoi.com/thuc-day-van-dong-cong-dong-chung-tay-ho-tro-phu-nu/c/43872077.epi,"Thúc đẩy, vận động cộng đồng chung tay hỗ trợ phụ nữ",Báo Nhân Dân,2022-09-30T15:04:00+07:00
https://baomoi.com/hinh-anh-thay-ky-mai-in-sau-trong-trai-tim-hoc-tro-que-huong/c/43870255.epi,Hình ảnh thầy Ký mãi in sâu trong trái tim học trò quê hương,Báo Giáo Dục & Thời Đại,2022-09-30T11:39:00+07:00
https://baomoi.com/kien-quyet-khong-khoan-nhuong-voi-tham-nhung-tieu-cuc/c/43036870.epi,"Kiên quyết không khoan nhượng với tham nhũng, tiêu cực",Báo Điện tử Đảng cộng sản VN,
https://baomoi.com/clip-cho-rang-bi-nhin-deu-nhom-thanh-nien-danh-da-man-nguoi-dan-ong-trong-quan-nhau/c/43873856.epi,"CLIP: Cho rằng bị nhìn đểu, nhóm thanh niên đánh dã man người đàn ông trong quán nhậu",Báo Người Lao Động,2022-09-30T17:19:28+07:00
https://baomoi.com/khong-khi-lanh-tran-ve-mien-bac-nhieu-noi-mua-lon-keo-dai/c/43873835.epi,"Không khí lạnh tràn về miền Bắc, nhiều nơi mưa lớn kéo dài",Báo VietnamNet,2022-09-30T17:14:00+07:00
https://baomoi.com/tp-hcm-nong-cau-chuyen-thoi-han-so-huu-nha-chung-cu/c/43873857.epi,TP HCM: 'Nóng' câu chuyện thời hạn sở hữu nhà chung cư,Báo Người Lao Động,2022-09-30T17:13:11+07:00
https://baomoi.com/to-chuc-dau-gia-tai-san-cong-roi-xu-luon-tien-dat-truoc/c/43873824.epi,Tổ chức đấu giá tài sản công rồi 'xù' luôn tiền đặt trước,Báo Nhân Dân,2022-09-30T17:13:00+07:00
https://baomoi.com/hon-200-nghe-nhan-dien-vien-tham-gia-lien-hoan-hat-then-dan-tinh-tinh-cao-bang/c/43873839.epi,"Hơn 200 nghệ nhân, diễn viên tham gia Liên hoan hát Then, đàn Tính tỉnh Cao Bằng",Báo VOV,2022-09-30T17:13:00+07:00
https://baomoi.com/khoi-to-bat-tam-giam-nguyen-chi-cuc-truong-chi-cuc-du-tru-nha-nuoc-moc-chau/c/43873785.epi,"Khởi tố, bắt tạm giam nguyên Chi cục trưởng Chi cục Dự trữ Nhà nước Mộc Châu",Báo Tiền Phong,2022-09-30T17:12:00+07:00
https://baomoi.com/thieu-nien-bi-canh-sat-duoi-theo-danh-dap-noi-gi/c/43864629.epi,Thiếu niên bị cảnh sát đuổi theo đánh đập nói gì?,Báo VTC News,
https://baomoi.com/vot-chiec-vali-la-troi-noi-tren-song-nguoi-dan-soc-nang-khi-mo-ra/c/43866863.epi,"Vớt chiếc vali 'lạ' trôi nổi trên sông, người dân sốc nặng khi mở ra",Tạp chí SaoStar,2022-09-30T07:00:00+07:00
https://baomoi.com/ket-dau-long-cua-nu-dai-gia-sau-khi-vao-khach-san-voi-huan-luyen-vien-gym/c/43868351.epi,Kết đau lòng của nữ đại gia sau khi vào khách sạn với huấn luyện viên gym,Báo VietnamNet,2022-09-30T09:08:00+07:00
https://baomoi.com/hien-truong-7-thi-the-troi-dat-o-bai-bien-phu-quoc/c/43864061.epi,Hiện trường 7 thi thể trôi dạt ở bãi biển Phú Quốc,Tạp chí Tri Thức Trực Tuyến,
https://baomoi.com/dang-giua-chuyen-bay-vo-phat-hien-chong-chet-tren-ghe-may-bay/c/43864902.epi,"Đang giữa chuyến bay, vợ phát hiện chồng chết trên ghế máy bay",Báo Người Lao Động,
https://baomoi.com/ba-luat-su-bao-chua-cho-ba-nguyen-phuong-hang/c/43866209.epi,Ba luật sư bào chữa cho bà Nguyễn Phương Hằng,Báo Tiền Phong,2022-09-30T05:37:00+07:00
https://baomoi.com/an-mang-dau-long-gia-dinh-tan-nat/c/43864558.epi,"Án mạng đau lòng, gia đình tan nát",Báo Người Lao Động,
https://baomoi.com/day-xe-tang-2-nguoi-dan-ong-bi-dien-giat-tu-vong/c/43864153.epi,"Đẩy xe tang, 2 người đàn ông bị điện giật tử vong",Báo Giao Thông,
https://baomoi.com/pho-tong-thong-my-toi-han-quoc-de-tran-an-them-han-gan/c/43861973.epi,"Phó Tổng thống Mỹ tới Hàn Quốc: Để trấn an, thêm hàn gắn",Báo Thế Giới & Việt Nam,
https://baomoi.com/vu-khi-nguy-hiem-doi-voi-eu/c/43858012.epi,'Vũ khí' nguy hiểm đối với EU,Báo Tin Tức TTXVN,
https://baomoi.com/cai-to-hoi-dong-bao-an-lien-hop-quoc-khi-xu-the-cung-chinh-la-diem-nghen/c/43857738.epi,Cải tổ Hội đồng Bảo an Liên hợp quốc: Khi xu thế cũng chính là điểm nghẽn,Báo An Ninh Thế Giới,
https://baomoi.com/van-bai-nang-luong-cua-nga-o-chau-a-trong-boi-canh-xung-dot-ukraine/c/43856483.epi,Ván bài năng lượng của Nga ở châu Á trong bối cảnh xung đột Ukraine,Báo VOV,
https://baomoi.com/ai-duoc-huong-loi-tu-kich-ban-dong-chay-phuong-bac-bi-pha-hoai/c/43854709.epi,Ai được hưởng lợi từ kịch bản Dòng chảy phương Bắc bị phá hoại?,Báo VOV,
https://baomoi.com/tac-dong-toan-cau-sau-khi-fed-tang-lai-suat-len-cao-nhat-tu-nam-2008/c/43851284.epi,Tác động toàn cầu sau khi FED tăng lãi suất lên cao nhất từ năm 2008,Báo Tin Tức TTXVN,
https://baomoi.com/nguoi-phu-nu-khien-ca-chau-au-lo-lang/c/43847833.epi,Người phụ nữ khiến cả châu Âu lo lắng,Tạp chí Tri Thức Trực Tuyến,
https://baomoi.com/chinh-phu-moi-o-italy-se-tac-dong-the-nao-voi-eu-va-cuoc-xung-dot-nga-ukraine/c/43845884.epi,Chính phủ mới ở Italy sẽ tác động thế nào với EU và cuộc xung đột Nga - Ukraine?,Báo Tin Tức TTXVN,
https://baomoi.com/thuc-day-van-dong-cong-dong-chung-tay-ho-tro-phu-nu/c/43872077.epi,"Thúc đẩy, vận động cộng đồng chung tay hỗ trợ phụ nữ",Báo Nhân Dân,2022-09-30T15:04:00+07:00
https://baomoi.com/thi-truong-du-lich-chau-a-soi-dong-manh-sau-tin-hieu-tu-nhat-ban-dai-loan-va-hong-kong/c/43871537.epi,"Thị trường du lịch châu Á sôi động mạnh sau tín hiệu từ Nhật Bản, Đài Loan và Hong Kong",Báo Tổ Quốc,2022-09-30T14:22:00+07:00
https://baomoi.com/ra-mat-sach-tho-cua-nha-tho-mai-van-phan-tai-azerbaijan/c/43872799.epi,Ra mắt sách thơ của nhà thơ Mai Văn Phấn tại Azerbaijan,Báo VietnamPlus,2022-09-30T14:55:00+07:00
https://baomoi.com/thuy-diem-anh-thanh-rat-ngoan/c/43871510.epi,Thúy Diễm: 'Anh Thành rất ngoan',Báo Đại Đoàn Kết,2022-09-30T14:19:00+07:00
https://baomoi.com/dieu-gi-dua-ta-vao-dai-hoc/c/43871227.epi,Điều gì đưa ta vào đại học,Tạp chí Tri Thức Trực Tuyến,2022-09-30T14:15:35+07:00
https://baomoi.com/phu-nhan-co-luat-su-phan-anh-qua-doi/c/43870586.epi,Phu nhân cố Luật sư Phan Anh qua đời,Báo Đại Đoàn Kết,2022-09-30T12:15:00+07:00
https://baomoi.com/thu-hoi-lo-thuoc-vien-nen-levosum/c/43871618.epi,Thu hồi lô thuốc viên nén Levosum,Tạp chí Gia Đình Việt Nam,2022-09-30T14:30:00+07:00
https://baomoi.com/nghe-an-them-4-nguoi-bi-lu-cuon-troi/c/43869604.epi,Nghệ An: Thêm 4 người bị lũ cuốn trôi,Báo Công An Nhân Dân,2022-09-30T09:51:00+07:00
https://baomoi.com/theo-dau-thuong-luong-nhung-chuyen-chua-ke-ve-loai-rua-moi-noi-goi-moi-kieu/c/43869086.epi,Theo dấu 'thuồng luồng': Những chuyện chưa kể về loài rùa 'mỗi nơi gọi mỗi kiểu',Báo VTC News,2022-09-30T09:58:00+07:00
https://baomoi.com/vu-chinh-cong-khai-len-an-doan-phim-truong-nguyet-tan-minh-vi-bach-loc/c/43870613.epi,Vu Chính công khai lên án đoàn phim Trường Nguyệt Tẫn Minh vì Bạch Lộc,Tạp chí SaoStar,2022-09-30T12:30:00+07:00
https://baomoi.com/park-min-young-thong-bao-chia-tay-ban-trai-tap-trung-dong-phim/c/43870526.epi,"Park Min Young thông báo chia tay bạn trai, tập trung đóng phim",Báo Thế Giới & Việt Nam,2022-09-30T12:08:00+07:00
https://baomoi.com/han-quoc-dat-muc-tieu-chiem-12-thi-phan-xe-dien-toan-cau/c/43871769.epi,Hàn Quốc đặt mục tiêu chiếm 12% thị phần xe điện toàn cầu,VietTimes,2022-09-30T14:37:00+07:00
https://baomoi.com/vi-sao-578-duoc-lua-chon-dai-dien-phim-viet-tranh-giai-oscar-2022/c/43870593.epi,Vì sao '578' được lựa chọn đại diện phim Việt tranh giải Oscar 2022?,Báo An Ninh Thủ Đô,2022-09-30T12:18:58+07:00
https://baomoi.com/quoc-lo-1a-qua-nghe-an-ha-tinh-bi-nuoc-lu-chia-cat/c/43868501.epi,"Quốc lộ 1A qua Nghệ An, Hà Tĩnh bị nước lũ chia cắt",Báo Quân Đội Nhân Dân,2022-09-30T09:23:00+07:00
https://baomoi.com/syria-no-luc-giai-quyet-cuoc-khung-hoang-nang-luong-nghiem-trong/c/43871200.epi,Syria nỗ lực giải quyết cuộc khủng hoảng năng lượng nghiêm trọng,Báo VietnamPlus,2022-09-30T13:45:00+07:00
https://baomoi.com/buc-xuc-canh-chu-re-bi-do-dau-phu-thoi-len-nguoi-trong-ngay-cuoi/c/43869970.epi,Bức xúc cảnh chú rể bị đổ đậu phụ thối lên người trong ngày cưới,Tạp chí Người Đưa Tin,2022-09-30T11:10:00+07:00
https://baomoi.com/the-kho-cua-eu-ve-trung-phat-hungary/c/43869197.epi,Thế khó của EU về trừng phạt Hungary,Báo Tin Tức TTXVN,2022-09-30T09:58:00+07:00
https://baomoi.com/nang-kim-ngach-hai-chieu-viet-nam-cuba-len-500-trieu-usd/c/43870554.epi,Nâng kim ngạch hai chiều Việt Nam - Cuba lên 500 triệu USD,Tạp chí Tri Thức Trực Tuyến,2022-09-30T12:34:11+07:00
https://baomoi.com/google-khai-tu-dich-vu-stream-game-truc-tuyen-stadia/c/43871636.epi,Google 'khai tử' dịch vụ stream game trực tuyến Stadia,Báo Nhân Dân,2022-09-30T14:34:00+07:00
https://baomoi.com/chau-gia-kiet-tiet-lo-se-len-xe-hoa-vao-cuoi-nam-nay/c/43870943.epi,Châu Gia Kiệt tiết lộ sẽ lên xe hoa vào cuối năm nay,Báo Phụ Nữ Việt Nam,2022-09-30T13:08:00+07:00
https://baomoi.com/hai-anh-em-ngoi-tu-vi-chem-nguoi-boc-phot-tren-mang-xa-hoi/c/43873379.epi,Hai anh em ngồi tù vì chém người 'bóc phốt' trên mạng xã hội,Báo Bảo Vệ Pháp Luật,2022-09-30T11:59:00+07:00
https://baomoi.com/truy-na-chu-cau-lac-bo-chua-chap-hon-100-nguoi-su-dung-ma-tuy-o-ca-mau/c/43870087.epi,Truy nã chủ câu lạc bộ chứa chấp hơn 100 người sử dụng ma túy ở Cà Mau,Báo Giao Thông,2022-09-30T11:09:00+07:00
https://baomoi.com/sat-canh-cung-nhan-dan-khac-phuc-thiet-hai-sau-bao-so-4/c/43872050.epi,Sát cánh cùng nhân dân khắc phục thiệt hại sau bão số 4,Báo Biên phòng,2022-09-30T14:59:00+07:00
https://baomoi.com/cac-bo-truong-quoc-phong-my-nhat-australia-nhom-hop-tai-hawaii/c/43870329.epi,"Các bộ trưởng quốc phòng Mỹ, Nhật, Australia nhóm họp tại Hawaii",Báo VietnamPlus,2022-09-30T11:32:00+07:00
https://baomoi.com/dan-van-phong-hoc-mua-ballet-sau-gio-lam/c/43868642.epi,Dân văn phòng học múa ballet sau giờ làm,Tạp chí Tri Thức Trực Tuyến,2022-09-30T09:47:47+07:00
https://baomoi.com/can-tho-cong-ty-dat-xanh-mien-tay-bi-tuyt-coi-vi-quang-cao-sai-su-that/c/43871829.epi,Cần Thơ: Công ty Đất Xanh Miền Tây bị 'tuýt còi' vì quảng cáo sai sự thật,Bảo Vệ Công Lý,2022-09-30T14:50:00+07:00
https://baomoi.com/tan-hoa-hau-ban-mai-dap-tra-tin-don-thien-vi-khi-dang-quang-miss-peace-vietnam/c/43871450.epi,Tân hoa hậu Ban Mai đáp trả tin đồn thiên vị khi đăng quang Miss Peace Vietnam,Tạp chí SaoStar,2022-09-30T14:18:00+07:00
https://baomoi.com/tho-nhi-ky-keu-goi-nga-gia-han-thoa-thuan-dam-bao-xuat-khau-ngu-coc/c/43869074.epi,Thổ Nhĩ Kỳ kêu gọi Nga gia hạn thỏa thuận đảm bảo xuất khẩu ngũ cốc,Báo VietnamPlus,2022-09-30T09:39:00+07:00
https://baomoi.com/thuy-dien-dai-binh-chua-du-dieu-kien-cho-phep-tich-nuoc-chay-thu-thiet-bi/c/43870959.epi,"Thủy điện Đại Bình chưa đủ điều kiện cho phép tích nước, chạy thử thiết bị",Báo Đầu Tư,2022-09-30T13:13:00+07:00
https://baomoi.com/nen-kinh-te-toan-cau-se-quay-cuong-voi-lai-suat-tang-cao/c/43869608.epi,Nền kinh tế toàn cầu sẽ quay cuồng với lãi suất tăng cao,Báo Đầu Tư Chứng Khoán,2022-09-30T10:48:59+07:00
https://baomoi.com/ha-noi-cong-lang-mot-net-van-hoa-can-duoc-giu-gin/c/43870921.epi,Hà Nội: Cổng làng – Một nét văn hóa cần được giữ gìn,Báo Xây Dựng,2022-09-30T13:16:00+07:00
https://baomoi.com/mu-co-the-khong-gia-han-voi-de-gea-se-ban-de-mua-oblak/c/43869402.epi,"MU có thể không gia hạn với De Gea, sẽ bán để mua Oblak",Tạp chí Người Đưa Tin,2022-09-30T10:15:00+07:00
https://baomoi.com/nhung-mau-xe-co-thiet-ke-ky-la-nhat-tung-duoc-san-xuat/c/43870991.epi,Những mẫu xe có thiết kế kỳ lạ nhất từng được sản xuất,Xe Giao Thông,2022-09-30T13:30:00+07:00
https://baomoi.com/engfa-waraha-ung-cu-vien-sang-gia-cho-vi-tri-ke-nhiem-hoa-hau-thuy-tien/c/43870737.epi,Engfa Waraha: Ứng cử viên sáng giá cho vị trí kế nhiệm Hoa hậu Thùy Tiên,Báo Phụ Nữ Việt Nam,2022-09-30T12:51:00+07:00
https://baomoi.com/nuoc-ngap-vao-nha-dan-xa-quang-thai-moi-khi-mua-lon-keo-dai/c/43871250.epi,Nước ngập vào nhà dân xã Quảng Thái mỗi khi mưa lớn kéo dài,Báo Giáo Dục & Thời Đại,2022-09-30T13:56:00+07:00
https://baomoi.com/hai-du-an-benh-vien-viet-duc-va-bach-mai-tai-ha-nam-khong-con-du-dieu-kien-bo-tri-von/c/43868825.epi,Hai dự án bệnh viện Việt Đức và Bạch Mai tại Hà Nam không còn đủ điều kiện bố trí vốn,Báo An Ninh Thủ Đô,2022-09-30T09:41:13+07:00
https://baomoi.com/nguyen-hieu-truong-truong-cao-dang-nghe-va-dong-pham-gay-that-thoat-hon-7-ti-dong/c/43870750.epi,Nguyên Hiệu trưởng Trường Cao đẳng nghề và đồng phạm gây thất thoát hơn 7 tỉ đồng,Báo Công Lý,2022-09-30T11:24:00+07:00
https://baomoi.com/tam-ban-do-vo-dua-giup-thang-hoa-chon-phong-the/c/43868874.epi,Tấm bản đồ vợ đưa giúp thăng hoa chốn phòng the,Tạp chí Gia Đình Việt Nam,2022-09-30T09:47:00+07:00
https://baomoi.com/nsnd-bach-tuyet-thay-dieu-hien-ngay-cang-khoe-ra-nhu-vay-toi-mung-lam/c/43870035.epi,"NSND Bạch Tuyết: 'Thấy Diệu Hiền ngày càng khỏe ra như vậy, tôi mừng lắm'",Báo Phụ Nữ Việt Nam,2022-09-30T11:07:00+07:00
https://baomoi.com/nhieu-vung-tan-hoang-sau-khi-bao-ian-can-quet/c/43868817.epi,Nhiều vùng tan hoang sau khi bão Ian càn quét,Tạp chí Tri Thức Trực Tuyến,2022-09-30T10:02:04+07:00
https://baomoi.com/bo-tai-chinh-noi-gi-ve-de-xuat-mien-toan-bo-thue-tieu-thu-dac-biet-voi-xang/c/43870219.epi,Bộ Tài chính nói gì về đề xuất miễn toàn bộ thuế tiêu thụ đặc biệt với xăng?,Tạp chí Một Thế Giới,2022-09-30T11:29:00+07:00
https://baomoi.com/am-anh-ly-do-khien-nguoi-dan-ong-chuyen-di-an-trom-ao-mua-phu-nu/c/43869136.epi,Ám ảnh lý do khiến người đàn ông chuyên đi ăn trộm áo mưa phụ nữ,Báo Infonet,2022-09-30T10:13:00+07:00
https://baomoi.com/thu-hoi-toan-quoc-thuoc-dung-dich-uong-batiwell/c/43869730.epi,Thu hồi toàn quốc thuốc dung dịch uống Batiwell,Tạp chí Gia Đình Việt Nam,2022-09-30T10:59:00+07:00
https://baomoi.com/thanh-cong-tu-phuong-cham-4-tai-cho/c/43872048.epi,Thành công từ phương châm '4 tại chỗ',Báo Biên phòng,2022-09-30T14:59:00+07:00
https://baomoi.com/cach-phong-tranh-6-can-benh-thuong-gap-trong-mua-mua-bao/c/43869526.epi,Cách phòng tránh 6 căn bệnh thường gặp trong mùa mưa bão,Báo Giáo Dục & Thời Đại,2022-09-30T10:24:00+07:00
https://baomoi.com/co-1-nu-chinh-mang-ten-jennie-blackpink-trong-lang-giai-tri-han-voi-cuoc-doi-tua-cuon-tieu-thuyet/c/43870337.epi,Có 1 nữ chính mang tên Jennie (BLACKPINK) trong làng giải trí Hàn với cuộc đời tựa cuốn tiểu thuyết,Báo Tổ Quốc,2022-09-30T11:49:00+07:00
https://baomoi.com/loat-cau-noi-triet-ly-tinh-yeu-cua-huong-giang-nghe-cuc-tham/c/43871996.epi,Loạt câu nói triết lý tình yêu của Hương Giang nghe cực thấm,Tạp chí SaoStar,2022-09-30T15:00:00+07:00
https://baomoi.com/tp-hcm-se-thi-tuyen-lanh-dao-quan-ly-o-nhung-vi-tri-nao/c/43869810.epi,"TP.HCM sẽ thi tuyển lãnh đạo, quản lý ở những vị trí nào?",Báo Pháp Luật TP.HCM,2022-09-30T11:01:45+07:00
https://baomoi.com/litva-tang-ngan-sach-quoc-phong-de-mua-himars-may-bay-khong-nguoi-lai/c/43869203.epi,"Litva tăng ngân sách quốc phòng để mua HIMARS, máy bay không người lái",Báo Tin Tức TTXVN,2022-09-30T10:16:00+07:00
https://baomoi.com/nghi-van-doi-gia-trang-thiet-bi-tai-ca-mau/c/43869275.epi,"Nghi vấn, đội giá trang thiết bị tại Cà Mau",Tài Chính Doanh Nghiệp,2022-09-30T10:19:00+07:00
https://baomoi.com/nghe-an-hoan-luu-bao-so-4-khien-nhieu-tuyen-duong-sat-lo-ngap-chia-cat/c/43869681.epi,"Nghệ An: Hoàn lưu bão số 4 khiến nhiều tuyến đường sạt lở, ngập chia cắt",Tạp Chí Giao Thông Vận Tải,2022-09-30T10:47:00+07:00
https://baomoi.com/ngan-hang-trung-uong-mexico-tang-lai-suat-len-muc-chua-tung-co/c/43870539.epi,Ngân hàng Trung ương Mexico tăng lãi suất lên mức chưa từng có,Tài Chính Doanh Nghiệp,2022-09-30T11:55:00+07:00
https://baomoi.com/dung-dau-tre-em-va-loat-bi-quyet-giup-vera-wang-tre-trung-o-tuoi-73/c/43870986.epi,Dùng dầu trẻ em và loạt bí quyết giúp Vera Wang trẻ trung ở tuổi 73,Tạp chí SaoStar,2022-09-30T13:30:00+07:00
https://baomoi.com/tau-san-bay-ins-vikrant-an-do-su-lang-phi-hay-buoc-dem-dung-dan/c/43869552.epi,Tàu sân bay INS Vikrant Ấn Độ: Sự lãng phí hay bước đệm đúng đắn?,Báo An Ninh Thủ Đô,2022-09-30T10:40:56+07:00
https://baomoi.com/my-ap-dat-cac-lenh-trung-phat-moi-lien-quan-hoat-dong-xuat-khau-dau-mo-cua-iran/c/43869196.epi,Mỹ áp đặt các lệnh trừng phạt mới liên quan hoạt động xuất khẩu dầu mỏ của Iran,Báo Tin Tức TTXVN,2022-09-30T09:53:00+07:00
https://baomoi.com/apple-chiem-80-loi-nhuan-toan-nganh-smartphone/c/43868641.epi,Apple chiếm 80% lợi nhuận toàn ngành smartphone,Tạp chí Tri Thức Trực Tuyến,2022-09-30T09:47:43+07:00
https://baomoi.com/2-nam-an-chay-nam-ca-si-khoe-co-bap-cuon-cuon-ve-ngoai-lao-hoa-nguoc-khien-h-hen-nie-phai-cam-than/c/43870805.epi,"2 năm ăn chay, nam ca sĩ khoe cơ bắp cuồn cuộn, vẻ ngoài lão hóa ngược khiến H'Hen Niê phải cảm thán",Tạp chí SaoStar,2022-09-30T13:00:00+07:00
https://baomoi.com/ngoi-nha-khac-la-boi-phong-cach-indochine/c/43869298.epi,Ngôi nhà khác lạ bởi phong cách Indochine,Báo Pháp Luật TP.HCM,2022-09-30T10:00:00+07:00
https://baomoi.com/nha-uyen-trong-dem-toi-ruc-ro-dien-vien-xau-van-co-co-hoi-thanh-cong/c/43869685.epi,Nhã Uyên trong 'Đêm tối rực rỡ': Diễn viên 'xấu' vẫn có cơ hội thành công,Tạp chí Một Thế Giới,2022-09-30T10:52:00+07:00
https://baomoi.com/mui-dien-noi-binh-minh-bat-dau/c/43870448.epi,Mũi Điện - Nơi bình minh bắt đầu,Báo Giáo Dục & Thời Đại,2022-09-30T11:50:00+07:00
https://baomoi.com/tu-van-tam-ly-hoc-duong-bo-vo-tim-noi-trut-bau-tam-su/c/43869252.epi,Tư vấn tâm lý học đường: 'Bơ vơ' tìm nơi… trút bầu tâm sự,Báo Giáo Dục & Thời Đại,2022-09-30T10:05:00+07:00
https://baomoi.com/giao-dich-giua-nhan-dan-te-va-dong-ruble-du-kien-vuot-usd-trong-nam-2023/c/43870090.epi,Giao dịch giữa nhân dân tệ và đồng ruble dự kiến vượt USD trong năm 2023,Báo VOV,2022-09-30T11:26:00+07:00
https://baomoi.com/kich-ban-phim-moi-cua-song-joong-ki-cuc-nhieu-drama-nhung-co-vuot-duoc-cai-bong-cua-vincenzo/c/43871998.epi,Kịch bản phim mới của Song Joong Ki cực nhiều 'drama' nhưng có vượt được cái bóng của Vincenzo?,Tạp chí SaoStar,2022-09-30T15:00:00+07:00
https://baomoi.com/nhung-nuoc-dong-nam-a-nao-muon-mua-may-bay-khong-nguoi-lai-cua-tho-nhi-ky/c/43868691.epi,Những nước Đông Nam Á nào muốn mua máy bay không người lái của Thổ Nhĩ Kỳ?,Báo Tin Tức TTXVN,2022-09-30T09:26:00+07:00
https://baomoi.com/dan-sao-hollywood-hoi-tu-tai-su-kien-tudum-netflix-he-lo-loat-sieu-pham-dang-mong-doi/c/43868625.epi,"Dàn sao Hollywood hội tụ tại sự kiện Tudum Netflix, hé lộ loạt siêu phẩm đáng mong đợi",Báo Hoa Học Trò,2022-09-30T09:30:01+07:00
https://baomoi.com/hyun-bin-cuoi-son-ye-jin-xong-khong-con-noi-tieng-nhu-truoc-phim-moi-quang-ba-bi-flop/c/43869168.epi,"Hyun Bin cưới Son Ye Jin xong không còn nổi tiếng như trước, phim mới quảng bá bị 'flop'?",Tạp chí SaoStar,2022-09-30T10:14:00+07:00
https://baomoi.com/ford-bat-dau-xay-dung-nha-may-o-to-lon-nhat-tu-truoc-den-nay/c/43870528.epi,Ford bắt đầu xây dựng Nhà máy ô tô lớn nhất từ trước đến nay,Cartimes,2022-09-30T12:00:00+07:00
https://baomoi.com/bo-tay-cua-canada-co-vai-tro-the-nao-tren-thi-truong-lng-the-gioi/c/43869564.epi,Bờ Tây của Canada có vai trò thế nào trên thị trường LNG thế giới?,Bnews,2022-09-30T10:45:00+07:00
https://baomoi.com/su-ra-doi-cua-metoo/c/43863646.epi,Sự ra đời của #MeToo,Tạp chí Tri Thức Trực Tuyến,2022-09-30T10:54:02+07:00
https://baomoi.com/cuon-sach-phoi-bay-bi-mat-xau-xi-cua-vo-chong-harry-meghan/c/43868629.epi,Cuốn sách phơi bày bí mật xấu xí của vợ chồng Harry - Meghan,Báo Tiền Phong,2022-09-30T09:28:00+07:00
https://baomoi.com/o-to-xep-hang-dai-xe-may-tranh-via-he-voi-nguoi-di-bo-tren-duong-pho-ha-noi/c/43868764.epi,"Ô tô xếp hàng dài, xe máy tranh vỉa hè với người đi bộ trên đường phố Hà Nội",Báo VietnamNet,2022-09-30T09:40:00+07:00
https://baomoi.com/chua-co-trong-quy-hoach-su-dung-dat-cong-trinh-dien-mat-troi-van-moc-len/c/43869221.epi,"Chưa có trong quy hoạch sử dụng đất, công trình điện mặt trời vẫn 'mọc' lên",Báo Đầu Tư,2022-09-30T10:16:00+07:00
https://baomoi.com/diem-chung-bat-ngo-cua-ba-co-dau-thang-10-dieu-nhi-lieu-ha-trinh-phuong-nga/c/43869739.epi,Điểm chung bất ngờ của ba 'cô dâu tháng 10' Diệu Nhi - Liêu Hà Trinh - Phương Nga,Tạp chí SaoStar,2022-09-30T11:00:00+07:00
https://baomoi.com/pho-thu-tuong-vu-duc-dam-lam-viec-ve-de-an-so-06-tai-thai-nguyen/c/43869492.epi,Phó Thủ tướng Vũ Đức Đam làm việc về Đề án số 06 tại Thái Nguyên,Báo Xây Dựng,2022-09-30T10:38:00+07:00
https://baomoi.com/phau-thuat-thanh-cong-cho-benh-nhan-gay-xuong-don-vai-va-co-khoi-u-tuyen-giap-khong-lo/c/43872163.epi,Phẫu thuật thành công cho bệnh nhân gãy xương đòn vai và có khối u tuyến giáp khổng lồ,Báo Công Lý - Chuyên Trang Công Lý & Xã Hội,2022-09-30T14:44:00+07:00
https://baomoi.com/bi-lam-phat-thang-9-2022-tang-len-muc-cao-nhat-trong-47-nam/c/43870548.epi,Bỉ: Lạm phát tháng 9/2022 tăng lên mức cao nhất trong 47 năm,Báo Tin Tức TTXVN,2022-09-30T12:10:00+07:00
https://baomoi.com/huong-dan-ve-sinh-ca-nhan-ve-sinh-moi-truong-va-xu-ly-nuoc-an-uong-mua-bao-lu/c/43870815.epi,"Hướng dẫn vệ sinh cá nhân, vệ sinh môi trường và xử lý nước ăn uống mùa bão lũ",Báo Sức Khỏe & Đời Sống,2022-09-30T13:02:00+07:00
https://baomoi.com/dem-cuoi-cung-damascus-la-la-ma/c/43869140.epi,Đêm cuối cùng Damascus là La Mã,Báo An Ninh Thế Giới,2022-09-30T10:05:00+07:00
https://baomoi.com/apple-bao-tin-cho-hon-12-quan-chuc-indonesia-dung-iphone-bi-phan-mem-gian-diep-de-doa/c/43869314.epi,Apple báo tin cho hơn 12 quan chức Indonesia dùng iPhone bị phần mềm gián điệp đe dọa,Tạp chí Một Thế Giới,2022-09-30T10:24:00+07:00
